fuckcqcs,HTML,4500,857,,2,2018-07-22T14:33:12Z,9808,14小时,https://github.com/fuckcqcs/fuckcqcs,https://api.github.com/repos/fuckcqcs/fuckcqcs/languages
kompose,Go,4500,367,apache-2.0,41,2016-06-27T21:08:18Z,21269,Go from Docker Compose to Kubernetes,https://github.com/kubernetes/kompose,https://api.github.com/repos/kubernetes/kompose/languages
koin,Kotlin,4498,279,apache-2.0,89,2017-06-06T12:21:06Z,75789,KOIN - a pragmatic lightweight dependency injection framework for Kotlin,https://github.com/InsertKoinIO/koin,https://api.github.com/repos/InsertKoinIO/koin/languages
bootstrap-fileinput,JavaScript,4498,2139,other,10,2014-03-02T09:52:16Z,13191,"An enhanced HTML 5 file input for Bootstrap 3.x with file preview, multiple selection, and more features.",https://github.com/kartik-v/bootstrap-fileinput,https://api.github.com/repos/kartik-v/bootstrap-fileinput/languages
ffmpeg-libav-tutorial,C,4497,314,bsd-3-clause,12,2017-11-06T23:40:18Z,2483,"FFmpeg libav tutorial - learn how media works from basic to transmuxing, transcoding and more",https://github.com/leandromoreira/ffmpeg-libav-tutorial,https://api.github.com/repos/leandromoreira/ffmpeg-libav-tutorial/languages
pdfs,HTML,4497,740,,1,2014-06-16T00:55:23Z,2096293,"Technically-oriented PDF Collection (Papers, Specs, Decks, Manuals, etc)",https://github.com/tpn/pdfs,https://api.github.com/repos/tpn/pdfs/languages
gperftools,C++,4496,978,bsd-3-clause,222,2014-01-28T11:15:07Z,3582,Main gperftools repository,https://github.com/gperftools/gperftools,https://api.github.com/repos/gperftools/gperftools/languages
git-ftp,Shell,4496,601,gpl-3.0,122,2013-04-17T06:54:46Z,2716,Uses Git to upload only changed files to FTP servers.,https://github.com/git-ftp/git-ftp,https://api.github.com/repos/git-ftp/git-ftp/languages
react-native-video,Java,4496,1558,mit,672,2015-03-31T05:08:38Z,12766,A <Video /> component for react-native,https://github.com/react-native-community/react-native-video,https://api.github.com/repos/react-native-community/react-native-video/languages
passenger,C++,4493,506,mit,172,2008-03-27T23:40:48Z,50323,"A fast and robust web server and application server for Ruby, Python and Node.js",https://github.com/phusion/passenger,https://api.github.com/repos/phusion/passenger/languages
snowflake,JavaScript,4493,644,mit,17,2015-12-04T18:34:22Z,30278,":snowflake: A React-Native Android iOS Starter App/ BoilerPlate / Example with Redux, RN Router,  & Jest with the Snowflake Hapi Server running locally or on RedHat OpenShift for the backend, or a Parse Server running locally or remotely on Heroku",https://github.com/bartonhammond/snowflake,https://api.github.com/repos/bartonhammond/snowflake/languages
lz4,C,4491,745,other,22,2014-03-25T15:52:21Z,5035,Extremely Fast Compression algorithm,https://github.com/lz4/lz4,https://api.github.com/repos/lz4/lz4/languages
semver,null,4491,498,,101,2011-05-29T23:10:40Z,80,Semantic Versioning Specification,https://github.com/semver/semver,https://api.github.com/repos/semver/semver/languages
balloon.css,CSS,4490,444,mit,6,2016-03-01T17:52:58Z,1166,Simple tooltips made of pure CSS,https://github.com/kazzkiq/balloon.css,https://api.github.com/repos/kazzkiq/balloon.css/languages
RustPython,Rust,4489,311,mit,97,2018-05-28T19:27:01Z,30187,A Python Interpreter written in Rust,https://github.com/RustPython/RustPython,https://api.github.com/repos/RustPython/RustPython/languages
react-native-material-kit,TypeScript,4489,565,mit,155,2015-07-01T12:33:24Z,1646,Bringing Material Design to React Native,https://github.com/xinthink/react-native-material-kit,https://api.github.com/repos/xinthink/react-native-material-kit/languages
SwiftyBeaver,Swift,4489,330,mit,1,2015-11-28T14:08:37Z,2334,"Convenient & secure logging during development & release in Swift 3, 4 & 5",https://github.com/SwiftyBeaver/SwiftyBeaver,https://api.github.com/repos/SwiftyBeaver/SwiftyBeaver/languages
8cc,C,4488,535,mit,35,2012-02-28T06:01:01Z,1339,A Small C Compiler,https://github.com/rui314/8cc,https://api.github.com/repos/rui314/8cc/languages
mysql-server,C++,4488,1756,other,1,2014-09-26T09:31:03Z,2761706,"MySQL Server, the world's most popular open source database, and MySQL Cluster, a real-time, open source transactional database.",https://github.com/mysql/mysql-server,https://api.github.com/repos/mysql/mysql-server/languages
cancancan,Ruby,4487,429,mit,23,2014-02-19T18:26:23Z,1271,The authorization Gem for Ruby on Rails.,https://github.com/CanCanCommunity/cancancan,https://api.github.com/repos/CanCanCommunity/cancancan/languages
jPlayer,JavaScript,4486,1465,other,153,2010-02-17T04:44:34Z,3802,jPlayer : HTML5 Audio & Video for jQuery,https://github.com/jplayer/jPlayer,https://api.github.com/repos/jplayer/jPlayer/languages
jstree,JavaScript,4485,1258,mit,12,2009-10-28T23:59:02Z,13309,jquery tree plugin,https://github.com/vakata/jstree,https://api.github.com/repos/vakata/jstree/languages
useful-java-links,Java,4485,948,other,6,2016-02-13T13:14:52Z,2068,"A list of useful Java frameworks, libraries, software and hello worlds examples",https://github.com/Vedenin/useful-java-links,https://api.github.com/repos/Vedenin/useful-java-links/languages
pyston,Python,4484,302,other,110,2014-04-01T07:17:20Z,41022,An open-source Python implementation using JIT techniques. ,https://github.com/dropbox/pyston,https://api.github.com/repos/dropbox/pyston/languages
debugger,JavaScript,4484,853,mpl-2.0,241,2016-03-23T18:55:36Z,34515,The Firefox debugger that works anywhere  :boom:,https://github.com/firefox-devtools/debugger,https://api.github.com/repos/firefox-devtools/debugger/languages
MagicCamera,Java,4483,1412,,92,2016-01-08T11:36:56Z,17476,Real-time Filter Camera&VideoRecorder And ImageEditor With Face Beauty For Android---包含美颜等40余种实时滤镜相机，可拍照、录像、图片修改,https://github.com/wuhaoyu1990/MagicCamera,https://api.github.com/repos/wuhaoyu1990/MagicCamera/languages
cron-expression,PHP,4484,266,mit,10,2011-04-20T15:48:27Z,197,CRON for PHP: Calculate the next or previous run date and determine if a CRON expression is due,https://github.com/mtdowling/cron-expression,https://api.github.com/repos/mtdowling/cron-expression/languages
mruby,C,4481,683,mit,175,2012-04-19T09:11:15Z,13015,Lightweight Ruby,https://github.com/mruby/mruby,https://api.github.com/repos/mruby/mruby/languages
TermKit,JavaScript,4481,261,other,36,2010-07-21T22:08:27Z,49615,"Experimental Terminal platform built on WebKit + node.js. Currently only for Mac and Windows, though the prototype works 90% in any WebKit browser.",https://github.com/unconed/TermKit,https://api.github.com/repos/unconed/TermKit/languages
react-native-paper,TypeScript,4481,600,mit,108,2016-10-19T05:56:53Z,68971,Material Design for React Native (Android & iOS),https://github.com/callstack/react-native-paper,https://api.github.com/repos/callstack/react-native-paper/languages
ardupilot,C++,4481,8471,gpl-3.0,1639,2013-01-09T00:58:52Z,145837,"ArduPlane, ArduCopter, ArduRover source",https://github.com/ArduPilot/ardupilot,https://api.github.com/repos/ArduPilot/ardupilot/languages
camerakit-android,Java,4480,717,mit,118,2016-11-27T19:29:43Z,21842,Library for Android Camera 1 and 2 APIs. Massively increase stability and reliability of photo and video capture on all Android devices.,https://github.com/CameraKit/camerakit-android,https://api.github.com/repos/CameraKit/camerakit-android/languages
bitwise,C,4478,151,other,18,2018-03-10T04:49:11Z,1005,Bitwise is an educational project where we create the software/hardware stack for a computer from scratch.,https://github.com/pervognsen/bitwise,https://api.github.com/repos/pervognsen/bitwise/languages
redcarpet,C,4477,498,mit,88,2011-03-24T22:05:14Z,1079,"The safe Markdown parser, reloaded.",https://github.com/vmg/redcarpet,https://api.github.com/repos/vmg/redcarpet/languages
emojione,PHP,4474,572,other,133,2014-08-27T14:41:53Z,451105,[Archived] The world's largest independent emoji font. Maintained at https://github.com/joypixels/emoji-toolkit.,https://github.com/joypixels/emojione,https://api.github.com/repos/joypixels/emojione/languages
Xiaomi_Kernel_OpenSource,null,4474,1728,,533,2014-12-31T02:48:55Z,2318738,Xiaomi Mobile Phone Kernel OpenSource,https://github.com/MiCode/Xiaomi_Kernel_OpenSource,https://api.github.com/repos/MiCode/Xiaomi_Kernel_OpenSource/languages
csslint,JavaScript,4473,529,other,228,2011-06-07T19:17:42Z,4770,Automated linting of Cascading Stylesheets,https://github.com/CSSLint/csslint,https://api.github.com/repos/CSSLint/csslint/languages
elastic,Go,4472,837,mit,35,2012-12-06T17:15:33Z,7948,Elasticsearch client for Go.,https://github.com/olivere/elastic,https://api.github.com/repos/olivere/elastic/languages
golden-layout,JavaScript,4471,376,mit,238,2014-10-05T07:29:06Z,5946,A multi window layout manager for webapps,https://github.com/golden-layout/golden-layout,https://api.github.com/repos/golden-layout/golden-layout/languages
wpscan,Ruby,4470,825,other,17,2012-07-11T20:27:47Z,33944,"WPScan is a free, for non-commercial use, black box WordPress Vulnerability Scanner written for security professionals and blog maintainers to test the security of their WordPress websites.",https://github.com/wpscanteam/wpscan,https://api.github.com/repos/wpscanteam/wpscan/languages
proposal-optional-chaining,HTML,4468,62,,13,2017-03-09T03:09:55Z,183,null,https://github.com/tc39/proposal-optional-chaining,https://api.github.com/repos/tc39/proposal-optional-chaining/languages
node-config,JavaScript,4468,387,other,65,2010-12-02T00:33:11Z,2375,Node.js Application Configuration,https://github.com/lorenwest/node-config,https://api.github.com/repos/lorenwest/node-config/languages
clash,Go,4467,597,gpl-3.0,77,2018-06-10T14:28:14Z,519,A rule-based tunnel in Go.,https://github.com/Dreamacro/clash,https://api.github.com/repos/Dreamacro/clash/languages
django-extensions,Python,4466,919,mit,71,2009-03-21T16:11:19Z,3401,This is a repository for collecting global custom management extensions for the Django Framework. ,https://github.com/django-extensions/django-extensions,https://api.github.com/repos/django-extensions/django-extensions/languages
caprover,TypeScript,4465,291,other,37,2017-10-25T05:00:43Z,38909,[previously CaptainDuckDuck] Automated Scalable PaaS Package (automated Docker+nginx) - Heroku on Steroids,https://github.com/caprover/caprover,https://api.github.com/repos/caprover/caprover/languages
wallabag,PHP,4465,515,mit,411,2013-04-03T12:21:14Z,64878,wallabag is a self hostable application for saving web pages: Save and classify articles. Read them later. Freely.,https://github.com/wallabag/wallabag,https://api.github.com/repos/wallabag/wallabag/languages
DevopsWiki,null,4463,698,mit,9,2015-12-04T13:19:42Z,130,"A wiki of AI, Machine Learning, Robotics, Automation, Devops Tools, Tutorials, Scripts and Datasets",https://github.com/Leo-G/DevopsWiki,https://api.github.com/repos/Leo-G/DevopsWiki/languages
amethyst,Rust,4463,504,other,66,2015-12-21T09:59:29Z,42586,Data-oriented and data-driven game engine written in Rust,https://github.com/amethyst/amethyst,https://api.github.com/repos/amethyst/amethyst/languages
bucklescript,OCaml,4461,323,other,470,2016-01-06T20:34:59Z,468500,A backend for the OCaml compiler which emits JavaScript.,https://github.com/BuckleScript/bucklescript,https://api.github.com/repos/BuckleScript/bucklescript/languages
SoundManager2,JavaScript,4459,828,other,82,2010-01-02T18:34:51Z,27847,"A JavaScript Sound API supporting MP3, MPEG4 and HTML5 audio + RTMP, providing reliable cross-browser/platform audio control in as little as 12 KB. BSD licensed.",https://github.com/scottschiller/SoundManager2,https://api.github.com/repos/scottschiller/SoundManager2/languages
laravel-cors,PHP,4458,411,mit,63,2013-10-16T07:35:54Z,156,Adds CORS (Cross-Origin Resource Sharing) headers support in your Laravel application,https://github.com/barryvdh/laravel-cors,https://api.github.com/repos/barryvdh/laravel-cors/languages
Data-Analysis-and-Machine-Learning-Projects,Jupyter Notebook,4458,1664,,4,2015-02-12T23:03:58Z,20815,"Repository of teaching materials, code, and data for my data analysis and machine learning projects.",https://github.com/rhiever/Data-Analysis-and-Machine-Learning-Projects,https://api.github.com/repos/rhiever/Data-Analysis-and-Machine-Learning-Projects/languages
concourse,Go,4458,547,apache-2.0,659,2014-04-19T20:45:45Z,99088,Concourse is a container-based continuous thing-doer written in Go and Elm.,https://github.com/concourse/concourse,https://api.github.com/repos/concourse/concourse/languages
grin,Rust,4457,879,apache-2.0,120,2016-10-21T00:02:23Z,15888,Minimal implementation of the Mimblewimble protocol.,https://github.com/mimblewimble/grin,https://api.github.com/repos/mimblewimble/grin/languages
doorkeeper,Ruby,4455,890,mit,25,2011-11-18T13:02:01Z,3151,Doorkeeper is an OAuth 2 provider for Ruby on Rails / Grape.,https://github.com/doorkeeper-gem/doorkeeper,https://api.github.com/repos/doorkeeper-gem/doorkeeper/languages
pix2pix-tensorflow,JavaScript,4454,1135,mit,117,2017-01-24T20:17:13Z,13656,Tensorflow port of Image-to-Image Translation with Conditional Adversarial Nets https://phillipi.github.io/pix2pix/,https://github.com/affinelayer/pix2pix-tensorflow,https://api.github.com/repos/affinelayer/pix2pix-tensorflow/languages
ORB_SLAM2,C++,4454,2918,other,608,2016-01-23T19:46:24Z,42427,"Real-Time SLAM for Monocular, Stereo and RGB-D Cameras, with Loop Detection and Relocalization Capabilities",https://github.com/raulmur/ORB_SLAM2,https://api.github.com/repos/raulmur/ORB_SLAM2/languages
retinajs,CSS,4454,659,mit,43,2012-04-04T20:37:09Z,2719,"JavaScript, SCSS, Sass, Less, and Stylus helpers for rendering high-resolution image variants",https://github.com/strues/retinajs,https://api.github.com/repos/strues/retinajs/languages
docker-stacks,Shell,4453,1743,other,65,2015-07-15T15:30:00Z,1783,Ready-to-run Docker images containing Jupyter applications,https://github.com/jupyter/docker-stacks,https://api.github.com/repos/jupyter/docker-stacks/languages
laravel-mongodb,PHP,4452,1041,,474,2013-03-31T14:31:04Z,1603,A MongoDB based Eloquent model and Query builder for Laravel (Moloquent),https://github.com/jenssegers/laravel-mongodb,https://api.github.com/repos/jenssegers/laravel-mongodb/languages
derby,JavaScript,4452,266,,65,2011-04-09T04:29:16Z,1902,"MVC framework making it easy to write realtime, collaborative applications that run in both Node.js and browsers",https://github.com/derbyjs/derby,https://api.github.com/repos/derbyjs/derby/languages
upx,C,4451,540,other,84,2016-08-31T11:23:13Z,58312,UPX - the Ultimate Packer for eXecutables,https://github.com/upx/upx,https://api.github.com/repos/upx/upx/languages
httpstat,Go,4451,233,mit,11,2016-09-23T09:40:41Z,10398,"It's like curl -v, with colours. ",https://github.com/davecheney/httpstat,https://api.github.com/repos/davecheney/httpstat/languages
