2019-Autumn-recruitment-experience,null,1490,343,other,10,2018-07-28T13:20:46Z,105,2019届秋招面经集合,https://github.com/zslomo/2019-Autumn-recruitment-experience,https://api.github.com/repos/zslomo/2019-Autumn-recruitment-experience/languages
Interview-Questions,Java,1490,463,mit,0,2017-10-25T11:08:52Z,1320,"Most comprehensive list :clipboard: of tech interview questions :blue_book: of companies scraped from Geeksforgeeks, CareerCup and Glassdoor. ",https://github.com/rishabh115/Interview-Questions,https://api.github.com/repos/rishabh115/Interview-Questions/languages
open_model_zoo,Python,1490,463,apache-2.0,28,2018-10-15T10:55:02Z,74999,Pre-trained Deep Learning models and samples (high quality and extremely fast),https://github.com/opencv/open_model_zoo,https://api.github.com/repos/opencv/open_model_zoo/languages
Typefont,JavaScript,1490,94,mit,7,2017-04-23T16:05:37Z,1658,The first open-source library that detects the font of a text in a image.,https://github.com/Vasile-Peste/Typefont,https://api.github.com/repos/Vasile-Peste/Typefont/languages
greenkeeper,JavaScript,1490,107,apache-2.0,101,2015-08-16T00:16:58Z,1820,:robot: :palm_tree: Real-time automated dependency updates for npm and GitHub,https://github.com/greenkeeperio/greenkeeper,https://api.github.com/repos/greenkeeperio/greenkeeper/languages
fselect,Rust,1490,33,other,7,2018-01-26T12:17:59Z,513,Find files with SQL-like queries,https://github.com/jhspetersson/fselect,https://api.github.com/repos/jhspetersson/fselect/languages
UEFITool,C++,1490,278,bsd-2-clause,18,2013-10-08T07:05:51Z,2880,UEFI firmware image viewer and editor,https://github.com/LongSoft/UEFITool,https://api.github.com/repos/LongSoft/UEFITool/languages
swift-log,Swift,1489,75,apache-2.0,11,2019-02-11T18:13:17Z,460,A Logging API for Swift,https://github.com/apple/swift-log,https://api.github.com/repos/apple/swift-log/languages
kairosdb,Java,1489,308,apache-2.0,133,2013-02-05T22:27:48Z,47261,Fast scalable time series database,https://github.com/kairosdb/kairosdb,https://api.github.com/repos/kairosdb/kairosdb/languages
amp-wp,PHP,1489,336,gpl-2.0,346,2015-09-22T04:52:15Z,56518,"Enable AMP on your WordPress site, the WordPress way.",https://github.com/ampproject/amp-wp,https://api.github.com/repos/ampproject/amp-wp/languages
smart-location-lib,Java,1489,324,,116,2013-06-13T11:14:18Z,811,Android library project that lets you manage the location updates to be as painless as possible,https://github.com/mrmans0n/smart-location-lib,https://api.github.com/repos/mrmans0n/smart-location-lib/languages
django-admin-bootstrapped,HTML,1489,390,apache-2.0,36,2012-10-23T06:35:27Z,2017,"A Django admin theme using Twitter Bootstrap. It doesn't need any kind of modification on your side, just add it to the installed apps.",https://github.com/django-admin-bootstrapped/django-admin-bootstrapped,https://api.github.com/repos/django-admin-bootstrapped/django-admin-bootstrapped/languages
ArcLayout,Java,1489,232,apache-2.0,7,2016-11-18T14:41:06Z,20651,With Arc Layout explore new styles and approaches on material design,https://github.com/florent37/ArcLayout,https://api.github.com/repos/florent37/ArcLayout/languages
shards-ui,CSS,1489,164,mit,4,2017-11-07T15:43:58Z,1887,🎨Shards is a beautiful & modern Bootstrap 4 UI kit packed with extra templates and components.,https://github.com/DesignRevision/shards-ui,https://api.github.com/repos/DesignRevision/shards-ui/languages
vim-vinegar,Vim script,1489,70,,30,2013-12-24T16:44:31Z,37,vinegar.vim: Combine with netrw to create a delicious salad dressing,https://github.com/tpope/vim-vinegar,https://api.github.com/repos/tpope/vim-vinegar/languages
Diamond,Python,1489,581,mit,219,2013-10-11T23:32:13Z,3842,"Diamond is a python daemon that collects system metrics and publishes them to Graphite (and others). It is capable of collecting cpu, memory, network, i/o, load and disk metrics. Additionally, it features an API for implementing custom collectors for gathering metrics from almost any source.",https://github.com/python-diamond/Diamond,https://api.github.com/repos/python-diamond/Diamond/languages
django-ckeditor,JavaScript,1489,606,other,96,2010-03-08T19:20:59Z,10912,Django admin CKEditor integration.,https://github.com/django-ckeditor/django-ckeditor,https://api.github.com/repos/django-ckeditor/django-ckeditor/languages
pointer-generator,Python,1489,634,apache-2.0,90,2017-04-23T01:24:56Z,74,"Code for the ACL 2017 paper ""Get To The Point: Summarization with Pointer-Generator Networks""",https://github.com/abisee/pointer-generator,https://api.github.com/repos/abisee/pointer-generator/languages
cscs,null,1489,180,mit,5,2015-08-13T13:00:37Z,64,A curated list of Coding Style Conventions and Standards.,https://github.com/SalGnt/cscs,https://api.github.com/repos/SalGnt/cscs/languages
tock,Rust,1489,194,other,76,2015-05-28T09:26:47Z,142135,A secure embedded operating system for microcontrollers,https://github.com/tock/tock,https://api.github.com/repos/tock/tock/languages
CornerNet-Lite,Python,1489,359,bsd-3-clause,88,2019-04-17T17:06:50Z,363,null,https://github.com/princeton-vl/CornerNet-Lite,https://api.github.com/repos/princeton-vl/CornerNet-Lite/languages
Go,Go,1488,373,mit,60,2016-08-20T16:32:12Z,40,Algorithms Implemented in GoLang,https://github.com/TheAlgorithms/Go,https://api.github.com/repos/TheAlgorithms/Go/languages
textdistance,Python,1488,130,mit,1,2017-05-05T08:46:10Z,343,"Compute distance between sequences. 30+ algorithms, pure python implementation, common interface, optional external libs usage.",https://github.com/life4/textdistance,https://api.github.com/repos/life4/textdistance/languages
prettyplotlib,Python,1488,138,mit,11,2013-07-18T14:39:58Z,28686,Painlessly create beautiful matplotlib plots.,https://github.com/olgabot/prettyplotlib,https://api.github.com/repos/olgabot/prettyplotlib/languages
YOLO_v3_tutorial_from_scratch,Python,1488,454,,34,2018-04-10T22:35:38Z,1933,"Accompanying code for Paperspace tutorial series ""How to Implement YOLO v3 Object Detector from Scratch""",https://github.com/ayooshkathuria/YOLO_v3_tutorial_from_scratch,https://api.github.com/repos/ayooshkathuria/YOLO_v3_tutorial_from_scratch/languages
rbtrace,Ruby,1488,60,mit,17,2011-02-10T06:20:11Z,1469,"like strace, but for ruby code",https://github.com/tmm1/rbtrace,https://api.github.com/repos/tmm1/rbtrace/languages
awesome-monorepo,null,1488,70,,2,2017-07-20T12:50:54Z,67,"A curated list of awesome Monorepo tools, software and architectures.",https://github.com/korfuri/awesome-monorepo,https://api.github.com/repos/korfuri/awesome-monorepo/languages
hoverfly,Go,1488,134,apache-2.0,28,2015-11-30T16:36:31Z,70596,Lightweight service virtualization/API simulation tool for developers and testers,https://github.com/SpectoLabs/hoverfly,https://api.github.com/repos/SpectoLabs/hoverfly/languages
awesome-fish,null,1488,69,,3,2015-10-13T08:37:26Z,134,"A curated list of packages, prompts, and resources for the fish shell.",https://github.com/jorgebucaran/awesome-fish,https://api.github.com/repos/jorgebucaran/awesome-fish/languages
Lightning-Browser,Kotlin,1488,683,mpl-2.0,327,2013-02-01T19:25:59Z,14562,A lightweight Android browser with modern navigation,https://github.com/anthonycr/Lightning-Browser,https://api.github.com/repos/anthonycr/Lightning-Browser/languages
aeneas,Python,1488,140,agpl-3.0,40,2015-05-11T11:19:46Z,30530,aeneas is a Python/C library and a set of tools to automagically synchronize audio and text (aka forced alignment),https://github.com/readbeyond/aeneas,https://api.github.com/repos/readbeyond/aeneas/languages
angularjs-style-guide,null,1488,68,,1,2014-09-15T11:25:12Z,60,AngularJS style guide used at GoCardless,https://github.com/gocardless/angularjs-style-guide,https://api.github.com/repos/gocardless/angularjs-style-guide/languages
rheostat,JavaScript,1488,155,mit,56,2015-12-02T22:28:26Z,1115,"Rheostat is a www, mobile, and accessible slider component built with React",https://github.com/airbnb/rheostat,https://api.github.com/repos/airbnb/rheostat/languages
TranslateProject,Shell,1488,340,apache-2.0,2,2013-09-11T01:54:15Z,79429,Linux中国翻译项目,https://github.com/LCTT/TranslateProject,https://api.github.com/repos/LCTT/TranslateProject/languages
d3plus,JavaScript,1487,194,mit,268,2013-01-09T00:26:58Z,34249,A javascript library that extends D3.js to enable fast and beautiful visualizations.,https://github.com/alexandersimoes/d3plus,https://api.github.com/repos/alexandersimoes/d3plus/languages
wwdc-downloader,Swift,1487,140,,20,2013-06-28T12:21:11Z,220060,WWDC 2019 video downloader script written in Swift - no external dependency.,https://github.com/ohoachuck/wwdc-downloader,https://api.github.com/repos/ohoachuck/wwdc-downloader/languages
bubbly-bg,JavaScript,1487,97,apache-2.0,2,2017-09-29T08:00:47Z,2796,Beautiful bubbly backgrounds in less than 1kB (750 bytes gzipped),https://github.com/tipsy/bubbly-bg,https://api.github.com/repos/tipsy/bubbly-bg/languages
favesound-redux,JavaScript,1486,238,,20,2016-01-27T21:43:25Z,507,🎶 A SoundCloud Client in React + Redux running in production. Live Demo and Source Code to explore React + Redux as a beginner.,https://github.com/rwieruch/favesound-redux,https://api.github.com/repos/rwieruch/favesound-redux/languages
doorman,Go,1486,80,apache-2.0,15,2016-02-05T13:49:20Z,10729,Doorman: Global Distributed Client Side Rate Limiting.,https://github.com/youtube/doorman,https://api.github.com/repos/youtube/doorman/languages
rendora,Go,1486,53,apache-2.0,18,2018-11-18T13:33:53Z,168,dynamic server-side rendering using headless Chrome to effortlessly solve the SEO problem for modern javascript websites,https://github.com/rendora/rendora,https://api.github.com/repos/rendora/rendora/languages
gpustat,Python,1486,141,mit,16,2016-04-24T10:46:43Z,208,📊 A simple command-line utility for querying and monitoring GPU status,https://github.com/wookayin/gpustat,https://api.github.com/repos/wookayin/gpustat/languages
voltdb,Java,1486,385,other,81,2011-09-23T18:46:12Z,683208,VoltDB,https://github.com/VoltDB/voltdb,https://api.github.com/repos/VoltDB/voltdb/languages
StofDoctrineExtensionsBundle,PHP,1487,314,mit,70,2010-11-09T20:48:50Z,245,Integration bundle for DoctrineExtensions by l3pp4rd in Symfony,https://github.com/stof/StofDoctrineExtensionsBundle,https://api.github.com/repos/stof/StofDoctrineExtensionsBundle/languages
mlir,C++,1486,213,apache-2.0,52,2019-03-29T04:54:54Z,13554,"""Multi-Level Intermediate Representation"" Compiler Infrastructure",https://github.com/tensorflow/mlir,https://api.github.com/repos/tensorflow/mlir/languages
ToDoList,Java,1486,244,,14,2016-11-22T09:45:29Z,3416,Micro-Transitions for Smooth Android To-Do List Animations,https://github.com/Yalantis/ToDoList,https://api.github.com/repos/Yalantis/ToDoList/languages
atom-pair,JavaScript,1486,45,mit,15,2015-01-27T17:15:19Z,4030,An Atom package that allows for epic pair programming,https://github.com/pusher/atom-pair,https://api.github.com/repos/pusher/atom-pair/languages
groovy-core,Java,1486,420,apache-2.0,15,2011-09-19T07:41:42Z,162860,"former home of the groovy programming language, moved to https://github.com/apache/groovy",https://github.com/groovy/groovy-core,https://api.github.com/repos/groovy/groovy-core/languages
Jarvis,Python,1486,545,mit,28,2017-03-10T22:09:14Z,1080,Personal Assistant for Linux and macOS,https://github.com/sukeesh/Jarvis,https://api.github.com/repos/sukeesh/Jarvis/languages
PyLaTeX,Python,1486,214,mit,68,2014-01-15T14:52:10Z,4535,A Python library for creating LaTeX files,https://github.com/JelteF/PyLaTeX,https://api.github.com/repos/JelteF/PyLaTeX/languages
ansiweather,Shell,1486,127,bsd-2-clause,2,2013-10-19T10:58:45Z,162,"Weather in terminal, with ANSI colors and Unicode symbols",https://github.com/fcambus/ansiweather,https://api.github.com/repos/fcambus/ansiweather/languages
scouter,Java,1485,418,apache-2.0,57,2015-06-04T01:19:31Z,94591,Scouter is an open source APM (Application Performance Management) tool.,https://github.com/scouter-project/scouter,https://api.github.com/repos/scouter-project/scouter/languages
match-sorter,JavaScript,1485,59,mit,1,2016-08-25T04:04:48Z,189,"Simple, expected, and deterministic best-match sorting of an array in JavaScript",https://github.com/kentcdodds/match-sorter,https://api.github.com/repos/kentcdodds/match-sorter/languages
android-pluginmgr,Java,1485,549,,24,2014-11-23T03:46:47Z,2282,apk plug apkplug apk load,https://github.com/houkx/android-pluginmgr,https://api.github.com/repos/houkx/android-pluginmgr/languages
ProgressHUD,Objective-C,1485,273,other,8,2013-10-09T14:25:30Z,163,ProgressHUD is a lightweight and easy-to-use HUD for iOS. (Objective-C),https://github.com/relatedcode/ProgressHUD,https://api.github.com/repos/relatedcode/ProgressHUD/languages
RichEditorView,Swift,1485,325,bsd-3-clause,76,2015-04-05T14:44:13Z,1889,"RichEditorView is a simple, modular, drop-in UIView subclass for Rich Text Editing.",https://github.com/cjwirth/RichEditorView,https://api.github.com/repos/cjwirth/RichEditorView/languages
ormlite-android,Java,1485,372,isc,38,2013-03-08T16:37:44Z,440,ORMLite Android functionality used in conjunction with ormlite-core,https://github.com/j256/ormlite-android,https://api.github.com/repos/j256/ormlite-android/languages
PyQt5-Chinese-tutorial,null,1485,562,,0,2016-09-28T02:35:59Z,906,PyQt5中文教程,https://github.com/maicss/PyQt5-Chinese-tutorial,https://api.github.com/repos/maicss/PyQt5-Chinese-tutorial/languages
meme,JavaScript,1485,387,other,21,2014-06-25T19:07:11Z,4057,Meme generator,https://github.com/voxmedia/meme,https://api.github.com/repos/voxmedia/meme/languages
