Pixel,Swift,1830,121,mit,22,2018-10-08T11:44:36Z,104045,🎨🖼 An image editor and engine using CoreImage,https://github.com/muukii/Pixel,https://api.github.com/repos/muukii/Pixel/languages
singa,C++,1830,480,apache-2.0,33,2015-04-02T07:00:05Z,16822,Mirror of Apache Singa,https://github.com/apache/singa,https://api.github.com/repos/apache/singa/languages
haste-server,JavaScript,1830,442,,115,2011-11-29T14:19:46Z,1399,open source pastebin written in node.js,https://github.com/seejohnrun/haste-server,https://api.github.com/repos/seejohnrun/haste-server/languages
uvicorn,Python,1830,128,bsd-3-clause,46,2017-05-31T13:13:43Z,1810,The lightning-fast ASGI server. 🦄,https://github.com/encode/uvicorn,https://api.github.com/repos/encode/uvicorn/languages
TextPathView,Java,1829,194,mit,1,2018-01-10T10:36:47Z,315,A View with text path animation!,https://github.com/totond/TextPathView,https://api.github.com/repos/totond/TextPathView/languages
react-image-gallery,JavaScript,1829,389,mit,14,2015-02-27T23:41:41Z,30703,React carousel image gallery component with thumbnail support  🖼,https://github.com/xiaolin/react-image-gallery,https://api.github.com/repos/xiaolin/react-image-gallery/languages
LaTeXTools,Python,1829,358,,322,2011-03-26T18:59:50Z,2668,LaTeX plugin for Sublime Text 2 and 3,https://github.com/SublimeText/LaTeXTools,https://api.github.com/repos/SublimeText/LaTeXTools/languages
rubygems.org,Ruby,1829,765,mit,104,2009-01-29T22:30:46Z,14034,The Ruby community's gem hosting service.,https://github.com/rubygems/rubygems.org,https://api.github.com/repos/rubygems/rubygems.org/languages
credstash,Python,1829,190,apache-2.0,50,2015-04-20T16:20:15Z,318,A little utility for managing credentials in the cloud,https://github.com/fugue/credstash,https://api.github.com/repos/fugue/credstash/languages
Adafruit_NeoPixel,C++,1829,837,lgpl-3.0,51,2012-12-12T19:16:00Z,678,"Arduino library for controlling single-wire LED pixels (NeoPixel, WS2812, etc.)",https://github.com/adafruit/Adafruit_NeoPixel,https://api.github.com/repos/adafruit/Adafruit_NeoPixel/languages
GiphyAPI,null,1828,276,,40,2013-05-24T21:00:06Z,978,"Public facing API docs, notes and more ",https://github.com/Giphy/GiphyAPI,https://api.github.com/repos/Giphy/GiphyAPI/languages
Scarlet,Kotlin,1828,107,bsd-3-clause,54,2018-05-29T17:23:18Z,1405,"A Retrofit inspired WebSocket client for Kotlin, Java, and Android",https://github.com/Tinder/Scarlet,https://api.github.com/repos/Tinder/Scarlet/languages
IJulia.jl,Julia,1828,305,mit,63,2013-03-05T18:20:21Z,1048,Julia kernel for Jupyter,https://github.com/JuliaLang/IJulia.jl,https://api.github.com/repos/JuliaLang/IJulia.jl/languages
earth-reverse-engineering,C,1828,123,,11,2019-01-12T06:10:07Z,1831,Reversing Google's 3D satellite mode,https://github.com/retroplasma/earth-reverse-engineering,https://api.github.com/repos/retroplasma/earth-reverse-engineering/languages
isMobile,TypeScript,1828,240,mit,5,2012-07-26T17:31:23Z,644,A simple JS library that detects mobile devices.,https://github.com/kaimallea/isMobile,https://api.github.com/repos/kaimallea/isMobile/languages
MusicBot,Python,1828,1681,mit,111,2015-12-29T05:30:11Z,155272,:musical_note: The original MusicBot for Discord (formerly SexualRhinoceros/MusicBot),https://github.com/Just-Some-Bots/MusicBot,https://api.github.com/repos/Just-Some-Bots/MusicBot/languages
tinyproxy,C,1828,332,gpl-2.0,102,2015-12-07T14:11:44Z,1752,tinyproxy - a light-weight HTTP/HTTPS proxy daemon for POSIX operating systems,https://github.com/tinyproxy/tinyproxy,https://api.github.com/repos/tinyproxy/tinyproxy/languages
spring-boot-all,JavaScript,1828,1270,apache-2.0,14,2014-06-09T08:52:42Z,9674,"spring-boot,mybatis,activemq,redis,email, freemarker,shiro,websocket,sitemesh,ehcache,easyui,kindeditor,quartz,springfox,swagger,jpa,hibernate,querydsl,netty",https://github.com/leelance/spring-boot-all,https://api.github.com/repos/leelance/spring-boot-all/languages
wayback-machine-downloader,Ruby,1828,269,other,65,2015-07-25T23:45:34Z,145,Download an entire website from the Wayback Machine.,https://github.com/hartator/wayback-machine-downloader,https://api.github.com/repos/hartator/wayback-machine-downloader/languages
kxmenu,Objective-C,1828,390,bsd-2-clause,31,2013-05-17T14:41:49Z,911,KxMenu is a vertical popup menu for using in iOS applications,https://github.com/kolyvan/kxmenu,https://api.github.com/repos/kolyvan/kxmenu/languages
bootcamp,CSS,1828,912,mit,4,2014-05-27T19:30:57Z,9795,An enterprise social network,https://github.com/vitorfs/bootcamp,https://api.github.com/repos/vitorfs/bootcamp/languages
wikiextractor,Python,1828,550,,70,2015-03-22T12:03:01Z,1311,A tool for extracting plain text from Wikipedia dumps,https://github.com/attardi/wikiextractor,https://api.github.com/repos/attardi/wikiextractor/languages
vuetable-2,Vue,1827,320,mit,321,2016-10-08T14:58:10Z,1837,data table simplify! -- datatable component for Vue 2.x. See documentation at ,https://github.com/ratiw/vuetable-2,https://api.github.com/repos/ratiw/vuetable-2/languages
electron-store,JavaScript,1827,56,mit,15,2016-05-25T09:21:10Z,50,"Simple data persistence for your Electron app or module - Save and load user preferences, app state, cache, etc",https://github.com/sindresorhus/electron-store,https://api.github.com/repos/sindresorhus/electron-store/languages
MacRuby,Ruby,1827,201,other,88,2010-10-10T22:31:20Z,61455,"MacRuby is an implementation of Ruby 1.9 directly on top of Mac OS X core technologies such as the Objective-C runtime and garbage collector, the LLVM compiler infrastructure and the Foundation and ICU frameworks.",https://github.com/MacRuby/MacRuby,https://api.github.com/repos/MacRuby/MacRuby/languages
hjs-webpack,JavaScript,1827,147,,16,2015-03-23T21:56:09Z,362,Helpers/presets for setting up webpack with hotloading react and ES6(2015) using Babel.,https://github.com/HenrikJoreteg/hjs-webpack,https://api.github.com/repos/HenrikJoreteg/hjs-webpack/languages
card.io-Android-SDK,Java,1827,502,other,67,2013-06-11T17:27:45Z,131111,"card.io provides fast, easy credit card scanning in mobile apps",https://github.com/card-io/card.io-Android-SDK,https://api.github.com/repos/card-io/card.io-Android-SDK/languages
core-values-encoder,JavaScript,1827,258,,7,2017-10-18T07:14:15Z,68,Translating text to core values and back,https://github.com/sym233/core-values-encoder,https://api.github.com/repos/sym233/core-values-encoder/languages
StarterLearningPython,Python,1827,876,,31,2015-02-23T08:31:37Z,6498,Learning Python: from Beginner to Master. http://www.itdiffer.com,https://github.com/qiwsir/StarterLearningPython,https://api.github.com/repos/qiwsir/StarterLearningPython/languages
RazorEngine,C#,1827,488,apache-2.0,147,2011-06-29T18:18:33Z,33900,Open source templating engine based on Microsoft's Razor parsing engine,https://github.com/Antaris/RazorEngine,https://api.github.com/repos/Antaris/RazorEngine/languages
redis-stat,Ruby,1827,323,mit,21,2012-07-22T12:47:19Z,2112,(UNMAINTAINED) A real-time Redis monitoring tool,https://github.com/junegunn/redis-stat,https://api.github.com/repos/junegunn/redis-stat/languages
cpplinks,null,1826,220,,0,2015-08-07T14:36:35Z,751, A categorized list of C++ resources.,https://github.com/MattPD/cpplinks,https://api.github.com/repos/MattPD/cpplinks/languages
node-chakracore,JavaScript,1826,285,other,94,2015-11-25T19:09:26Z,429061,Node.js on ChakraCore :sparkles::turtle::rocket::sparkles:,https://github.com/nodejs/node-chakracore,https://api.github.com/repos/nodejs/node-chakracore/languages
deploy,HTML,1826,275,mit,6,2014-08-14T11:05:33Z,548,"Ansible role to deploy scripting applications like PHP, Python, Ruby, etc. in a capistrano style",https://github.com/ansistrano/deploy,https://api.github.com/repos/ansistrano/deploy/languages
QueryList,PHP,1826,318,,32,2015-12-20T15:58:35Z,747,:spider: The progressive PHP crawler framework!  优雅的渐进式PHP采集框架。,https://github.com/jae-jae/QueryList,https://api.github.com/repos/jae-jae/QueryList/languages
MineCraft-One-Week-Challenge,C,1826,317,mit,15,2017-07-27T17:07:06Z,11940,"I challenged myself to see if I could create a voxel game (Minecraft-like) in just one week using C++ and OpenGL, and here is the result",https://github.com/Hopson97/MineCraft-One-Week-Challenge,https://api.github.com/repos/Hopson97/MineCraft-One-Week-Challenge/languages
SB-Admin-BS4-Angular-8,HTML,1826,1192,other,53,2015-12-21T12:32:22Z,7170,Simple Dashboard Admin App built using Angular 8 and Bootstrap 4,https://github.com/start-angular/SB-Admin-BS4-Angular-8,https://api.github.com/repos/start-angular/SB-Admin-BS4-Angular-8/languages
code,Python,1826,666,mit,26,2017-07-24T19:13:17Z,12343,ActiveState Code Recipes,https://github.com/ActiveState/code,https://api.github.com/repos/ActiveState/code/languages
sqler,Go,1826,76,apache-2.0,4,2019-01-07T21:38:36Z,85,"write APIs using direct SQL queries with no hassle, let's rethink about SQL",https://github.com/alash3al/sqler,https://api.github.com/repos/alash3al/sqler/languages
tinykaboom,C++,1826,68,,0,2019-01-27T13:03:40Z,11166,A brief computer graphics / rendering course,https://github.com/ssloy/tinykaboom,https://api.github.com/repos/ssloy/tinykaboom/languages
bug.n,AutoHotkey,1826,132,gpl-3.0,83,2014-03-04T01:34:45Z,9511,Tiling Window Manager for Windows,https://github.com/fuhsjr00/bug.n,https://api.github.com/repos/fuhsjr00/bug.n/languages
homoiconic,Ruby,1825,116,other,15,2008-10-28T02:36:02Z,6396,An experiment in publishing code and words about code on a small scale.,https://github.com/raganwald-deprecated/homoiconic,https://api.github.com/repos/raganwald-deprecated/homoiconic/languages
mr-data-converter,JavaScript,1825,715,other,37,2010-09-27T23:02:51Z,6099,"Takes CSV or tab-delimited data from Excel and converts it into several web-friendly formats, include JSON and XML. ",https://github.com/shancarter/mr-data-converter,https://api.github.com/repos/shancarter/mr-data-converter/languages
rsync-time-backup,Shell,1825,277,,47,2013-10-27T03:57:45Z,770,Time Machine style backup with rsync.,https://github.com/laurent22/rsync-time-backup,https://api.github.com/repos/laurent22/rsync-time-backup/languages
inflector,PHP,1829,6,mit,0,2016-03-31T09:36:34Z,106,Inflector converts words between their singular and plural forms (English only).,https://github.com/symfony/inflector,https://api.github.com/repos/symfony/inflector/languages
FreshRSS,PHP,1825,258,agpl-3.0,279,2012-10-21T16:48:50Z,12280,"A free, self-hostable aggregator…",https://github.com/FreshRSS/FreshRSS,https://api.github.com/repos/FreshRSS/FreshRSS/languages
ITArticles,Python,1825,741,,15,2014-06-20T07:39:45Z,3310,null,https://github.com/qiwsir/ITArticles,https://api.github.com/repos/qiwsir/ITArticles/languages
pywin32,C++,1824,365,,372,2017-10-24T21:44:27Z,53328,Python for Windows (pywin32) Extensions,https://github.com/mhammond/pywin32,https://api.github.com/repos/mhammond/pywin32/languages
sprintf.js,JavaScript,1824,268,bsd-3-clause,39,2013-04-02T17:32:26Z,246,sprintf.js is a complete open source JavaScript sprintf implementation,https://github.com/alexei/sprintf.js,https://api.github.com/repos/alexei/sprintf.js/languages
ZeroFormatter,C#,1824,192,mit,54,2016-09-11T12:18:17Z,107941,"Infinitely Fast Deserializer for .NET, .NET Core and Unity.",https://github.com/neuecc/ZeroFormatter,https://api.github.com/repos/neuecc/ZeroFormatter/languages
tensorflow-yolov3,Python,1824,768,other,308,2018-11-23T06:26:37Z,64361,🔥 pure tensorflow Implement of YOLOv3 with support to train your own dataset ,https://github.com/YunYang1994/tensorflow-yolov3,https://api.github.com/repos/YunYang1994/tensorflow-yolov3/languages
wallpapper,Swift,1824,87,mit,9,2018-07-12T10:13:20Z,190,Console application for creating dynamic wallpapers for macOS Mojave,https://github.com/mczachurski/wallpapper,https://api.github.com/repos/mczachurski/wallpapper/languages
LXReorderableCollectionViewFlowLayout,Objective-C,1823,332,mit,60,2012-10-02T16:09:14Z,222,Extends `UICollectionViewFlowLayout` to support reordering of cells. Similar to long press and pan on books in iBook.,https://github.com/lxcid/LXReorderableCollectionViewFlowLayout,https://api.github.com/repos/lxcid/LXReorderableCollectionViewFlowLayout/languages
vim-as-an-ide,VimL,1823,166,,0,2015-02-25T10:09:03Z,38,Workshop on how to use Vim Plugins.,https://github.com/jez/vim-as-an-ide,https://api.github.com/repos/jez/vim-as-an-ide/languages
ganache,JavaScript,1823,313,,256,2017-01-17T20:39:11Z,295508,Personal blockchain for Ethereum development,https://github.com/trufflesuite/ganache,https://api.github.com/repos/trufflesuite/ganache/languages
xcode-install,Ruby,1823,165,mit,102,2015-04-08T20:47:32Z,461,🔽 Install and update your Xcodes,https://github.com/xcpretty/xcode-install,https://api.github.com/repos/xcpretty/xcode-install/languages
lk,C,1823,387,other,45,2011-12-27T19:19:36Z,21079,LK embedded kernel,https://github.com/littlekernel/lk,https://api.github.com/repos/littlekernel/lk/languages
rtl_433,C,1823,553,gpl-2.0,52,2013-01-19T16:40:34Z,4917,Program to decode traffic from Devices that are broadcasting on 433.9 MHz like temperature sensors,https://github.com/merbanan/rtl_433,https://api.github.com/repos/merbanan/rtl_433/languages
sqlparse,Python,1823,391,bsd-3-clause,140,2012-04-18T19:33:21Z,1454,A non-validating SQL parser module for Python,https://github.com/andialbrecht/sqlparse,https://api.github.com/repos/andialbrecht/sqlparse/languages
eksctl,Go,1822,356,other,329,2018-05-23T08:41:03Z,30514,The official CLI for Amazon EKS,https://github.com/weaveworks/eksctl,https://api.github.com/repos/weaveworks/eksctl/languages
UI-Testing-Cheat-Sheet,Swift,1822,146,,6,2015-09-07T13:13:19Z,79,How do I test this with UI Testing?,https://github.com/joemasilotti/UI-Testing-Cheat-Sheet,https://api.github.com/repos/joemasilotti/UI-Testing-Cheat-Sheet/languages
TextJustify-Android,Java,1821,380,other,75,2013-09-13T04:19:31Z,4218,:page_facing_up: Android Text Full Jusiftication / Wrapping / Justify / Hyphenate - V2.0,https://github.com/mathew-kurian/TextJustify-Android,https://api.github.com/repos/mathew-kurian/TextJustify-Android/languages
YalpStore,Java,1821,185,gpl-2.0,7,2016-12-11T16:57:14Z,4454,Download apks from Google Play Store,https://github.com/yeriomin/YalpStore,https://api.github.com/repos/yeriomin/YalpStore/languages
thuthesis,TeX,1821,642,,9,2011-09-12T10:20:07Z,2398,LaTeX Thesis Template for Tsinghua University,https://github.com/xueruini/thuthesis,https://api.github.com/repos/xueruini/thuthesis/languages
rust-doom,Rust,1821,67,apache-2.0,4,2014-09-18T19:40:35Z,18390,A Doom Renderer written in Rust.,https://github.com/cristicbz/rust-doom,https://api.github.com/repos/cristicbz/rust-doom/languages
awesome-ci,null,1821,160,mit,2,2014-10-28T07:07:56Z,214,List of Continuous Integration services,https://github.com/ligurio/awesome-ci,https://api.github.com/repos/ligurio/awesome-ci/languages
PokemonGo-DesktopMap,Python,1821,424,mit,183,2016-07-19T21:59:54Z,34961,Electron App around PokemonGo-Map,https://github.com/mchristopher/PokemonGo-DesktopMap,https://api.github.com/repos/mchristopher/PokemonGo-DesktopMap/languages
aws-cloudformation-templates,Python,1821,1354,apache-2.0,58,2015-12-08T20:52:52Z,1582,A collection of useful CloudFormation templates ,https://github.com/awslabs/aws-cloudformation-templates,https://api.github.com/repos/awslabs/aws-cloudformation-templates/languages
nlp-recipes,Python,1821,195,mit,53,2019-04-05T17:42:41Z,43055,Natural Language Processing Best Practices & Examples,https://github.com/microsoft/nlp-recipes,https://api.github.com/repos/microsoft/nlp-recipes/languages
wink,Vue,1820,215,mit,50,2018-11-03T10:26:06Z,2356,A Laravel-based publishing platform,https://github.com/writingink/wink,https://api.github.com/repos/writingink/wink/languages
openaddresses,JavaScript,1820,771,bsd-3-clause,484,2014-02-06T21:29:20Z,12362,A repository of global open address data.,https://github.com/openaddresses/openaddresses,https://api.github.com/repos/openaddresses/openaddresses/languages
AisenWeiBo,Java,1820,613,,45,2014-10-10T03:22:08Z,83031,新浪微博第三方Android客户端,https://github.com/wangdan/AisenWeiBo,https://api.github.com/repos/wangdan/AisenWeiBo/languages
Chronicle-Map,Java,1820,364,apache-2.0,39,2014-07-18T15:33:57Z,19218,"Replicate your Key Value Store across your network, with consistency, persistance and performance.",https://github.com/OpenHFT/Chronicle-Map,https://api.github.com/repos/OpenHFT/Chronicle-Map/languages
IntentKit,Objective-C,1820,125,mit,19,2013-11-30T05:15:54Z,5460,An easier way to handle third-party URL schemes in iOS apps.,https://github.com/intentkit/IntentKit,https://api.github.com/repos/intentkit/IntentKit/languages
