eos,C++,10698,3368,mit,274,2017-04-05T17:09:53Z,126450,An open source smart contract platform ,https://github.com/EOSIO/eos,https://api.github.com/repos/EOSIO/eos/languages
mpv,C,10697,1457,other,415,2012-10-13T08:08:44Z,92912,🎥 Command line video player,https://github.com/mpv-player/mpv,https://api.github.com/repos/mpv-player/mpv/languages
download,null,10696,2147,,0,2018-06-26T23:52:16Z,17,蓝灯Windows下载 https://s3.amazonaws.com/lantern/lantern-installer.exe 蓝灯安卓下载 https://s3.amazonaws.com/lantern/lantern-installer.apk,https://github.com/getlantern/download,https://api.github.com/repos/getlantern/download/languages
prezto,Shell,10691,4160,mit,183,2010-12-16T08:07:04Z,2031,The configuration framework for Zsh,https://github.com/sorin-ionescu/prezto,https://api.github.com/repos/sorin-ionescu/prezto/languages
fasthttp,Go,10687,907,mit,33,2015-10-18T22:19:57Z,1911,Fast HTTP package for Go. Tuned for high performance. Zero memory allocations in hot paths. Up to 10x faster than net/http,https://github.com/valyala/fasthttp,https://api.github.com/repos/valyala/fasthttp/languages
nginx-admins-handbook,Shell,10686,764,gpl-3.0,0,2019-01-28T13:24:15Z,45994,"How to improve NGINX performance, security, and other important things; @ssllabs A+ 100%, @mozilla A+ 120/100.",https://github.com/trimstray/nginx-admins-handbook,https://api.github.com/repos/trimstray/nginx-admins-handbook/languages
DoraemonKit,Java,10683,1365,apache-2.0,10,2018-08-14T10:32:07Z,21808,"简称 ""DoKit"" 。一款功能齐全的客户端（ iOS 、Android、微信小程序 ）研发助手，你值得拥有。",https://github.com/didi/DoraemonKit,https://api.github.com/repos/didi/DoraemonKit/languages
aframe,JavaScript,10680,2573,mit,222,2015-09-15T02:04:40Z,322192,:a: web framework for building virtual reality experiences.,https://github.com/aframevr/aframe,https://api.github.com/repos/aframevr/aframe/languages
node-http-proxy,JavaScript,10680,1571,other,440,2010-07-24T18:30:12Z,1435,A full-featured http proxy for node.js,https://github.com/http-party/node-http-proxy,https://api.github.com/repos/http-party/node-http-proxy/languages
bytecode-viewer,Java,10677,708,gpl-3.0,45,2014-10-14T10:26:46Z,574377,"A Java 8+ Jar & Android APK Reverse Engineering Suite (Decompiler, Editor, Debugger & More)",https://github.com/Konloch/bytecode-viewer,https://api.github.com/repos/Konloch/bytecode-viewer/languages
ChromeAppHeroes,Python,10674,950,gpl-3.0,5,2019-02-07T06:35:24Z,26626,"🌈谷粒-Chrome插件英雄榜, 为优秀的Chrome插件写一本中文说明书, 让Chrome插件英雄们造福人类~  ChromePluginHeroes, Write a Chinese manual for the excellent Chrome plugin, let the Chrome plugin heroes benefit the human~",https://github.com/zhaoolee/ChromeAppHeroes,https://api.github.com/repos/zhaoolee/ChromeAppHeroes/languages
zxcvbn,CoffeeScript,10672,705,mit,95,2012-02-28T03:25:54Z,16189,Low-Budget Password Strength Estimation,https://github.com/dropbox/zxcvbn,https://api.github.com/repos/dropbox/zxcvbn/languages
IGListKit,Objective-C,10665,1199,mit,122,2016-09-07T08:39:27Z,6815,A data-driven UICollectionView framework for building fast and flexible lists.,https://github.com/Instagram/IGListKit,https://api.github.com/repos/Instagram/IGListKit/languages
awesome-datascience,null,10656,3147,mit,0,2014-07-05T07:07:43Z,614,:memo: An awesome Data Science repository to learn and apply for real world problems.,https://github.com/academic/awesome-datascience,https://api.github.com/repos/academic/awesome-datascience/languages
core-js,JavaScript,10649,691,mit,36,2013-07-17T16:32:27Z,28859,Standard Library,https://github.com/zloirock/core-js,https://api.github.com/repos/zloirock/core-js/languages
CheatSheetSeries,Python,10643,1477,other,54,2018-12-21T14:26:43Z,246221,The OWASP Cheat Sheet Series was created to provide a concise collection of high value information on specific application security topics.,https://github.com/OWASP/CheatSheetSeries,https://api.github.com/repos/OWASP/CheatSheetSeries/languages
dashboards,HTML,10637,1416,mit,0,2014-08-08T17:16:17Z,2240,Responsive dashboard templates 📊✨,https://github.com/keen/dashboards,https://api.github.com/repos/keen/dashboards/languages
volkswagen,JavaScript,10635,213,mit,55,2015-10-07T16:51:21Z,248,":see_no_evil: Volkswagen detects when your tests are being run in a CI server, and makes them pass.",https://github.com/auchenberg/volkswagen,https://api.github.com/repos/auchenberg/volkswagen/languages
react-devtools,null,10633,1583,other,0,2013-09-04T20:28:43Z,21682,An extension that allows inspection of React component hierarchy in the Chrome and Firefox Developer Tools.,https://github.com/facebook/react-devtools,https://api.github.com/repos/facebook/react-devtools/languages
zulip,Python,10619,3311,apache-2.0,1348,2015-09-25T16:37:25Z,246012,Zulip server - powerful open source team chat,https://github.com/zulip/zulip,https://api.github.com/repos/zulip/zulip/languages
history.js,JavaScript,10607,1465,other,233,2011-01-20T14:10:05Z,3083,"History.js gracefully supports the HTML5 History/State APIs (pushState, replaceState, onPopState) in all browsers. Including continued support for data, titles, replaceState. Supports jQuery, MooTools and Prototype.  For HTML5 browsers this means that you can modify the URL directly, without needing to use hashes anymore. For HTML4 browsers it will revert back to using the old onhashchange functionality.",https://github.com/browserstate/history.js,https://api.github.com/repos/browserstate/history.js/languages
tdesktop,C++,10588,2495,other,1166,2014-05-02T12:36:31Z,136131,Telegram Desktop messaging app,https://github.com/telegramdesktop/tdesktop,https://api.github.com/repos/telegramdesktop/tdesktop/languages
awesome-graphql,null,10577,879,,77,2015-07-12T10:53:26Z,623,Awesome list of GraphQL & Relay,https://github.com/chentsulin/awesome-graphql,https://api.github.com/repos/chentsulin/awesome-graphql/languages
nvm-windows,Go,10572,1010,mit,145,2014-09-20T16:37:28Z,2059,A node.js version management utility for Windows. Ironically written in Go.,https://github.com/coreybutler/nvm-windows,https://api.github.com/repos/coreybutler/nvm-windows/languages
nedb,JavaScript,10571,711,mit,161,2013-05-01T17:12:17Z,1555,"The JavaScript Database, for Node.js, nw.js, electron and the browser",https://github.com/louischatriot/nedb,https://api.github.com/repos/louischatriot/nedb/languages
cookiecutter,Python,10571,1170,bsd-3-clause,205,2013-07-14T18:31:22Z,2421,"A command-line utility that creates projects from cookiecutters (project templates), e.g. Python package projects, jQuery plugin projects.",https://github.com/cookiecutter/cookiecutter,https://api.github.com/repos/cookiecutter/cookiecutter/languages
blur-admin,JavaScript,10568,3054,other,258,2016-04-08T08:30:20Z,87532,AngularJS Bootstrap Admin Panel Framework,https://github.com/akveo/blur-admin,https://api.github.com/repos/akveo/blur-admin/languages
pomelo,JavaScript,10558,2759,mit,131,2012-09-20T02:37:07Z,61084,"A fast,scalable,distributed game server framework for Node.js.",https://github.com/NetEase/pomelo,https://api.github.com/repos/NetEase/pomelo/languages
NodeBB,JavaScript,10549,2127,gpl-3.0,169,2013-04-22T16:49:40Z,53462,Node.js based forum software built for the modern web,https://github.com/NodeBB/NodeBB,https://api.github.com/repos/NodeBB/NodeBB/languages
swift-evolution,Markdown,10542,1697,apache-2.0,29,2015-11-03T21:49:37Z,4465,This maintains proposals for changes and user-visible enhancements to the Swift Programming Language.,https://github.com/apple/swift-evolution,https://api.github.com/repos/apple/swift-evolution/languages
react-in-patterns,JavaScript,10541,669,mit,8,2016-06-20T07:53:11Z,132849,A free book that talks about design patterns/techniques used while developing with React.,https://github.com/krasimir/react-in-patterns,https://api.github.com/repos/krasimir/react-in-patterns/languages
ignite,TypeScript,10532,834,mit,27,2016-02-10T16:06:07Z,12565,"The hottest CLI for React Native, boilerplates, plugins, generators, and more!",https://github.com/infinitered/ignite,https://api.github.com/repos/infinitered/ignite/languages
pix2code,Python,10530,1116,apache-2.0,1,2017-05-24T05:51:41Z,776652,pix2code: Generating Code from a Graphical User Interface Screenshot,https://github.com/tonybeltramelli/pix2code,https://api.github.com/repos/tonybeltramelli/pix2code/languages
driver.js,JavaScript,10520,503,mit,29,2018-03-11T19:52:13Z,1899,"A light-weight, no-dependency, vanilla JavaScript engine to drive the user's focus across the page",https://github.com/kamranahmedse/driver.js,https://api.github.com/repos/kamranahmedse/driver.js/languages
Semantic-UI-React,JavaScript,10520,2891,mit,120,2015-06-19T16:47:19Z,164126,The official Semantic-UI-React integration,https://github.com/Semantic-Org/Semantic-UI-React,https://api.github.com/repos/Semantic-Org/Semantic-UI-React/languages
PayloadsAllTheThings,Python,10517,3286,mit,5,2016-10-18T07:29:07Z,7574,A list of useful payloads and bypass for Web Application Security and Pentest/CTF,https://github.com/swisskyrepo/PayloadsAllTheThings,https://api.github.com/repos/swisskyrepo/PayloadsAllTheThings/languages
primitive,Go,10509,495,mit,39,2016-09-13T03:01:10Z,2345,Reproducing images with geometric primitives.,https://github.com/fogleman/primitive,https://api.github.com/repos/fogleman/primitive/languages
android-async-http,Java,10506,4280,,107,2011-02-20T03:25:07Z,3049,An Asynchronous HTTP Library for Android,https://github.com/android-async-http/android-async-http,https://api.github.com/repos/android-async-http/android-async-http/languages
openvpn-install,Shell,10484,2612,mit,1,2013-05-14T12:03:29Z,115,"OpenVPN road warrior installer for Debian, Ubuntu and CentOS",https://github.com/Nyr/openvpn-install,https://api.github.com/repos/Nyr/openvpn-install/languages
brook,Go,10479,1999,gpl-3.0,67,2017-03-18T03:00:28Z,30685,Brook is a cross-platform(Linux/MacOS/Windows/Android/iOS) proxy/vpn software,https://github.com/txthinking/brook,https://api.github.com/repos/txthinking/brook/languages
react-bits,null,10474,658,cc-by-4.0,10,2016-12-20T06:49:54Z,1030,"✨ React patterns, techniques, tips and tricks ✨",https://github.com/vasanthk/react-bits,https://api.github.com/repos/vasanthk/react-bits/languages
awesome-dotnet-core,C#,10465,1613,,71,2016-03-17T03:52:09Z,1367,":honeybee: A collection of awesome .NET core libraries, tools, frameworks and software",https://github.com/thangchung/awesome-dotnet-core,https://api.github.com/repos/thangchung/awesome-dotnet-core/languages
headroom.js,JavaScript,10454,879,mit,16,2013-08-07T20:42:58Z,646,Give your pages some headroom. Hide your header until you need it,https://github.com/WickyNilliams/headroom.js,https://api.github.com/repos/WickyNilliams/headroom.js/languages
twemoji,HTML,10453,1199,other,57,2014-11-06T21:49:34Z,808164,Emoji for everyone. https://twemoji.twitter.com/,https://github.com/twitter/twemoji,https://api.github.com/repos/twitter/twemoji/languages
codis,Go,10452,2407,mit,241,2014-10-27T05:26:11Z,22981,Proxy based Redis cluster solution supporting pipeline and scaling dynamically,https://github.com/CodisLabs/codis,https://api.github.com/repos/CodisLabs/codis/languages
alfred-workflows,null,10447,793,,6,2013-09-23T21:46:31Z,73368,:metal: A collection of Alfred 3 and 4 workflows that will rock your world,https://github.com/zenorocha/alfred-workflows,https://api.github.com/repos/zenorocha/alfred-workflows/languages
akka,Scala,10447,3130,other,903,2009-02-16T12:51:54Z,248840,"Build highly concurrent, distributed, and resilient message-driven applications on the JVM",https://github.com/akka/akka,https://api.github.com/repos/akka/akka/languages
appium,JavaScript,10441,4226,apache-2.0,178,2013-01-09T22:49:50Z,84060,":iphone: Automation for iOS, Android, and Windows Apps.",https://github.com/appium/appium,https://api.github.com/repos/appium/appium/languages
awesome-ruby,null,10441,1494,,87,2014-07-03T12:31:18Z,2637,":gem: A collection of awesome Ruby libraries, tools, frameworks and software",https://github.com/markets/awesome-ruby,https://api.github.com/repos/markets/awesome-ruby/languages
raphael,JavaScript,10439,1610,mit,335,2008-09-02T05:34:33Z,6705,JavaScript Vector Library,https://github.com/DmitryBaranovskiy/raphael,https://api.github.com/repos/DmitryBaranovskiy/raphael/languages
mux,Go,10437,1082,bsd-3-clause,14,2012-10-02T21:32:24Z,481,A powerful HTTP router and URL matcher for building Go web servers with 🦍,https://github.com/gorilla/mux,https://api.github.com/repos/gorilla/mux/languages
react-redux-starter-kit,JavaScript,10431,2388,mit,130,2015-06-24T18:38:28Z,1190,"Get started with React, Redux, and React-Router.",https://github.com/davezuko/react-redux-starter-kit,https://api.github.com/repos/davezuko/react-redux-starter-kit/languages
vert.x,Java,10420,1613,other,232,2011-06-17T14:54:55Z,105437,Vert.x is a tool-kit for building reactive applications on the JVM,https://github.com/eclipse-vertx/vert.x,https://api.github.com/repos/eclipse-vertx/vert.x/languages
Cachet,PHP,10411,1204,bsd-3-clause,182,2014-11-16T22:23:11Z,37512,📛 An open source status page system for everyone.,https://github.com/CachetHQ/Cachet,https://api.github.com/repos/CachetHQ/Cachet/languages
TDengine,C,10411,2757,agpl-3.0,231,2019-07-11T08:33:48Z,5161,An open-source big data platform designed and optimized for the Internet of Things (IoT).,https://github.com/taosdata/TDengine,https://api.github.com/repos/taosdata/TDengine/languages
swagger-codegen,HTML,10410,4850,other,2447,2011-07-06T14:26:48Z,90400,"swagger-codegen contains a template-driven engine to generate documentation, API clients and server stubs in different languages by parsing your OpenAPI / Swagger definition.",https://github.com/swagger-api/swagger-codegen,https://api.github.com/repos/swagger-api/swagger-codegen/languages
pydata-book,Jupyter Notebook,10405,8661,other,17,2012-06-30T18:39:12Z,41497,"Materials and IPython notebooks for ""Python for Data Analysis"" by Wes McKinney, published by O'Reilly Media",https://github.com/wesm/pydata-book,https://api.github.com/repos/wesm/pydata-book/languages
android-training-course-in-chinese,JavaScript,10404,2809,apache-2.0,10,2014-06-13T09:46:16Z,96483,Android官方培训课程中文版,https://github.com/kesenhoo/android-training-course-in-chinese,https://api.github.com/repos/kesenhoo/android-training-course-in-chinese/languages
requests-html,Python,10398,648,mit,85,2018-02-24T20:11:02Z,2907,Pythonic HTML Parsing for Humans™,https://github.com/psf/requests-html,https://api.github.com/repos/psf/requests-html/languages
shelljs,JavaScript,10394,601,other,76,2012-03-02T17:04:47Z,1279,:shell: Portable Unix shell commands for Node.js,https://github.com/shelljs/shelljs,https://api.github.com/repos/shelljs/shelljs/languages
salt,Python,10392,4699,other,3126,2011-02-20T20:16:56Z,442878,Software to automate the management and configuration of any infrastructure or application at scale. Get access to the Salt software package repository here: ,https://github.com/saltstack/salt,https://api.github.com/repos/saltstack/salt/languages
virtual-dom,JavaScript,10386,750,mit,160,2014-01-23T17:12:21Z,808,A Virtual DOM and diffing algorithm,https://github.com/Matt-Esch/virtual-dom,https://api.github.com/repos/Matt-Esch/virtual-dom/languages
Matisse,Java,10385,1607,apache-2.0,316,2017-04-13T01:31:05Z,1991,:fireworks: A well-designed local image and video selector for Android,https://github.com/zhihu/Matisse,https://api.github.com/repos/zhihu/Matisse/languages
rubocop,Ruby,10378,2216,mit,139,2012-04-21T10:09:58Z,29826,"A Ruby static code analyzer and formatter, based on the community Ruby style guide.",https://github.com/rubocop-hq/rubocop,https://api.github.com/repos/rubocop-hq/rubocop/languages
brain.js,JavaScript,10370,807,mit,70,2016-02-13T18:09:44Z,13109,🤖 Neural networks in JavaScript,https://github.com/BrainJS/brain.js,https://api.github.com/repos/BrainJS/brain.js/languages
swift-style-guide,null,10366,1696,other,4,2014-06-10T00:52:42Z,1460,The official Swift style guide for raywenderlich.com.,https://github.com/raywenderlich/swift-style-guide,https://api.github.com/repos/raywenderlich/swift-style-guide/languages
Babylon.js,TypeScript,10364,1925,apache-2.0,54,2013-06-27T20:40:42Z,2166706,"Babylon.js is a powerful, beautiful, simple, and open game and rendering engine packed into a friendly JavaScript framework.",https://github.com/BabylonJS/Babylon.js,https://api.github.com/repos/BabylonJS/Babylon.js/languages
awesome-algorithm,Python,10363,2158,gpl-3.0,2,2017-09-29T04:26:40Z,25254,项目永久冻结，迁移至新地址：,https://github.com/apachecn/awesome-algorithm,https://api.github.com/repos/apachecn/awesome-algorithm/languages
VasSonic,Java,10362,1414,other,25,2017-08-01T08:35:13Z,16215,"VasSonic is a lightweight and high-performance Hybrid framework developed by tencent VAS team, which is intended to speed up the first screen of websites working on Android and iOS platform. ",https://github.com/Tencent/VasSonic,https://api.github.com/repos/Tencent/VasSonic/languages
autojump,Python,10356,518,other,158,2009-01-14T11:18:07Z,797,A cd command that learns - easily navigate directories from the command line,https://github.com/wting/autojump,https://api.github.com/repos/wting/autojump/languages
awesome-dotnet,null,10354,1766,cc0-1.0,37,2014-07-16T09:32:12Z,1352,"A collection of awesome .NET libraries, tools, frameworks and software",https://github.com/quozd/awesome-dotnet,https://api.github.com/repos/quozd/awesome-dotnet/languages
UglifyJS2,JavaScript,10352,1092,other,61,2012-08-27T09:31:03Z,9039, JavaScript parser / mangler / compressor / beautifier toolkit,https://github.com/mishoo/UglifyJS2,https://api.github.com/repos/mishoo/UglifyJS2/languages
infer,OCaml,10345,1404,mit,214,2015-01-26T11:19:13Z,102224,"A static analyzer for Java, C, C++, and Objective-C",https://github.com/facebook/infer,https://api.github.com/repos/facebook/infer/languages
Catch2,C++,10340,1703,bsl-1.0,217,2010-11-08T18:22:56Z,14720,"A modern, C++-native, header-only, test framework for unit-tests, TDD and BDD - using C++11, C++14, C++17 and later (or C++03 on the Catch1.x branch)",https://github.com/catchorg/Catch2,https://api.github.com/repos/catchorg/Catch2/languages
angular-starter,JavaScript,10340,5378,mit,81,2015-03-07T22:25:10Z,4325,":tada: An Angular Starter kit featuring Angular (Router, Http, Forms, Services, Tests, E2E, Dev/Prod, HMR, Async/Lazy Routes, AoT via ngc), Karma, Protractor, Jasmine, Istanbul, TypeScript, TsLint, Codelyzer, Hot Module Replacement, @types, and Webpack",https://github.com/PatrickJS/angular-starter,https://api.github.com/repos/PatrickJS/angular-starter/languages
flysystem,PHP,10337,545,mit,10,2013-10-27T11:07:22Z,2250,Abstraction for local and remote filesystems,https://github.com/thephpleague/flysystem,https://api.github.com/repos/thephpleague/flysystem/languages
sage,PHP,10334,2873,mit,16,2011-01-29T03:12:09Z,7468,WordPress starter theme with a modern development workflow,https://github.com/roots/sage,https://api.github.com/repos/roots/sage/languages
websocket,Go,10334,1793,bsd-2-clause,31,2013-10-16T16:41:46Z,377,"A fast, well-tested and widely used WebSocket implementation for Go.",https://github.com/gorilla/websocket,https://api.github.com/repos/gorilla/websocket/languages
matplotlib,Python,10332,4599,,1491,2011-02-19T03:17:12Z,360383,matplotlib: plotting with Python,https://github.com/matplotlib/matplotlib,https://api.github.com/repos/matplotlib/matplotlib/languages
bootstrap-vue,JavaScript,10324,1391,mit,52,2016-10-08T15:59:35Z,24886,"BootstrapVue, with over 40 plugins and more than 80 custom components, provides one of the most comprehensive implementations of Bootstrap v4 components and grid system for Vue.js. With extensive and automated WAI-ARIA accessibility markup.",https://github.com/bootstrap-vue/bootstrap-vue,https://api.github.com/repos/bootstrap-vue/bootstrap-vue/languages
RestKit,Objective-C,10322,2224,apache-2.0,363,2010-02-09T01:14:06Z,43492,RestKit is a framework for consuming and modeling RESTful web resources on iOS and OS X,https://github.com/RestKit/RestKit,https://api.github.com/repos/RestKit/RestKit/languages
Eureka,Swift,10315,1179,mit,136,2015-09-28T22:20:53Z,20874,Elegant iOS form builder in Swift,https://github.com/xmartlabs/Eureka,https://api.github.com/repos/xmartlabs/Eureka/languages
vConsole,JavaScript,10307,2054,other,81,2016-04-27T03:33:45Z,1687,"A lightweight, extendable front-end developer tool for mobile web page.",https://github.com/Tencent/vConsole,https://api.github.com/repos/Tencent/vConsole/languages
gollum,Ruby,10300,1486,mit,23,2010-03-29T18:30:53Z,13635,"A simple, Git-powered wiki with a sweet API and local frontend.",https://github.com/gollum/gollum,https://api.github.com/repos/gollum/gollum/languages
