awesome-vscode,JavaScript,15999,831,cc0-1.0,28,2016-02-07T23:02:45Z,10409,🎨 A curated list of delightful VS Code packages and resources.,https://github.com/viatsko/awesome-vscode,https://api.github.com/repos/viatsko/awesome-vscode/languages
engineering-blogs,Ruby,15993,1871,,39,2015-06-13T18:25:17Z,1345,A curated list of engineering blogs,https://github.com/kilimchoi/engineering-blogs,https://api.github.com/repos/kilimchoi/engineering-blogs/languages
typeorm,TypeScript,15954,2233,mit,1226,2016-02-29T07:41:14Z,14407,"ORM for TypeScript and JavaScript (ES7, ES6, ES5). Supports MySQL, PostgreSQL, MariaDB, SQLite, MS SQL Server, Oracle, WebSQL databases. Works in NodeJS, Browser, Ionic, Cordova and Electron platforms.",https://github.com/typeorm/typeorm,https://api.github.com/repos/typeorm/typeorm/languages
fresco,Java,15924,3684,mit,100,2015-03-02T09:58:04Z,69418,An Android library for managing images and the memory they use.,https://github.com/facebook/fresco,https://api.github.com/repos/facebook/fresco/languages
typeahead.js,JavaScript,15897,3394,mit,496,2013-02-19T19:45:01Z,6152,typeahead.js is a fast and fully-featured autocomplete library,https://github.com/twitter/typeahead.js,https://api.github.com/repos/twitter/typeahead.js/languages
Aerial,Swift,15869,844,mit,23,2015-10-26T21:21:31Z,12860,Apple TV Aerial Screensaver for Mac,https://github.com/JohnCoates/Aerial,https://api.github.com/repos/JohnCoates/Aerial/languages
OpenAPI-Specification,null,15837,5633,apache-2.0,587,2014-03-03T16:53:36Z,2420,The OpenAPI Specification Repository,https://github.com/OAI/OpenAPI-Specification,https://api.github.com/repos/OAI/OpenAPI-Specification/languages
Boostnote,JavaScript,15788,1395,other,530,2016-03-06T17:06:07Z,17994,"A markdown editor for developers on Mac, Windows and Linux.",https://github.com/BoostIO/Boostnote,https://api.github.com/repos/BoostIO/Boostnote/languages
reselect,JavaScript,15786,560,mit,78,2015-07-01T11:06:45Z,629,Selector library for Redux,https://github.com/reduxjs/reselect,https://api.github.com/repos/reduxjs/reselect/languages
gorm,Go,15784,1819,mit,541,2013-10-25T08:31:38Z,4884,"The fantastic ORM library for Golang, aims to be developer friendly",https://github.com/jinzhu/gorm,https://api.github.com/repos/jinzhu/gorm/languages
cypress,CoffeeScript,15778,885,mit,1141,2015-03-04T00:46:28Z,141216,"Fast, easy and reliable testing for anything that runs in a browser.",https://github.com/cypress-io/cypress,https://api.github.com/repos/cypress-io/cypress/languages
django-rest-framework,Python,15770,4627,other,237,2011-03-02T17:13:56Z,45128,Web APIs for Django. 🎸,https://github.com/encode/django-rest-framework,https://api.github.com/repos/encode/django-rest-framework/languages
SnapKit,Swift,15750,1543,mit,80,2014-06-05T21:13:40Z,2808,A Swift Autolayout DSL for iOS & OS X,https://github.com/SnapKit/SnapKit,https://api.github.com/repos/SnapKit/SnapKit/languages
algo,Python,15729,1356,agpl-3.0,55,2016-05-15T03:42:48Z,2646,Set up a personal VPN in the cloud,https://github.com/trailofbits/algo,https://api.github.com/repos/trailofbits/algo/languages
my-mac-os,CSS,15701,660,mit,1,2016-03-04T12:26:34Z,16391,List of applications and tools that make my macOS experience even more amazing,https://github.com/nikitavoloboev/my-mac-os,https://api.github.com/repos/nikitavoloboev/my-mac-os/languages
odoo,Python,15663,11220,other,2481,2014-05-13T15:38:58Z,2742614,Odoo. Open Source Apps To Grow Your Business.,https://github.com/odoo/odoo,https://api.github.com/repos/odoo/odoo/languages
slate,JavaScript,15656,1465,mit,444,2016-06-18T01:52:42Z,239508,A completely customizable framework for building rich text editors. (Currently in beta.),https://github.com/ianstormtaylor/slate,https://api.github.com/repos/ianstormtaylor/slate/languages
python-fire,Python,15643,948,other,61,2017-02-21T21:35:07Z,873,Python Fire is a library for automatically generating command line interfaces (CLIs) from absolutely any Python object.,https://github.com/google/python-fire,https://api.github.com/repos/google/python-fire/languages
jq,C,15611,910,other,524,2012-07-18T19:57:25Z,6658,Command-line JSON processor,https://github.com/stedolan/jq,https://api.github.com/repos/stedolan/jq/languages
Micro8,null,15591,6230,,13,2019-02-18T08:30:52Z,98064,Gitbook,https://github.com/Micropoor/Micro8,https://api.github.com/repos/Micropoor/Micro8/languages
tmux,C,15569,1053,other,5,2015-06-03T23:32:55Z,10695,tmux source code,https://github.com/tmux/tmux,https://api.github.com/repos/tmux/tmux/languages
Daily-Interview-Question,JavaScript,15548,1851,,151,2019-01-19T10:49:00Z,201,我是木易杨，公众号「高级前端进阶」作者，每天搞定一道前端大厂面试题，祝大家天天进步，一年后会看到不一样的自己。,https://github.com/Advanced-Frontend/Daily-Interview-Question,https://api.github.com/repos/Advanced-Frontend/Daily-Interview-Question/languages
sqlmap,Python,15543,3375,other,46,2012-06-26T09:52:15Z,66560,Automatic SQL injection and database takeover tool,https://github.com/sqlmapproject/sqlmap,https://api.github.com/repos/sqlmapproject/sqlmap/languages
plyr,JavaScript,15542,1732,mit,376,2015-02-14T11:33:07Z,43546,"A simple HTML5, YouTube and Vimeo player",https://github.com/sampotts/plyr,https://api.github.com/repos/sampotts/plyr/languages
idiomatic.js,null,15527,2059,other,49,2011-05-25T17:48:59Z,1049,"Principles of Writing Consistent, Idiomatic JavaScript",https://github.com/rwaldron/idiomatic.js,https://api.github.com/repos/rwaldron/idiomatic.js/languages
echo,Go,15496,1432,mit,46,2015-03-01T17:43:01Z,5238,"High performance, minimalist Go web framework",https://github.com/labstack/echo,https://api.github.com/repos/labstack/echo/languages
vue-devtools,JavaScript,15489,2340,mit,184,2014-09-29T03:52:07Z,8598,⚙️ Browser devtools extension for debugging Vue.js applications.,https://github.com/vuejs/vue-devtools,https://api.github.com/repos/vuejs/vue-devtools/languages
Python,Python,15444,7656,mit,108,2011-11-30T09:04:08Z,9908,My Python Examples,https://github.com/geekcomputers/Python,https://api.github.com/repos/geekcomputers/Python/languages
MBProgressHUD,Objective-C,15439,3479,mit,60,2009-05-31T21:45:41Z,1229,MBProgressHUD + Customizations,https://github.com/jdg/MBProgressHUD,https://api.github.com/repos/jdg/MBProgressHUD/languages
source-code-pro,CSS,15414,1303,ofl-1.1,41,2012-08-09T23:14:02Z,128783,Monospaced font family for user interface and coding environments,https://github.com/adobe-fonts/source-code-pro,https://api.github.com/repos/adobe-fonts/source-code-pro/languages
curl,C,15406,3334,other,80,2010-03-18T22:32:22Z,64895,"A command line tool and library for transferring data with URL syntax, supporting HTTP, HTTPS, FTP, FTPS, GOPHER, TFTP, SCP, SFTP, SMB, TELNET, DICT, LDAP, LDAPS, FILE, IMAP, SMTP, POP3, RTSP and RTMP. libcurl offers a myriad of powerful features",https://github.com/curl/curl,https://api.github.com/repos/curl/curl/languages
react-native-guide,null,15398,3625,,3,2015-04-10T03:34:17Z,117,React Native指南汇集了各类react-native学习资源、开源App和组件,https://github.com/reactnativecn/react-native-guide,https://api.github.com/repos/reactnativecn/react-native-guide/languages
coffeescript,CoffeeScript,15356,2010,mit,41,2009-12-18T01:39:53Z,28251,Unfancy JavaScript,https://github.com/jashkenas/coffeescript,https://api.github.com/repos/jashkenas/coffeescript/languages
stackedit,JavaScript,15343,2261,apache-2.0,501,2013-03-24T13:46:06Z,37182,In-browser Markdown editor,https://github.com/benweet/stackedit,https://api.github.com/repos/benweet/stackedit/languages
anko,Kotlin,15330,1209,apache-2.0,244,2014-09-18T12:12:23Z,15224,Pleasant Android application development,https://github.com/Kotlin/anko,https://api.github.com/repos/Kotlin/anko/languages
rocksdb,C++,15314,3383,other,402,2012-11-30T06:16:18Z,144945,"A library that provides an embeddable, persistent key-value store for fast storage.",https://github.com/facebook/rocksdb,https://api.github.com/repos/facebook/rocksdb/languages
docker_practice,Go,15314,4331,,4,2014-09-05T04:06:39Z,11298,"Learn and understand Docker technologies, with real DevOps practice!",https://github.com/yeasy/docker_practice,https://api.github.com/repos/yeasy/docker_practice/languages
kit,Go,15307,1607,mit,61,2015-02-03T00:01:19Z,6932,A standard library for microservices.,https://github.com/go-kit/kit,https://api.github.com/repos/go-kit/kit/languages
macOS-Security-and-Privacy-Guide,Python,15300,1076,mit,3,2015-08-31T03:36:35Z,1298,Guide to securing and improving privacy on macOS,https://github.com/drduh/macOS-Security-and-Privacy-Guide,https://api.github.com/repos/drduh/macOS-Security-and-Privacy-Guide/languages
darknet,C,15297,9514,other,1446,2014-04-11T07:59:16Z,6273,Convolutional Neural Networks,https://github.com/pjreddie/darknet,https://api.github.com/repos/pjreddie/darknet/languages
node-lessons,JavaScript,15294,4781,,92,2014-10-05T09:57:08Z,2070,:closed_book:《Node.js 包教不包会》 by alsotang,https://github.com/alsotang/node-lessons,https://api.github.com/repos/alsotang/node-lessons/languages
apollo,C++,15291,5205,apache-2.0,476,2017-07-04T19:03:31Z,1883825,An open autonomous driving platform,https://github.com/ApolloAuto/apollo,https://api.github.com/repos/ApolloAuto/apollo/languages
eslint,JavaScript,15272,2652,mit,204,2013-06-29T23:59:48Z,23050,A fully pluggable tool for identifying and reporting on patterns in JavaScript,https://github.com/eslint/eslint,https://api.github.com/repos/eslint/eslint/languages
hubot,JavaScript,15244,3580,mit,69,2011-08-27T08:30:59Z,2020,A customizable life embetterment robot.,https://github.com/hubotio/hubot,https://api.github.com/repos/hubotio/hubot/languages
highlight.js,JavaScript,15244,2608,bsd-3-clause,175,2011-01-01T23:47:21Z,9496,Javascript syntax highlighter,https://github.com/highlightjs/highlight.js,https://api.github.com/repos/highlightjs/highlight.js/languages
fks,JavaScript,15241,4561,,11,2012-10-17T05:55:16Z,1764,前端技能汇总 Frontend Knowledge Structure,https://github.com/JacksonTian/fks,https://api.github.com/repos/JacksonTian/fks/languages
awesome-tensorflow,null,15239,2797,cc0-1.0,22,2016-02-27T17:00:27Z,246,TensorFlow - A curated list of dedicated resources http://tensorflow.org,https://github.com/jtoy/awesome-tensorflow,https://api.github.com/repos/jtoy/awesome-tensorflow/languages
awesome-remote-job,null,15222,1546,,2,2015-01-02T00:31:34Z,874,A curated list of awesome remote jobs and resources. Inspired by https://github.com/vinta/awesome-python,https://github.com/lukasz-madon/awesome-remote-job,https://api.github.com/repos/lukasz-madon/awesome-remote-job/languages
obs-studio,C,15215,3152,gpl-2.0,78,2013-10-01T02:40:31Z,31548,OBS Studio - Free and open source software for live streaming and screen recording,https://github.com/obsproject/obs-studio,https://api.github.com/repos/obsproject/obs-studio/languages
phpunit,PHP,15198,1803,other,110,2009-12-24T13:16:23Z,47303,The PHP Unit Testing framework.,https://github.com/sebastianbergmann/phpunit,https://api.github.com/repos/sebastianbergmann/phpunit/languages
bower,JavaScript,15191,1966,mit,204,2012-09-07T00:15:39Z,4380,A package manager for the web,https://github.com/bower/bower,https://api.github.com/repos/bower/bower/languages
mojs,JavaScript,15187,828,mit,55,2014-06-26T08:49:14Z,137853,The motion graphics toolbelt for the web,https://github.com/mojs/mojs,https://api.github.com/repos/mojs/mojs/languages
Kingfisher,Swift,15165,1712,mit,58,2015-04-06T14:26:21Z,21019,"A lightweight, pure-Swift library for downloading and caching images from the web.",https://github.com/onevcat/Kingfisher,https://api.github.com/repos/onevcat/Kingfisher/languages
reddit,Python,15153,2782,other,304,2008-06-18T23:30:53Z,40093,historical code from reddit.com,https://github.com/reddit-archive/reddit,https://api.github.com/repos/reddit-archive/reddit/languages
react-native-web,JavaScript,15148,1245,mit,101,2015-06-09T19:25:38Z,25966,React Native for Web,https://github.com/necolas/react-native-web,https://api.github.com/repos/necolas/react-native-web/languages
mint-ui,Vue,15146,3347,mit,283,2016-05-17T09:54:10Z,3064,Mobile UI elements for Vue.js,https://github.com/ElemeFE/mint-ui,https://api.github.com/repos/ElemeFE/mint-ui/languages
servo,Rust,15124,2277,mpl-2.0,2988,2012-02-08T19:07:25Z,1001989,The Servo Browser Engine,https://github.com/servo/servo,https://api.github.com/repos/servo/servo/languages
wekan,JavaScript,15109,2219,mit,552,2014-01-21T01:26:28Z,17082,"The open-source kanban (built with Meteor). Keep variable/table/field names camelCase. For translations, only add Pull Request changes to wekan/i18n/en.i18n.json , other translations are done at https://transifex.com/wekan/wekan only.",https://github.com/wekan/wekan,https://api.github.com/repos/wekan/wekan/languages
architecture-components-samples,Kotlin,15102,4778,apache-2.0,291,2017-05-09T21:09:14Z,20513,Samples for Android Architecture Components. ,https://github.com/android/architecture-components-samples,https://api.github.com/repos/android/architecture-components-samples/languages
ruby-style-guide,null,15100,3343,,78,2011-09-12T13:03:05Z,1278,A community-driven Ruby coding style guide,https://github.com/rubocop-hq/ruby-style-guide,https://api.github.com/repos/rubocop-hq/ruby-style-guide/languages
blueprint,TypeScript,15100,1410,apache-2.0,428,2016-10-25T21:17:50Z,76969,A React-based UI toolkit for the web,https://github.com/palantir/blueprint,https://api.github.com/repos/palantir/blueprint/languages
uikit,CSS,15094,2141,mit,615,2013-07-18T16:00:26Z,46168,A lightweight and modular front-end framework for developing fast and powerful web interfaces,https://github.com/uikit/uikit,https://api.github.com/repos/uikit/uikit/languages
howler.js,JavaScript,15062,1552,mit,346,2013-01-28T16:47:12Z,31976,Javascript audio library for the modern web.,https://github.com/goldfire/howler.js,https://api.github.com/repos/goldfire/howler.js/languages
spaCy,Python,15044,2630,mit,142,2014-07-03T15:15:40Z,165424,💫 Industrial-strength Natural Language Processing (NLP) with Python and Cython,https://github.com/explosion/spaCy,https://api.github.com/repos/explosion/spaCy/languages
vue-router,JavaScript,15037,4057,mit,186,2013-12-11T19:37:46Z,8583,🚦 The official router for Vue.js.,https://github.com/vuejs/vue-router,https://api.github.com/repos/vuejs/vue-router/languages
generator-jhipster,JavaScript,15035,3041,apache-2.0,111,2013-10-21T20:07:22Z,44592,Open Source application platform for creating Spring Boot + Angular/React projects in seconds!,https://github.com/jhipster/generator-jhipster,https://api.github.com/repos/jhipster/generator-jhipster/languages
graphql-js,JavaScript,15031,1342,mit,98,2015-06-30T12:16:50Z,9026,A reference implementation of GraphQL for JavaScript,https://github.com/graphql/graphql-js,https://api.github.com/repos/graphql/graphql-js/languages
