mostly-adequate-guide-chinese,JavaScript,1670,239,other,7,2015-07-16T15:36:05Z,3893,JS 函数式编程指南中文版,https://github.com/llh911001/mostly-adequate-guide-chinese,https://api.github.com/repos/llh911001/mostly-adequate-guide-chinese/languages
gopl-zh.github.com,Go,1670,547,bsd-3-clause,0,2016-06-20T08:51:06Z,10756,"Go语言圣经中文版(只接收PR, Issue请提交到golang-china/gopl-zh)",https://github.com/gopl-zh/gopl-zh.github.com,https://api.github.com/repos/gopl-zh/gopl-zh.github.com/languages
DotNetOpenAuth,C#,1670,731,other,90,2008-03-21T16:25:42Z,68175,"A C# implementation of the OpenID, OAuth protocols",https://github.com/DotNetOpenAuth/DotNetOpenAuth,https://api.github.com/repos/DotNetOpenAuth/DotNetOpenAuth/languages
guides,null,1670,256,,7,2013-06-30T22:49:30Z,419,A collection of succinct guides - Public Domain,https://github.com/sindresorhus/guides,https://api.github.com/repos/sindresorhus/guides/languages
xabber-android,Java,1670,829,other,262,2013-01-29T12:16:51Z,39485,Open-source XMPP client for Android,https://github.com/redsolution/xabber-android,https://api.github.com/repos/redsolution/xabber-android/languages
UICountingLabel,Objective-C,1670,226,mit,14,2013-02-08T17:07:04Z,191,Adds animated counting support to UILabel. ,https://github.com/dataxpress/UICountingLabel,https://api.github.com/repos/dataxpress/UICountingLabel/languages
node-oracledb,JavaScript,1669,859,other,43,2014-12-30T00:53:54Z,5787,Oracle Database driver for Node.js maintained by Oracle Corp.,https://github.com/oracle/node-oracledb,https://api.github.com/repos/oracle/node-oracledb/languages
XVim2,Objective-C,1669,135,mit,77,2017-09-06T16:15:22Z,4782,Vim key-bindings for Xcode 9,https://github.com/XVimProject/XVim2,https://api.github.com/repos/XVimProject/XVim2/languages
Wormholy,Swift,1669,79,mit,9,2018-04-09T14:11:55Z,1177,"iOS network debugging, like a wizard 🧙‍♂️",https://github.com/pmusolino/Wormholy,https://api.github.com/repos/pmusolino/Wormholy/languages
fnm,OCaml,1669,55,gpl-3.0,19,2019-01-16T13:32:14Z,2390,"🚀 Fast and simple Node.js version manager, built in native ReasonML",https://github.com/Schniz/fnm,https://api.github.com/repos/Schniz/fnm/languages
kedro,Python,1669,140,other,43,2019-04-18T10:29:56Z,11184,A Python library for building robust production-ready data and analytics pipelines.,https://github.com/quantumblacklabs/kedro,https://api.github.com/repos/quantumblacklabs/kedro/languages
lambda-view,JavaScript,1669,136,,12,2016-08-25T08:47:14Z,665,A New Tool for Reading JavaScript Code in 2017,https://github.com/Jianru-Lin/lambda-view,https://api.github.com/repos/Jianru-Lin/lambda-view/languages
zinx,Go,1669,264,gpl-3.0,25,2019-01-23T13:15:31Z,34801,基于Golang轻量级TCP并发服务器框架,https://github.com/aceld/zinx,https://api.github.com/repos/aceld/zinx/languages
awesome-mobx,null,1669,112,,11,2016-12-08T15:10:45Z,228,A collection of awesome things regarding MobX.,https://github.com/mobxjs/awesome-mobx,https://api.github.com/repos/mobxjs/awesome-mobx/languages
PnP,C#,1669,3211,other,79,2014-07-27T02:08:15Z,217527,SharePoint / Office 365 Developer Patterns and Practices,https://github.com/SharePoint/PnP,https://api.github.com/repos/SharePoint/PnP/languages
weixin-robot,JavaScript,1669,592,,2,2012-11-17T16:28:55Z,695,微信公共帐号自动回复机器人 A Node.js robot for wechat.,https://github.com/node-webot/weixin-robot,https://api.github.com/repos/node-webot/weixin-robot/languages
react-ui,JavaScript,1669,344,mit,16,2015-03-16T06:47:36Z,10213,"A collection of components for React, base on bootstrap 4.0. ",https://github.com/Lobos/react-ui,https://api.github.com/repos/Lobos/react-ui/languages
chain,Go,1668,346,agpl-3.0,0,2016-10-24T01:12:26Z,136628,Chain Core Developer Edition (Archive),https://github.com/chain/chain,https://api.github.com/repos/chain/chain/languages
rails-assets,Ruby,1668,71,mit,50,2013-07-06T17:09:37Z,3489,The solution to assets management in Rails,https://github.com/tenex/rails-assets,https://api.github.com/repos/tenex/rails-assets/languages
teletraan,JavaScript,1668,224,apache-2.0,28,2015-12-09T22:08:45Z,14196,Teletraan is Pinterest's deploy system.,https://github.com/pinterest/teletraan,https://api.github.com/repos/pinterest/teletraan/languages
labrador,JavaScript,1668,248,mit,31,2016-09-24T16:25:33Z,84,微信小程序模块化开发框架,https://github.com/maichong/labrador,https://api.github.com/repos/maichong/labrador/languages
tigervnc,C++,1668,403,gpl-2.0,113,2014-06-25T12:48:26Z,20066,"High performance, multi-platform VNC client and server",https://github.com/TigerVNC/tigervnc,https://api.github.com/repos/TigerVNC/tigervnc/languages
knock,Python,1668,444,,47,2014-02-11T14:36:13Z,377,Knock Subdomain Scan,https://github.com/guelfoweb/knock,https://api.github.com/repos/guelfoweb/knock/languages
storyboarder,JavaScript,1668,166,,481,2016-12-22T22:22:59Z,156532,✏️ Storyboarder makes it easy to visualize a story as fast you can draw stick figures.,https://github.com/wonderunit/storyboarder,https://api.github.com/repos/wonderunit/storyboarder/languages
node-ar-drone,JavaScript,1667,432,mit,41,2012-07-21T18:50:20Z,551,A node.js client for controlling Parrot AR Drone 2.0 quad-copters.,https://github.com/felixge/node-ar-drone,https://api.github.com/repos/felixge/node-ar-drone/languages
fast-cli,JavaScript,1667,73,mit,3,2016-05-18T21:24:15Z,1454,Test your download and upload speed using fast.com,https://github.com/sindresorhus/fast-cli,https://api.github.com/repos/sindresorhus/fast-cli/languages
resque-scheduler,Ruby,1667,451,mit,66,2009-12-21T05:24:09Z,1019,A light-weight job scheduling system built on top of Resque,https://github.com/resque/resque-scheduler,https://api.github.com/repos/resque/resque-scheduler/languages
em-websocket,Ruby,1667,198,mit,23,2009-12-21T00:32:43Z,386,EventMachine based WebSocket server,https://github.com/igrigorik/em-websocket,https://api.github.com/repos/igrigorik/em-websocket/languages
football,Python,1667,279,apache-2.0,6,2019-06-03T12:59:44Z,27409,Check out the new game server:,https://github.com/google-research/football,https://api.github.com/repos/google-research/football/languages
react-tiny-virtual-list,TypeScript,1666,99,mit,26,2017-02-27T04:46:57Z,1007,"A tiny but mighty 3kb list virtualization library, with zero dependencies 💪 Supports variable heights/widths, sticky items, scrolling to index, and more!",https://github.com/clauderic/react-tiny-virtual-list,https://api.github.com/repos/clauderic/react-tiny-virtual-list/languages
folktale,JavaScript,1666,93,mit,26,2015-05-11T22:51:55Z,3371,A standard library for functional programming in JavaScript,https://github.com/origamitower/folktale,https://api.github.com/repos/origamitower/folktale/languages
html5sortable,HTML,1666,408,,2,2012-01-27T23:43:41Z,416,Lightweight jQuery plugin to create sortable lists and grids using native HTML5 drag and drop API.,https://github.com/farhadi/html5sortable,https://api.github.com/repos/farhadi/html5sortable/languages
software-development-kit,Shell,1666,261,,30,2013-04-13T13:28:39Z,101768,"Meteor for FDA, HIPPA, and HL7 compliant applications!",https://github.com/clinical-meteor/software-development-kit,https://api.github.com/repos/clinical-meteor/software-development-kit/languages
kubeapps,TypeScript,1666,292,apache-2.0,104,2017-10-19T14:14:34Z,53691,A web-based UI for deploying and managing applications in Kubernetes clusters,https://github.com/kubeapps/kubeapps,https://api.github.com/repos/kubeapps/kubeapps/languages
vue-color,Vue,1666,247,mit,35,2016-04-22T09:02:18Z,6244,":art: Vue Color Pickers for Sketch, Photoshop, Chrome & more   http://vue-color.surge.sh",https://github.com/xiaokaike/vue-color,https://api.github.com/repos/xiaokaike/vue-color/languages
TypeScript-React-Native-Starter,Objective-C,1666,171,mit,40,2017-05-09T19:57:43Z,240,A starter template for TypeScript and React Native with a detailed README describing how to use the two together.,https://github.com/microsoft/TypeScript-React-Native-Starter,https://api.github.com/repos/microsoft/TypeScript-React-Native-Starter/languages
gitgraph.js,TypeScript,1666,264,mit,34,2013-08-14T09:46:20Z,5641,👋 [Looking for maintainers] - A JavaScript library to draw pretty git graphs in the browser,https://github.com/nicoespeon/gitgraph.js,https://api.github.com/repos/nicoespeon/gitgraph.js/languages
x0,JavaScript,1666,70,mit,34,2017-09-13T02:00:34Z,23882,Document & develop React components without breaking a sweat,https://github.com/c8r/x0,https://api.github.com/repos/c8r/x0/languages
APIKit,Swift,1665,173,other,13,2015-02-18T14:16:16Z,1388,Type-safe networking abstraction layer that associates request type with response type.,https://github.com/ishkawa/APIKit,https://api.github.com/repos/ishkawa/APIKit/languages
EBPhotoPages,Objective-C,1665,202,mit,18,2014-04-05T00:21:48Z,24429,A photo gallery for iOS with a modern feature set. Similar features as the Facebook photo browser.,https://github.com/EddyBorja/EBPhotoPages,https://api.github.com/repos/EddyBorja/EBPhotoPages/languages
expression-language,PHP,1671,29,mit,0,2013-09-20T09:40:38Z,377,The ExpressionLanguage component provides an engine that can compile and evaluate expressions.,https://github.com/symfony/expression-language,https://api.github.com/repos/symfony/expression-language/languages
azure-powershell,C#,1665,1779,other,684,2014-09-10T20:35:18Z,1189406,Microsoft Azure PowerShell,https://github.com/Azure/azure-powershell,https://api.github.com/repos/Azure/azure-powershell/languages
artoolkit5,C++,1665,715,other,137,2015-05-13T04:11:46Z,463567,ARToolKit v5.x,https://github.com/artoolkit/artoolkit5,https://api.github.com/repos/artoolkit/artoolkit5/languages
Scrollify,JavaScript,1665,550,mit,125,2014-06-08T10:17:36Z,200,A jQuery plugin that assists scrolling and snaps to sections.,https://github.com/lukehaas/Scrollify,https://api.github.com/repos/lukehaas/Scrollify/languages
Avgrund,HTML,1665,338,mit,1,2012-08-18T05:13:11Z,15,A JS/CSS3 modal UI concept,https://github.com/hakimel/Avgrund,https://api.github.com/repos/hakimel/Avgrund/languages
Parse-SDK-Android,Java,1665,702,other,94,2015-08-12T22:57:48Z,1898,Parse SDK for Android,https://github.com/parse-community/Parse-SDK-Android,https://api.github.com/repos/parse-community/Parse-SDK-Android/languages
csurf,JavaScript,1665,160,mit,23,2014-03-05T06:45:25Z,156,CSRF token middleware,https://github.com/expressjs/csurf,https://api.github.com/repos/expressjs/csurf/languages
ARSegmentPager,Objective-C,1665,267,mit,22,2015-04-21T03:26:51Z,11061,segment tab controller with parallax Header,https://github.com/AugustRush/ARSegmentPager,https://api.github.com/repos/AugustRush/ARSegmentPager/languages
awesome-devenv,null,1665,120,,2,2014-07-10T08:46:00Z,106,"A curated list of awesome tools, resources and workflow tips making an awesome development environment.",https://github.com/jondot/awesome-devenv,https://api.github.com/repos/jondot/awesome-devenv/languages
ngTagsInput,JavaScript,1665,589,mit,156,2013-07-12T02:52:34Z,3192,Tags input directive for AngularJS,https://github.com/mbenford/ngTagsInput,https://api.github.com/repos/mbenford/ngTagsInput/languages
sshtron,Go,1665,86,mit,5,2016-03-06T03:15:11Z,458,Play Tron over SSH,https://github.com/zachlatta/sshtron,https://api.github.com/repos/zachlatta/sshtron/languages
Guiders-JS,JavaScript,1665,190,,24,2011-06-03T21:02:07Z,542,Guiders.js: A Javascript library for guiders.,https://github.com/pickhardt/Guiders-JS,https://api.github.com/repos/pickhardt/Guiders-JS/languages
BigGAN-PyTorch,Python,1665,220,mit,10,2019-01-20T18:50:49Z,5727,The author's officially unofficial PyTorch BigGAN implementation.,https://github.com/ajbrock/BigGAN-PyTorch,https://api.github.com/repos/ajbrock/BigGAN-PyTorch/languages
Bender,Swift,1664,91,other,19,2017-05-03T20:52:12Z,72720,Easily craft fast Neural Networks on iOS! Use TensorFlow models. Metal under the hood.,https://github.com/xmartlabs/Bender,https://api.github.com/repos/xmartlabs/Bender/languages
twython,Python,1664,388,mit,84,2009-04-02T05:01:31Z,2754,"Actively maintained, pure Python wrapper for the Twitter API. Supports both normal and streaming Twitter APIs.",https://github.com/ryanmcgrath/twython,https://api.github.com/repos/ryanmcgrath/twython/languages
decent_exposure,Ruby,1664,99,mit,13,2010-01-12T02:47:04Z,380,A helper for creating declarative interfaces in controllers,https://github.com/hashrocket/decent_exposure,https://api.github.com/repos/hashrocket/decent_exposure/languages
QuantLib,C++,1664,818,other,52,2015-12-17T16:29:33Z,62582,The QuantLib C++ library,https://github.com/lballabio/QuantLib,https://api.github.com/repos/lballabio/QuantLib/languages
elasticsearch-ruby,Ruby,1664,478,apache-2.0,21,2013-05-03T07:39:25Z,4201,Ruby integrations for Elasticsearch,https://github.com/elastic/elasticsearch-ruby,https://api.github.com/repos/elastic/elasticsearch-ruby/languages
Just-Another-Android-App,Java,1664,191,apache-2.0,3,2017-02-11T19:51:07Z,2232,An Android base app with loads of cool libraries/configuration,https://github.com/athkalia/Just-Another-Android-App,https://api.github.com/repos/athkalia/Just-Another-Android-App/languages
babel-plugin-macros,JavaScript,1664,96,mit,8,2017-07-07T00:48:46Z,286,🎣 Allows you to build simple compile-time libraries,https://github.com/kentcdodds/babel-plugin-macros,https://api.github.com/repos/kentcdodds/babel-plugin-macros/languages
TranslateApp,Java,1664,385,other,14,2016-02-26T06:10:35Z,1384,":memo: A translations app without interruptions, copy words and translate directly, show result by top view.",https://github.com/maoruibin/TranslateApp,https://api.github.com/repos/maoruibin/TranslateApp/languages
core.async,Clojure,1664,182,,2,2013-05-15T15:43:16Z,1215,Facilities for async programming and communication in Clojure,https://github.com/clojure/core.async,https://api.github.com/repos/clojure/core.async/languages
tmi,JavaScript,1664,60,apache-2.0,6,2014-10-31T12:01:59Z,267,TMI (Too Many Images) - discover your image weight on the web,https://github.com/addyosmani/tmi,https://api.github.com/repos/addyosmani/tmi/languages
ansible-tuto,Shell,1664,474,other,10,2013-03-06T13:27:18Z,313,Ansible tutorial,https://github.com/leucos/ansible-tuto,https://api.github.com/repos/leucos/ansible-tuto/languages
noobs,Makefile,1663,373,,58,2013-06-03T16:17:32Z,81074,NOOBS (New Out Of Box Software) - An easy Operating System install manager for the Raspberry Pi,https://github.com/raspberrypi/noobs,https://api.github.com/repos/raspberrypi/noobs/languages
nsp,JavaScript,1663,139,apache-2.0,44,2015-06-29T21:51:59Z,383,node security platform command-line tool,https://github.com/nodesecurity/nsp,https://api.github.com/repos/nodesecurity/nsp/languages
it-ebooks-cn,null,1663,501,,0,2015-06-26T23:11:27Z,208,计算机电子书pdf整理,https://github.com/fuhmmin/it-ebooks-cn,https://api.github.com/repos/fuhmmin/it-ebooks-cn/languages
amazon-freertos,C,1663,637,mit,46,2017-11-09T21:53:47Z,211655,IoT operating system for microcontrollers.,https://github.com/aws/amazon-freertos,https://api.github.com/repos/aws/amazon-freertos/languages
renpy,Ren'Py,1662,292,,132,2012-06-28T01:21:22Z,193638,The Ren'Py Visual Novel Engine,https://github.com/renpy/renpy,https://api.github.com/repos/renpy/renpy/languages
badssl.com,HTML,1662,126,apache-2.0,158,2015-04-07T22:37:47Z,6744,:lock: Memorable site for testing clients against bad SSL configs.,https://github.com/chromium/badssl.com,https://api.github.com/repos/chromium/badssl.com/languages
Charles-Crack,Kotlin,1662,403,gpl-3.0,4,2018-03-25T06:37:33Z,105,Charles 破解工具,https://github.com/8enet/Charles-Crack,https://api.github.com/repos/8enet/Charles-Crack/languages
searchable,PHP,1662,230,mit,93,2014-06-17T05:53:45Z,111,A php trait to search laravel models,https://github.com/nicolaslopezj/searchable,https://api.github.com/repos/nicolaslopezj/searchable/languages
container.training,Python,1662,998,other,15,2015-06-07T04:03:19Z,25667,"Slides and code samples for training, tutorials, and workshops about containers.",https://github.com/jpetazzo/container.training,https://api.github.com/repos/jpetazzo/container.training/languages
httprunner,Python,1662,649,apache-2.0,199,2017-06-13T03:54:29Z,27817,One-stop solution for HTTP(S) testing.,https://github.com/httprunner/httprunner,https://api.github.com/repos/httprunner/httprunner/languages
bookdown,R,1662,753,,100,2015-10-28T05:03:18Z,15471,Authoring Books and Technical Documents with R Markdown,https://github.com/rstudio/bookdown,https://api.github.com/repos/rstudio/bookdown/languages
springy,JavaScript,1661,247,mit,24,2010-04-16T02:19:49Z,590,A force directed graph layout algorithm in JavaScript,https://github.com/dhotson/springy,https://api.github.com/repos/dhotson/springy/languages
react-email-editor,JavaScript,1661,229,mit,38,2017-10-01T22:44:29Z,347,Drag-n-Drop Email Editor Component for React.js,https://github.com/unlayer/react-email-editor,https://api.github.com/repos/unlayer/react-email-editor/languages
rake,Ruby,1661,524,mit,45,2014-05-21T21:11:31Z,3693,A make-like build utility for Ruby.,https://github.com/ruby/rake,https://api.github.com/repos/ruby/rake/languages
StaggeredGridView,Java,1661,706,,47,2012-12-12T23:12:15Z,808,"A modified version of Android's experimental StaggeredGridView. Includes own OnItemClickListener and OnItemLongClickListener, selector, and fixed position restore.",https://github.com/maurycyw/StaggeredGridView,https://api.github.com/repos/maurycyw/StaggeredGridView/languages
node-geoip,JavaScript,1661,311,other,21,2011-08-05T01:12:45Z,472034,"Native NodeJS implementation of MaxMind's GeoIP API -- works in node 0.6.3 and above, ask me about other versions",https://github.com/bluesmoon/node-geoip,https://api.github.com/repos/bluesmoon/node-geoip/languages
docker-pi-hole,Python,1661,326,,112,2016-02-02T04:33:35Z,737,Pi-hole in a docker container,https://github.com/pi-hole/docker-pi-hole,https://api.github.com/repos/pi-hole/docker-pi-hole/languages
mapbox.js,HTML,1661,370,other,84,2012-07-03T18:22:56Z,9499,"Mapbox JavaScript API, a Leaflet Plugin",https://github.com/mapbox/mapbox.js,https://api.github.com/repos/mapbox/mapbox.js/languages
sticky-sidebar,JavaScript,1660,347,mit,39,2017-05-10T17:06:24Z,262,😎 Pure JavaScript tool for making smart and high performance sticky sidebar. ,https://github.com/abouolia/sticky-sidebar,https://api.github.com/repos/abouolia/sticky-sidebar/languages
TinyCrayon-iOS-SDK,Swift,1660,131,mit,24,2017-02-15T03:28:34Z,1574,A smart and easy-to-use image masking and cutout SDK for mobile apps.,https://github.com/TinyCrayon/TinyCrayon-iOS-SDK,https://api.github.com/repos/TinyCrayon/TinyCrayon-iOS-SDK/languages
HotFix,Java,1660,450,mit,16,2015-11-03T19:22:22Z,384,安卓App热补丁动态修复框架,https://github.com/dodola/HotFix,https://api.github.com/repos/dodola/HotFix/languages
developer,Makefile,1660,350,cc0-1.0,0,2015-02-28T15:01:11Z,1788,developer roadmap. use growth https://github.com/phodal/growth replace this,https://github.com/phodal/developer,https://api.github.com/repos/phodal/developer/languages
test-kitchen,Ruby,1660,546,other,129,2012-04-25T14:14:42Z,6470,Test Kitchen is an integration tool for developing and testing infrastructure code and software on isolated target platforms.,https://github.com/test-kitchen/test-kitchen,https://api.github.com/repos/test-kitchen/test-kitchen/languages
