blog,null,2590,466,,10,2017-09-01T05:42:02Z,11,个人技术博客，博文写在 Issues 里。,https://github.com/brickspert/blog,https://api.github.com/repos/brickspert/blog/languages
pyflame,C++,2590,182,apache-2.0,34,2016-08-09T18:35:37Z,374,🔥 Pyflame: A Ptracing Profiler For Python,https://github.com/uber/pyflame,https://api.github.com/repos/uber/pyflame/languages
redux-orm,JavaScript,2590,100,mit,56,2015-11-23T04:25:26Z,7244,"A small, simple and immutable ORM to manage relational data in your Redux store.",https://github.com/redux-orm/redux-orm,https://api.github.com/repos/redux-orm/redux-orm/languages
chinese_docker,null,2589,680,,5,2014-07-13T09:09:39Z,3327,docker中文文档，docker Chinese Documation,https://github.com/widuu/chinese_docker,https://api.github.com/repos/widuu/chinese_docker/languages
angular-google-maps,CoffeeScript,2589,1093,,337,2012-08-16T12:50:47Z,95582,AngularJS directives for the Google Maps Javascript API,https://github.com/angular-ui/angular-google-maps,https://api.github.com/repos/angular-ui/angular-google-maps/languages
indentLine,Vim script,2589,162,mit,40,2012-11-27T16:52:11Z,117,A vim plugin to display the indention levels with thin vertical lines,https://github.com/Yggdroot/indentLine,https://api.github.com/repos/Yggdroot/indentLine/languages
toxy,JavaScript,2588,98,mit,14,2015-07-29T22:51:42Z,295,Hackable HTTP proxy for resiliency testing and simulated network conditions,https://github.com/h2non/toxy,https://api.github.com/repos/h2non/toxy/languages
ysoserial,Java,2588,793,mit,35,2015-01-28T07:13:55Z,312,A proof-of-concept tool for generating payloads that exploit unsafe Java object deserialization.,https://github.com/frohoff/ysoserial,https://api.github.com/repos/frohoff/ysoserial/languages
pyod,Python,2588,516,bsd-2-clause,36,2017-10-03T20:29:04Z,36155,A Python Toolbox for Scalable Outlier Detection (Anomaly Detection),https://github.com/yzhao062/pyod,https://api.github.com/repos/yzhao062/pyod/languages
elasticsearch-rails,Ruby,2588,673,apache-2.0,122,2013-11-08T17:00:19Z,5439,Elasticsearch integrations for ActiveModel/Record and Ruby on Rails,https://github.com/elastic/elasticsearch-rails,https://api.github.com/repos/elastic/elasticsearch-rails/languages
recaptcha,PHP,2588,679,bsd-3-clause,39,2014-09-30T18:30:39Z,247,"PHP client library for reCAPTCHA, a free service to protect your website from spam and abuse.",https://github.com/google/recaptcha,https://api.github.com/repos/google/recaptcha/languages
koa-guide,null,2587,374,mit,3,2013-12-23T06:52:07Z,68,koa guide in Chinese,https://github.com/guo-yu/koa-guide,https://api.github.com/repos/guo-yu/koa-guide/languages
Inkpad,Objective-C,2587,483,mpl-2.0,85,2013-10-08T16:47:52Z,12379,Vector illustration app for the iPad.,https://github.com/sprang/Inkpad,https://api.github.com/repos/sprang/Inkpad/languages
lda2vec,Python,2587,544,mit,59,2015-12-25T00:40:49Z,14096,null,https://github.com/cemoody/lda2vec,https://api.github.com/repos/cemoody/lda2vec/languages
udemy-downloader-gui,JavaScript,2587,607,mit,174,2017-10-27T06:50:49Z,2070,A desktop application for downloading Udemy Courses,https://github.com/FaisalUmair/udemy-downloader-gui,https://api.github.com/repos/FaisalUmair/udemy-downloader-gui/languages
Infosec_Reference,null,2587,576,mit,1,2014-09-13T00:08:18Z,12774,An Information Security Reference That Doesn't Suck,https://github.com/rmusser01/Infosec_Reference,https://api.github.com/repos/rmusser01/Infosec_Reference/languages
cannon.js,JavaScript,2587,387,other,173,2012-01-04T06:46:35Z,8740,A lightweight 3D physics engine written in JavaScript.,https://github.com/schteppe/cannon.js,https://api.github.com/repos/schteppe/cannon.js/languages
apprise,Python,2587,73,mit,4,2017-11-25T18:06:38Z,1884,Apprise - Push Notifications that work with just about every platform!,https://github.com/caronc/apprise,https://api.github.com/repos/caronc/apprise/languages
isomer,JavaScript,2587,139,mit,27,2014-04-07T23:02:18Z,611,Simple isometric graphics library for HTML5 canvas,https://github.com/jdan/isomer,https://api.github.com/repos/jdan/isomer/languages
fenix,Kotlin,2587,323,mpl-2.0,1195,2018-03-22T09:55:43Z,26697,Firefox Preview,https://github.com/mozilla-mobile/fenix,https://api.github.com/repos/mozilla-mobile/fenix/languages
interesting-python,Jupyter Notebook,2586,956,,17,2018-03-16T02:54:02Z,45878,有趣的Python爬虫和Python数据分析小项目(Some interesting Python crawlers and data analysis projects),https://github.com/Alfred1984/interesting-python,https://api.github.com/repos/Alfred1984/interesting-python/languages
vuejs-component-style-guide,null,2586,320,,7,2017-01-04T10:34:05Z,236,Vue.js Component Style Guide,https://github.com/pablohpsilva/vuejs-component-style-guide,https://api.github.com/repos/pablohpsilva/vuejs-component-style-guide/languages
Quantum,PowerShell,2586,492,mit,20,2017-11-08T23:24:33Z,25891,Microsoft Quantum Development Kit Samples,https://github.com/microsoft/Quantum,https://api.github.com/repos/microsoft/Quantum/languages
rustfmt,Rust,2586,451,other,303,2015-03-07T22:51:56Z,10296,Format Rust code,https://github.com/rust-lang/rustfmt,https://api.github.com/repos/rust-lang/rustfmt/languages
pushpin,C++,2585,103,agpl-3.0,15,2012-08-29T04:53:56Z,3328,Reverse proxy for realtime web services,https://github.com/fanout/pushpin,https://api.github.com/repos/fanout/pushpin/languages
typestyle,TypeScript,2585,84,mit,21,2016-10-13T23:50:52Z,752,Making CSS Typesafe 🌹,https://github.com/typestyle/typestyle,https://api.github.com/repos/typestyle/typestyle/languages
the_platinum_searcher,Go,2584,123,mit,42,2014-01-02T13:43:20Z,1496,A code search tool similar to ack and the_silver_searcher(ag). It supports multi platforms and multi encodings.,https://github.com/monochromegane/the_platinum_searcher,https://api.github.com/repos/monochromegane/the_platinum_searcher/languages
juliusjs,JavaScript,2584,193,other,15,2014-07-10T08:11:34Z,3106,A speech recognition library for the web,https://github.com/zzmp/juliusjs,https://api.github.com/repos/zzmp/juliusjs/languages
SVG-Morpheus,JavaScript,2583,233,mit,11,2014-11-24T07:14:03Z,91,JavaScript library enabling SVG icons to morph from one to the other. It implements Material Design's Delightful Details transitions. (THIS PROJECT IS NOT MAINTAINED ANYMORE),https://github.com/alexk111/SVG-Morpheus,https://api.github.com/repos/alexk111/SVG-Morpheus/languages
coconut,Python,2583,81,apache-2.0,71,2014-10-04T23:43:11Z,4561,"Simple, elegant, Pythonic functional programming.",https://github.com/evhub/coconut,https://api.github.com/repos/evhub/coconut/languages
hmily,Java,2583,950,apache-2.0,60,2017-09-28T06:29:01Z,1625,高性能异步分布式事务TCC框架,https://github.com/Dromara/hmily,https://api.github.com/repos/Dromara/hmily/languages
slack,Go,2583,612,bsd-2-clause,40,2015-01-24T14:19:00Z,937,Slack API in Go,https://github.com/nlopes/slack,https://api.github.com/repos/nlopes/slack/languages
flow.js,JavaScript,2583,333,mit,106,2013-09-07T08:32:32Z,649,"A JavaScript library providing multiple simultaneous, stable, fault-tolerant and resumable/restartable file uploads via the HTML5 File API.",https://github.com/flowjs/flow.js,https://api.github.com/repos/flowjs/flow.js/languages
tessdata,null,2583,913,apache-2.0,43,2015-04-12T22:50:47Z,3333946,null,https://github.com/tesseract-ocr/tessdata,https://api.github.com/repos/tesseract-ocr/tessdata/languages
Vue-Socket.io,JavaScript,2583,318,mit,15,2016-05-06T13:51:00Z,360,😻Socket.io implementation for Vuejs and Vuex,https://github.com/MetinSeylan/Vue-Socket.io,https://api.github.com/repos/MetinSeylan/Vue-Socket.io/languages
SIAlertView,Objective-C,2583,448,mit,79,2013-05-03T07:48:23Z,939,An UIAlertView replacement with block syntax and fancy transition styles.,https://github.com/Sumi-Interactive/SIAlertView,https://api.github.com/repos/Sumi-Interactive/SIAlertView/languages
zerolog,Go,2583,179,mit,38,2017-05-12T05:24:39Z,884,Zero Allocation JSON Logger,https://github.com/rs/zerolog,https://api.github.com/repos/rs/zerolog/languages
modern-normalize,CSS,2583,119,mit,13,2018-02-08T05:31:02Z,248,🐒 Normalize browsers' default style,https://github.com/sindresorhus/modern-normalize,https://api.github.com/repos/sindresorhus/modern-normalize/languages
ReactNativeReduxCasts,JavaScript,2582,1383,,6,2016-09-19T16:57:30Z,349,Companion Repo for The Complete React Native and Redux Course,https://github.com/StephenGrider/ReactNativeReduxCasts,https://api.github.com/repos/StephenGrider/ReactNativeReduxCasts/languages
huey,Python,2582,248,mit,0,2011-11-03T16:39:43Z,3365,a little task queue for python,https://github.com/coleifer/huey,https://api.github.com/repos/coleifer/huey/languages
fbs,Python,2582,93,gpl-3.0,26,2017-12-15T09:07:55Z,519,Create Python GUIs with Qt in minutes,https://github.com/mherrmann/fbs,https://api.github.com/repos/mherrmann/fbs/languages
pixel,Go,2581,151,mit,33,2016-11-19T11:15:34Z,12404,A hand-crafted 2D game library in Go,https://github.com/faiface/pixel,https://api.github.com/repos/faiface/pixel/languages
mpc-hc,C,2581,835,gpl-3.0,18,2012-07-25T15:04:04Z,114821,MPC-HC's main repository.  For support use our Trac: https://trac.mpc-hc.org/,https://github.com/mpc-hc/mpc-hc,https://api.github.com/repos/mpc-hc/mpc-hc/languages
fake-s3,Ruby,2581,342,,110,2012-04-13T01:03:08Z,217,A lightweight server clone of Amazon S3 that simulates most of the commands supported by S3 with minimal dependencies,https://github.com/jubos/fake-s3,https://api.github.com/repos/jubos/fake-s3/languages
vuera,JavaScript,2581,119,mit,37,2017-09-27T21:26:27Z,218,":eyes: Vue in React, React in Vue. Seamless integration of the two. :dancers:",https://github.com/akxcv/vuera,https://api.github.com/repos/akxcv/vuera/languages
touchbar_nyancat,Swift,2580,118,,13,2016-11-05T22:24:53Z,7059,Stupid nyancat animation on your +$2k MacBook Pro's Touchbar,https://github.com/avatsaev/touchbar_nyancat,https://api.github.com/repos/avatsaev/touchbar_nyancat/languages
mootools-core,JavaScript,2580,541,,74,2008-04-21T16:58:56Z,7908,MooTools Core Repository,https://github.com/mootools/mootools-core,https://api.github.com/repos/mootools/mootools-core/languages
PHP-MySQLi-Database-Class,PHP,2580,1105,other,139,2010-10-23T15:19:38Z,606,"Wrapper for a PHP MySQL class, which utilizes MySQLi and prepared statements. ",https://github.com/ThingEngineer/PHP-MySQLi-Database-Class,https://api.github.com/repos/ThingEngineer/PHP-MySQLi-Database-Class/languages
pagedraw,CoffeeScript,2580,301,mit,10,2019-01-12T20:13:39Z,50570,a UI builder for React web apps,https://github.com/Pagedraw/pagedraw,https://api.github.com/repos/Pagedraw/pagedraw/languages
iOS-Framework,Shell,2580,300,,32,2012-02-02T22:02:50Z,2101,"How to create, develop, and distribute iOS Static Frameworks quickly and efficiently",https://github.com/jverkoey/iOS-Framework,https://api.github.com/repos/jverkoey/iOS-Framework/languages
mescroll,HTML,2580,664,mit,24,2017-07-15T10:22:21Z,12264,"精致的下拉刷新和上拉加载 js框架.支持vue,完美运行于移动端和主流PC浏览器 (JS framework for pull-refresh and pull-up-loading)",https://github.com/mescroll/mescroll,https://api.github.com/repos/mescroll/mescroll/languages
vuefire,TypeScript,2580,202,mit,16,2016-01-07T22:57:53Z,3433,🔥 Firebase bindings for Vue.js & Vuex,https://github.com/vuejs/vuefire,https://api.github.com/repos/vuejs/vuefire/languages
