openmv,C,1100,489,mit,9,2013-11-13T10:23:44Z,375459,OpenMV Camera Module,https://github.com/openmv/openmv,https://api.github.com/repos/openmv/openmv/languages
suave,F#,1100,199,other,30,2010-07-03T15:26:06Z,16427,Suave is a simple web development F# library providing a lightweight web server and a set of combinators to manipulate route flow and task composition.,https://github.com/SuaveIO/suave,https://api.github.com/repos/SuaveIO/suave/languages
yi-hack,Shell,1100,265,,160,2016-03-09T21:17:51Z,11517,Xiaomi Yi Ants camera hack,https://github.com/fritz-smh/yi-hack,https://api.github.com/repos/fritz-smh/yi-hack/languages
loss-landscape,Python,1100,139,mit,11,2018-03-16T04:01:12Z,8349,Code for visualizing the loss landscape of neural nets,https://github.com/tomgoldstein/loss-landscape,https://api.github.com/repos/tomgoldstein/loss-landscape/languages
repo,Java,1100,261,,4,2016-10-11T15:43:06Z,7393,ğŸ“’ è®°å½•ä¸€ä¸ªè‡ªå·±çš„çŸ¥è¯†åº“,https://github.com/suzeyu1992/repo,https://api.github.com/repos/suzeyu1992/repo/languages
SingleFile,JavaScript,1100,140,agpl-3.0,7,2010-09-12T23:50:21Z,331165,Web Extension for Firefox/Chrome and CLI tool to save a faithful copy of a complete web page as a single HTML file,https://github.com/gildas-lormeau/SingleFile,https://api.github.com/repos/gildas-lormeau/SingleFile/languages
class-loader,PHP,1102,49,mit,1,2011-02-22T17:56:22Z,610,[DEPRECATED] The ClassLoader component provides tools to autoload your classes and cache their locations for performance.,https://github.com/symfony/class-loader,https://api.github.com/repos/symfony/class-loader/languages
memviz,Go,1100,35,mit,15,2017-11-17T20:43:14Z,53,Visualize your Go data structures using graphviz,https://github.com/bradleyjkemp/memviz,https://api.github.com/repos/bradleyjkemp/memviz/languages
semistandard,JavaScript,1100,67,mit,4,2015-01-27T22:14:26Z,206,:icecream: All the goodness of `standard/standard` with semicolons sprinkled on top.,https://github.com/standard/semistandard,https://api.github.com/repos/standard/semistandard/languages
QilinBaoleiji,C,1100,130,gpl-3.0,2,2017-10-23T06:02:57Z,46494,å ¡å’æœº-éº’éºŸå ¡å’æœºï¼Œé›†å ¡å’æœºã€SSLVPN-å ¡å’æœºå†…ç½®ã€åŠ¨æ€å£ä»¤-å ¡å’æœºå†…ç½®ã€åº”ç”¨å®¡è®¡-å ¡å’æœºå†…ç½®ã€æ•°æ®åº“å®¡è®¡-å ¡å’æœºå†…ç½®ã€CAè¯ä¹¦-å ¡å’æœºå†…ç½®-å ¡å’æœºå†…ç½®ã€äº‘æ¡Œé¢-å ¡å’æœºå†…ç½®ã€å¯†ç è‡ªåŠ¨ä¿®æ”¹ä¸ºä¸€ä½“çš„å ¡å’æœºç³»ç»Ÿ,https://github.com/baoleiji/QilinBaoleiji,https://api.github.com/repos/baoleiji/QilinBaoleiji/languages
SoundScrape,Python,1100,111,mit,96,2013-12-29T22:32:46Z,229,SoundCloud (and Bandcamp and Mixcloud) downloader in Python. ,https://github.com/Miserlou/SoundScrape,https://api.github.com/repos/Miserlou/SoundScrape/languages
jquery-throttle-debounce,JavaScript,1100,185,other,14,2010-03-06T17:34:34Z,379,"jQuery throttle / debounce: Sometimes, less is more!",https://github.com/cowboy/jquery-throttle-debounce,https://api.github.com/repos/cowboy/jquery-throttle-debounce/languages
vagrant-hostsupdater,Ruby,1100,121,mit,33,2013-04-28T11:40:48Z,112,null,https://github.com/cogitatio/vagrant-hostsupdater,https://api.github.com/repos/cogitatio/vagrant-hostsupdater/languages
book-example,JavaScript,1100,458,other,4,2013-02-09T22:06:58Z,2874,Example code for my book on TDD with Python,https://github.com/hjwp/book-example,https://api.github.com/repos/hjwp/book-example/languages
FCN.tensorflow,Jupyter Notebook,1100,515,mit,20,2016-10-06T02:54:13Z,1103,Tensorflow implementation of Fully Convolutional Networks for Semantic Segmentation (http://fcn.berkeleyvision.org),https://github.com/shekkizh/FCN.tensorflow,https://api.github.com/repos/shekkizh/FCN.tensorflow/languages
eos,C++,1100,415,apache-2.0,27,2015-02-10T16:09:02Z,14138,A lightweight 3D Morphable Face Model fitting library in modern C++14,https://github.com/patrikhuber/eos,https://api.github.com/repos/patrikhuber/eos/languages
search-script-scrape,Python,1100,211,,0,2015-06-07T23:08:06Z,283,101 real world web scraping exercises in Python 3 for data journalists,https://github.com/stanfordjournalism/search-script-scrape,https://api.github.com/repos/stanfordjournalism/search-script-scrape/languages
elixir,JavaScript,1100,266,,78,2014-10-03T06:59:04Z,670,Fluent API for Gulp.,https://github.com/laravel/elixir,https://api.github.com/repos/laravel/elixir/languages
pretty-quick,JavaScript,1100,43,mit,8,2018-01-07T16:23:17Z,230,âš¡ Get Pretty Quick,https://github.com/azz/pretty-quick,https://api.github.com/repos/azz/pretty-quick/languages
crunz,PHP,1100,113,mit,16,2016-04-12T20:54:02Z,704,A PHP-based job scheduler,https://github.com/lavary/crunz,https://api.github.com/repos/lavary/crunz/languages
algorithm-archive,Assembly,1099,223,mit,74,2017-02-11T11:52:40Z,14752,A collaborative book on algorithms,https://github.com/algorithm-archivists/algorithm-archive,https://api.github.com/repos/algorithm-archivists/algorithm-archive/languages
crown,C,1099,90,mit,5,2012-08-07T00:07:40Z,215426,The flexible game engine.,https://github.com/dbartolini/crown,https://api.github.com/repos/dbartolini/crown/languages
phpstorm-laravel-live-templates,null,1099,154,unlicense,1,2014-03-04T10:55:20Z,856,Laravel Live Templates for PhpStorm,https://github.com/koomai/phpstorm-laravel-live-templates,https://api.github.com/repos/koomai/phpstorm-laravel-live-templates/languages
Scientist.net,C#,1099,98,mit,10,2016-02-04T10:24:00Z,1608,A .NET library for carefully refactoring critical paths. It's a port of GitHub's Ruby Scientist library,https://github.com/scientistproject/Scientist.net,https://api.github.com/repos/scientistproject/Scientist.net/languages
more-itertools,Python,1099,109,mit,3,2012-04-26T05:15:14Z,1024,"More routines for operating on iterables, beyond itertools",https://github.com/erikrose/more-itertools,https://api.github.com/repos/erikrose/more-itertools/languages
pytorch-qrnn,Python,1099,164,bsd-3-clause,20,2017-09-27T20:16:39Z,73,PyTorch implementation of the Quasi-Recurrent Neural Network - up to 16 times faster than NVIDIA's cuDNN LSTM,https://github.com/salesforce/pytorch-qrnn,https://api.github.com/repos/salesforce/pytorch-qrnn/languages
Attabench,Swift,1099,34,mit,5,2017-02-25T19:59:14Z,7661,Microbenchmarking app for Swift with nice log-log plots,https://github.com/attaswift/Attabench,https://api.github.com/repos/attaswift/Attabench/languages
LevelEditor,C#,1099,216,apache-2.0,18,2014-06-24T19:09:18Z,76589,"The ATF LevelEditor is a powerful tool for constructing and assembling game levels. It provides a WYSIWYG interface and allows you to place objects, edit properties, edit terrain, and build game levels.",https://github.com/SonyWWS/LevelEditor,https://api.github.com/repos/SonyWWS/LevelEditor/languages
CSrankings,Python,1099,894,other,184,2016-05-03T00:13:00Z,1321267,A web app for ranking computer science departments according to their research output in selective venues.,https://github.com/emeryberger/CSrankings,https://api.github.com/repos/emeryberger/CSrankings/languages
SwissArmyKnife,Java,1099,176,mit,1,2016-11-30T10:14:50Z,5445,android uiè°ƒè¯•å·¥å…·,https://github.com/android-notes/SwissArmyKnife,https://api.github.com/repos/android-notes/SwissArmyKnife/languages
react-native-node,Java,1099,33,mit,8,2017-08-01T14:29:11Z,6655,Run a separate Node.js process behind a React Native app,https://github.com/staltz/react-native-node,https://api.github.com/repos/staltz/react-native-node/languages
debops-tools,Python,1099,136,other,36,2014-09-01T18:47:36Z,382,Your Debian-based data center in a box,https://github.com/debops/debops-tools,https://api.github.com/repos/debops/debops-tools/languages
fuzz.txt,null,1099,174,,1,2016-01-19T13:35:44Z,2063,Potentially dangerous files,https://github.com/Bo0oM/fuzz.txt,https://api.github.com/repos/Bo0oM/fuzz.txt/languages
flux-examples,null,1098,144,,0,2014-06-20T16:22:09Z,1075,Isomorphic Flux examples with Fluxible,https://github.com/YahooArchive/flux-examples,https://api.github.com/repos/YahooArchive/flux-examples/languages
ZoomPreviewPicture,Java,1098,167,apache-2.0,11,2017-04-26T12:04:11Z,74802,"æ‹“å±•æ€§æé«˜ç±»ä¼¼å¾®ä¿¡å›¾ç‰‡å’Œè§†é¢‘æµè§ˆ,å¸¸è§åº”ç”¨åœºæ™¯å¦‚å¾®ä¿¡æœ‹å‹åœˆç…§ç‰‡ä¹å®«æ ¼å’Œå¾®ä¿¡èŠå¤©å›¾ç‰‡å›¾ç‰‡,è§†é¢‘,gifé¢„è§ˆ",https://github.com/yangchaojiang/ZoomPreviewPicture,https://api.github.com/repos/yangchaojiang/ZoomPreviewPicture/languages
marty,JavaScript,1098,94,mit,15,2014-11-02T10:35:32Z,10639,A Javascript library for state management in React applications,https://github.com/martyjs/marty,https://api.github.com/repos/martyjs/marty/languages
selectivity,JavaScript,1098,116,mit,46,2014-12-29T13:02:36Z,3233,Modular and light-weight selection library,https://github.com/arendjr/selectivity,https://api.github.com/repos/arendjr/selectivity/languages
faster,Rust,1098,28,mpl-2.0,22,2017-11-05T07:55:44Z,460,SIMD for humans,https://github.com/AdamNiederer/faster,https://api.github.com/repos/AdamNiederer/faster/languages
Python-crawler,HTML,1098,404,,5,2017-05-02T06:36:38Z,3813,ä»å¤´å¼€å§‹ ç³»ç»ŸåŒ–çš„ å­¦ä¹ å¦‚ä½•å†™Pythonçˆ¬è™«ã€‚ Pythonç‰ˆæœ¬ 3.6 ,https://github.com/Ehco1996/Python-crawler,https://api.github.com/repos/Ehco1996/Python-crawler/languages
drf-yasg,Python,1098,178,other,88,2017-11-29T10:30:22Z,13290,Automated generation of real Swagger/OpenAPI 2.0 schemas from Django REST Framework code.,https://github.com/axnsan12/drf-yasg,https://api.github.com/repos/axnsan12/drf-yasg/languages
vue-content-placeholders,JavaScript,1098,65,mit,10,2017-10-09T19:13:54Z,11,Composable components for rendering fake (progressive) content like facebook in vue,https://github.com/michalsnik/vue-content-placeholders,https://api.github.com/repos/michalsnik/vue-content-placeholders/languages
DragRankSquare,Java,1098,194,,2,2016-05-27T07:13:04Z,17119,edit personal information which enables users to drag and rank image order,https://github.com/xmuSistone/DragRankSquare,https://api.github.com/repos/xmuSistone/DragRankSquare/languages
92five,JavaScript,1098,209,other,49,2014-08-13T13:48:20Z,4451,Self hosted project management application,https://github.com/chintanbanugaria/92five,https://api.github.com/repos/chintanbanugaria/92five/languages
css,CSS,1098,178,mit,50,2012-07-18T23:52:18Z,181,CSS parser / stringifier for Node.js,https://github.com/reworkcss/css,https://api.github.com/repos/reworkcss/css/languages
kiwi.js,JavaScript,1098,213,mit,68,2013-07-15T23:30:04Z,50005,Kiwi.js is a blazingly fast mobile & desktop browser based HTML5 game framework. It uses CocoonJS for publishing to the AppStore.,https://github.com/gamelab/kiwi.js,https://api.github.com/repos/gamelab/kiwi.js/languages
im_service,Go,1098,414,gpl-2.0,0,2015-04-19T07:39:36Z,1140,golang   im   server,https://github.com/GoBelieveIO/im_service,https://api.github.com/repos/GoBelieveIO/im_service/languages
js-by-examples,null,1098,140,,3,2016-01-02T18:46:26Z,76,Learn JavaScript by examples,https://github.com/bmkmanoj/js-by-examples,https://api.github.com/repos/bmkmanoj/js-by-examples/languages
u-root,Go,1098,178,bsd-3-clause,102,2015-11-19T02:28:59Z,43175,A fully Go userland with Linux bootloaders! u-root can create a root file system (initramfs) containing a busybox-like set of tools written in Go.,https://github.com/u-root/u-root,https://api.github.com/repos/u-root/u-root/languages
NotificationPusher,PHP,1098,240,mit,33,2012-08-27T06:56:03Z,310,Standalone PHP library for easy devices notifications push.,https://github.com/Ph3nol/NotificationPusher,https://api.github.com/repos/Ph3nol/NotificationPusher/languages
Propel2,PHP,1098,314,mit,308,2011-10-06T06:50:51Z,27229,Propel2 is an open-source high-performance Object-Relational Mapping (ORM) for modern PHP,https://github.com/propelorm/Propel2,https://api.github.com/repos/propelorm/Propel2/languages
AndroidWM,Java,1098,112,apache-2.0,16,2018-08-28T03:26:29Z,4073,An android image watermark library that supports invisible digital watermarks (steganography). :foggy: ,https://github.com/huangyz0918/AndroidWM,https://api.github.com/repos/huangyz0918/AndroidWM/languages
mysql-postgresql-converter,Python,1098,380,bsd-2-clause,30,2012-11-13T14:41:20Z,52,Lanyrd's MySQL to PostgreSQL conversion script,https://github.com/lanyrd/mysql-postgresql-converter,https://api.github.com/repos/lanyrd/mysql-postgresql-converter/languages
keyczar,null,1097,162,apache-2.0,71,2015-03-07T21:41:04Z,8360,Easy-to-use crypto toolkit,https://github.com/google/keyczar,https://api.github.com/repos/google/keyczar/languages
volta,Rust,1097,42,other,128,2017-09-25T20:06:43Z,64168,Volta: The JavaScript Launcher âš¡,https://github.com/volta-cli/volta,https://api.github.com/repos/volta-cli/volta/languages
wwwbasic,JavaScript,1097,60,apache-2.0,16,2018-07-17T04:57:29Z,202,wwwBASIC is an implementation of BASIC that runs on Node.js and the Web.,https://github.com/google/wwwbasic,https://api.github.com/repos/google/wwwbasic/languages
paz,Shell,1097,60,other,21,2014-12-06T19:50:08Z,126,"An open-source, in-house service platform with a PaaS-like workflow, built on Docker, CoreOS, Etcd and Fleet. This repository houses the documentation and installation scripts.",https://github.com/paz-sh/paz,https://api.github.com/repos/paz-sh/paz/languages
jason,Go,1097,73,mit,7,2014-12-02T08:20:41Z,81,Easy-to-use JSON Library for Go,https://github.com/antonholmquist/jason,https://api.github.com/repos/antonholmquist/jason/languages
youCanCodeAGif,Python,1097,46,mit,4,2018-05-18T22:00:28Z,219,"Can you make an High Quality Gif from A to Z only by coding? Yes. Do you want to, though?",https://github.com/1-Sisyphe/youCanCodeAGif,https://api.github.com/repos/1-Sisyphe/youCanCodeAGif/languages
SwiftyTimer,Swift,1097,116,mit,8,2015-05-09T12:03:51Z,87,Swifty API for NSTimer,https://github.com/radex/SwiftyTimer,https://api.github.com/repos/radex/SwiftyTimer/languages
ocr,JavaScript,1097,108,other,0,2015-03-10T18:26:12Z,12470,Neural network OCR.,https://github.com/mateogianolio/ocr,https://api.github.com/repos/mateogianolio/ocr/languages
Hawkeye,Vue,1097,422,gpl-3.0,32,2017-06-02T07:10:45Z,5082,GitHub æ³„éœ²ç›‘æ§ç³»ç»Ÿ(GitHub Sensitive Information Leakage Monitor Spider),https://github.com/0xbug/Hawkeye,https://api.github.com/repos/0xbug/Hawkeye/languages
ShaderForge,C#,1097,300,,6,2013-09-22T07:36:07Z,308508,A Shader Editor for Unity,https://github.com/FreyaHolmer/ShaderForge,https://api.github.com/repos/FreyaHolmer/ShaderForge/languages
codemaid,C#,1097,249,lgpl-3.0,252,2014-07-19T11:39:00Z,15292,"CodeMaid is an open source Visual Studio extension to cleanup and simplify our C#, C++, F#, VB, PHP, PowerShell, JSON, XAML, XML, ASP, HTML, CSS, LESS, SCSS, JavaScript and TypeScript coding.",https://github.com/codecadwallader/codemaid,https://api.github.com/repos/codecadwallader/codemaid/languages
scc,Go,1097,65,other,11,2018-03-01T06:44:25Z,3822,"Sloc, Cloc and Code: scc is a very fast accurate code counter with complexity calculations and COCOMO estimates written in pure Go",https://github.com/boyter/scc,https://api.github.com/repos/boyter/scc/languages
quantdigger,Python,1097,543,,14,2014-11-29T04:26:59Z,17813,åŸºäºpythonçš„é‡åŒ–äº¤æ˜“å¹³å°,https://github.com/QuantFans/quantdigger,https://api.github.com/repos/QuantFans/quantdigger/languages
hawtio,Java,1097,458,apache-2.0,172,2012-12-02T11:58:08Z,96443,Hawtio web console helps you manage your JVM stuff and stay cool!,https://github.com/hawtio/hawtio,https://api.github.com/repos/hawtio/hawtio/languages
