dupeguru,Python,1134,192,gpl-3.0,265,2013-06-22T01:07:43Z,16725,Find duplicate files,https://github.com/arsenetar/dupeguru,https://api.github.com/repos/arsenetar/dupeguru/languages
bloomd,C,1134,98,bsd-3-clause,6,2012-02-12T02:22:46Z,3011,C network daemon for bloom filters,https://github.com/armon/bloomd,https://api.github.com/repos/armon/bloomd/languages
panzoom,TypeScript,1134,352,mit,3,2013-03-14T17:37:53Z,3355,"A library for panning and zooming elements using CSS transforms :mag: (REWRITE IN PROGRESS, see Projects ^) ",https://github.com/timmywil/panzoom,https://api.github.com/repos/timmywil/panzoom/languages
couchbase-lite-android,Java,1134,212,apache-2.0,91,2013-05-10T23:36:45Z,75109,"Lightweight, embedded, syncable NoSQL database engine for Android.",https://github.com/couchbase/couchbase-lite-android,https://api.github.com/repos/couchbase/couchbase-lite-android/languages
Sublime-Text-Plugins-for-Frontend-Web-Development,null,1134,67,,0,2017-04-06T09:46:24Z,2479,ğŸ“ A Collection of Plugins for Frontend Web Development,https://github.com/jfilter/Sublime-Text-Plugins-for-Frontend-Web-Development,https://api.github.com/repos/jfilter/Sublime-Text-Plugins-for-Frontend-Web-Development/languages
PhysX,C++,1134,252,,99,2018-12-05T14:30:22Z,777519,NVIDIA PhysX SDK,https://github.com/NVIDIAGameWorks/PhysX,https://api.github.com/repos/NVIDIAGameWorks/PhysX/languages
s3git,Go,1134,42,apache-2.0,16,2016-02-29T11:06:44Z,101,"s3git: git for Cloud Storage. Distributed Version Control for Data. Create decentralized and versioned repos that scale infinitely to 100s of millions of files. Clone huge PB-scale repos on your local SSD to make changes, commit and push back. Oh yeah, it dedupes too and offers directory versioning.",https://github.com/s3git/s3git,https://api.github.com/repos/s3git/s3git/languages
flexmark-java,Java,1134,127,other,41,2016-01-23T15:29:29Z,137469,"CommonMark/Markdown Java parser with source level AST. CommonMark 0.28, emulation of: pegdown, kramdown, markdown.pl, MultiMarkdown. With HTML to MD, MD to PDF, MD to DOCX  conversion modules.",https://github.com/vsch/flexmark-java,https://api.github.com/repos/vsch/flexmark-java/languages
tedious,JavaScript,1134,311,mit,144,2011-05-08T19:22:11Z,3575,Node TDS module for connecting to SQL Server databases.,https://github.com/tediousjs/tedious,https://api.github.com/repos/tediousjs/tedious/languages
jobs,null,1134,65,,303,2014-07-24T02:09:07Z,7,Our jobs board.,https://github.com/f2etw/jobs,https://api.github.com/repos/f2etw/jobs/languages
SublimeText-Nodejs,Python,1134,281,wtfpl,15,2011-11-06T21:17:20Z,560,nodejs snippets and bindings for Sublime Text 3,https://github.com/tanepiper/SublimeText-Nodejs,https://api.github.com/repos/tanepiper/SublimeText-Nodejs/languages
laravel-sitemap,PHP,1134,158,other,27,2013-05-30T21:09:32Z,190,null,https://github.com/Laravelium/laravel-sitemap,https://api.github.com/repos/Laravelium/laravel-sitemap/languages
MQTTnet,C#,1134,337,other,80,2017-03-16T21:15:54Z,4291,MQTTnet is a high performance .NET library for MQTT based communication. It provides a MQTT client and a MQTT server (broker). The implementation is based on the documentation from http://mqtt.org/.,https://github.com/chkr1011/MQTTnet,https://api.github.com/repos/chkr1011/MQTTnet/languages
almond,Scala,1134,169,bsd-3-clause,71,2015-03-10T22:48:50Z,9369,A scala kernel for Jupyter,https://github.com/almond-sh/almond,https://api.github.com/repos/almond-sh/almond/languages
graphql-subscriptions,TypeScript,1134,85,mit,37,2016-08-19T19:08:00Z,165,:newspaper: A small module that implements GraphQL subscriptions for Node.js,https://github.com/apollographql/graphql-subscriptions,https://api.github.com/repos/apollographql/graphql-subscriptions/languages
aioredis,Python,1134,188,mit,89,2014-05-25T19:29:57Z,1479,asyncio (PEP 3156) Redis support,https://github.com/aio-libs/aioredis,https://api.github.com/repos/aio-libs/aioredis/languages
RMDateSelectionViewController,Objective-C,1134,156,mit,3,2013-10-26T16:11:37Z,2018,This is an iOS control for selecting a date using UIDatePicker in an UIAlertController like manner,https://github.com/CooperRS/RMDateSelectionViewController,https://api.github.com/repos/CooperRS/RMDateSelectionViewController/languages
filterpy,Python,1134,298,mit,41,2014-07-15T02:15:19Z,974,"Python Kalman filtering and optimal estimation library. Implements Kalman filter, particle filter, Extended Kalman filter, Unscented Kalman filter, g-h (alpha-beta), least squares, H Infinity, smoothers, and more. Has companion book 'Kalman and Bayesian Filters in Python'.",https://github.com/rlabbe/filterpy,https://api.github.com/repos/rlabbe/filterpy/languages
material-table,JavaScript,1134,324,mit,381,2018-08-06T13:15:08Z,37355,Datatable for React based on material-ui's table with additional features,https://github.com/mbrn/material-table,https://api.github.com/repos/mbrn/material-table/languages
capsule,Java,1133,81,epl-1.0,23,2014-04-18T12:15:41Z,6156,Dead-Simple Packaging and Deployment for JVM Apps,https://github.com/puniverse/capsule,https://api.github.com/repos/puniverse/capsule/languages
telescope,Java,1133,119,apache-2.0,9,2014-04-30T16:08:35Z,2943,A simple tool to allow easy bug report capturing within your app.,https://github.com/mattprecious/telescope,https://api.github.com/repos/mattprecious/telescope/languages
awtk,C,1133,366,lgpl-2.1,48,2018-02-21T11:05:11Z,120534,AWTK = Toolkit AnyWhere(ä¸ºåµŒå…¥å¼ã€æ‰‹æœºå’ŒPCæ‰“é€ çš„é€šç”¨GUIç³»ç»Ÿ),https://github.com/zlgopen/awtk,https://api.github.com/repos/zlgopen/awtk/languages
Wyam,C#,1133,206,mit,218,2014-09-22T13:45:30Z,32980,A modular static content and static site generator.,https://github.com/Wyamio/Wyam,https://api.github.com/repos/Wyamio/Wyam/languages
StackNet,Java,1133,320,other,18,2017-03-12T23:43:23Z,83822,"StackNet is a computational, scalable and analytical Meta modelling framework",https://github.com/kaz-Anova/StackNet,https://api.github.com/repos/kaz-Anova/StackNet/languages
perf-map-agent,C,1133,205,gpl-2.0,29,2012-11-22T13:14:49Z,127,A java agent to generate method mappings to use with the linux `perf` tool,https://github.com/jvm-profiling-tools/perf-map-agent,https://api.github.com/repos/jvm-profiling-tools/perf-map-agent/languages
node-ldapjs,JavaScript,1133,313,mit,70,2011-08-04T20:37:11Z,1856,LDAP Client and Server API for node.js,https://github.com/ldapjs/node-ldapjs,https://api.github.com/repos/ldapjs/node-ldapjs/languages
ScreenRecorder,Java,1133,372,,28,2014-11-26T15:35:43Z,418,"Implement screen capture without root on Android 5.0+ by using MediaProjectionManager, VirtualDisplay, AudioRecord, MediaCodec and MediaMuxer APIs",https://github.com/yrom/ScreenRecorder,https://api.github.com/repos/yrom/ScreenRecorder/languages
chan,Shell,1133,97,apache-2.0,5,2014-08-18T00:25:53Z,102,Pure C implementation of Go channels.,https://github.com/tylertreat/chan,https://api.github.com/repos/tylertreat/chan/languages
cordova-plugin-wechat,Objective-C,1133,488,,37,2013-06-09T05:23:00Z,43998,"A cordova plugin, a JS version of Wechat SDK",https://github.com/xu-li/cordova-plugin-wechat,https://api.github.com/repos/xu-li/cordova-plugin-wechat/languages
whiteboard,JavaScript,1133,124,other,13,2016-01-26T22:15:34Z,292,Simply write beautiful API documentation.,https://github.com/mpociot/whiteboard,https://api.github.com/repos/mpociot/whiteboard/languages
skylark,Go,1133,79,bsd-3-clause,4,2017-10-02T14:05:01Z,1878,"Skylark in Go: the Skylark configuration language, implemented in Go [MOVED to go.starlark.net]",https://github.com/google/skylark,https://api.github.com/repos/google/skylark/languages
open-vm-tools,C,1133,252,,166,2014-04-25T21:30:54Z,20080,Official repository of VMware open-vm-tools project,https://github.com/vmware/open-vm-tools,https://api.github.com/repos/vmware/open-vm-tools/languages
powerfulseal,Python,1133,92,apache-2.0,23,2017-12-05T18:43:45Z,7141,A powerful testing tool for Kubernetes clusters.,https://github.com/bloomberg/powerfulseal,https://api.github.com/repos/bloomberg/powerfulseal/languages
hydra,Emacs Lisp,1133,72,,47,2015-01-20T13:21:51Z,507,make Emacs bindings that stick around,https://github.com/abo-abo/hydra,https://api.github.com/repos/abo-abo/hydra/languages
react-tagsinput,JavaScript,1133,196,mit,45,2014-06-24T07:54:19Z,953,Highly customizable React component for inputing tags.,https://github.com/olahol/react-tagsinput,https://api.github.com/repos/olahol/react-tagsinput/languages
rpi_ws281x,C,1132,422,bsd-2-clause,60,2014-09-03T13:18:19Z,340,Userspace Raspberry Pi PWM library for WS281X LEDs,https://github.com/jgarff/rpi_ws281x,https://api.github.com/repos/jgarff/rpi_ws281x/languages
cgdb,C++,1132,129,gpl-2.0,52,2012-05-04T23:06:34Z,7768,Console front-end to the GNU debugger,https://github.com/cgdb/cgdb,https://api.github.com/repos/cgdb/cgdb/languages
webmin,Perl,1132,324,other,249,2009-07-20T22:03:42Z,42716,Powerful and flexible web-based server management control panel,https://github.com/webmin/webmin,https://api.github.com/repos/webmin/webmin/languages
UITextView-Placeholder,Objective-C,1132,178,mit,14,2014-12-10T15:18:38Z,92,A missing placeholder for UITextView,https://github.com/devxoul/UITextView-Placeholder,https://api.github.com/repos/devxoul/UITextView-Placeholder/languages
personal-sites,Python,1132,768,,53,2014-09-10T18:32:08Z,1135,List of Hackathon Hackers' personal sites.,https://github.com/HackathonHackers/personal-sites,https://api.github.com/repos/HackathonHackers/personal-sites/languages
2017-talks,Go,1132,133,,1,2017-07-17T14:42:10Z,113697,Slides and links for 2017 talks,https://github.com/gophercon/2017-talks,https://api.github.com/repos/gophercon/2017-talks/languages
tuna,JavaScript,1132,91,,3,2012-11-07T11:11:15Z,5295,An audio effects library for the Web Audio API.,https://github.com/Theodeus/tuna,https://api.github.com/repos/Theodeus/tuna/languages
rttr,C++,1132,164,mit,56,2015-12-15T18:52:32Z,6621,C++ Reflection Library,https://github.com/rttrorg/rttr,https://api.github.com/repos/rttrorg/rttr/languages
BuildCraft,Java,1132,492,other,275,2012-04-16T10:57:39Z,75056,BuildCraft,https://github.com/BuildCraft/BuildCraft,https://api.github.com/repos/BuildCraft/BuildCraft/languages
dustcloud,C,1132,183,gpl-3.0,43,2017-12-23T18:05:46Z,214539,Xiaomi Smart Home Device Reverse Engineering and Hacking,https://github.com/dgiese/dustcloud,https://api.github.com/repos/dgiese/dustcloud/languages
nano,JavaScript,1132,173,other,47,2011-08-11T23:17:21Z,1655,Nano is now part of Apache CouchDB. Repo moved to https://GitHub.com/apache/couchdb-nano,https://github.com/apache/nano,https://api.github.com/repos/apache/nano/languages
MagicPython,JavaScript,1132,64,mit,29,2015-10-09T22:13:24Z,1784,"Cutting edge Python syntax highlighter for Sublime Text, Atom and Visual Studio Code. Used by GitHub to highlight your Python code!",https://github.com/MagicStack/MagicPython,https://api.github.com/repos/MagicStack/MagicPython/languages
Ligaturizer,Python,1132,65,gpl-3.0,20,2017-08-08T05:19:28Z,16091,Programming Fonts with Ligatures added (& a script to add them to other fonts),https://github.com/ToxicFrog/Ligaturizer,https://api.github.com/repos/ToxicFrog/Ligaturizer/languages
pleaserun,Ruby,1131,74,other,41,2013-07-12T06:04:02Z,358,"An attempt to abstract this ""init"" script madness.",https://github.com/jordansissel/pleaserun,https://api.github.com/repos/jordansissel/pleaserun/languages
picfit,Go,1131,102,mit,17,2014-12-06T17:30:45Z,112463,An image resizing server written in Go,https://github.com/thoas/picfit,https://api.github.com/repos/thoas/picfit/languages
rasterio,Python,1131,322,other,131,2013-11-04T16:36:27Z,24354,Rasterio reads and writes geospatial raster datasets,https://github.com/mapbox/rasterio,https://api.github.com/repos/mapbox/rasterio/languages
libarchive,C,1131,382,other,226,2012-01-19T18:16:02Z,22304,Multi-format archive and compression library,https://github.com/libarchive/libarchive,https://api.github.com/repos/libarchive/libarchive/languages
DANet,Python,1131,277,other,36,2018-09-11T10:03:15Z,19972,Dual Attention Network for Scene Segmentation (CVPR2019),https://github.com/junfu1115/DANet,https://api.github.com/repos/junfu1115/DANet/languages
Android-CircleMenu,Java,1131,485,apache-2.0,4,2015-01-26T08:00:09Z,6323,è‡ªå®šä¹‰ViewGroupå®ç°çš„åœ†å½¢æ—‹è½¬èœå•ï¼Œæ”¯æŒè·Ÿéšæ‰‹æŒ‡æ—‹è½¬ä»¥åŠå¿«é€Ÿæ—‹è½¬ã€‚,https://github.com/hongyangAndroid/Android-CircleMenu,https://api.github.com/repos/hongyangAndroid/Android-CircleMenu/languages
S3-Uploads,PHP,1131,229,,119,2013-11-21T01:26:22Z,9980,The WordPress Plugin to Store Uploads on Amazon S3,https://github.com/humanmade/S3-Uploads,https://api.github.com/repos/humanmade/S3-Uploads/languages
uform,TypeScript,1131,120,mit,38,2019-01-09T02:11:45Z,12668,âš¡React High Performance Form Solution For Enterprise. ,https://github.com/alibaba/uform,https://api.github.com/repos/alibaba/uform/languages
gomemcache,Go,1131,310,apache-2.0,34,2011-06-28T19:29:12Z,76,Go Memcached client library #golang,https://github.com/bradfitz/gomemcache,https://api.github.com/repos/bradfitz/gomemcache/languages
ACMESharp,C#,1131,185,,128,2015-08-13T11:24:02Z,4675,An ACME client library and PowerShell client for the .NET platform (Let's Encrypt),https://github.com/ebekker/ACMESharp,https://api.github.com/repos/ebekker/ACMESharp/languages
FIR,Python,1131,369,gpl-3.0,59,2015-03-11T16:23:34Z,2207,Fast Incident Response,https://github.com/certsocietegenerale/FIR,https://api.github.com/repos/certsocietegenerale/FIR/languages
merlin,OCaml,1131,145,mit,193,2013-02-06T09:38:04Z,34395,Context sensitive completion for OCaml in Vim and Emacs,https://github.com/ocaml/merlin,https://api.github.com/repos/ocaml/merlin/languages
GleeBug,C++,1131,20,mpl-2.0,39,2015-12-16T10:49:32Z,415,Debugging Framework for Windows.,https://github.com/x64dbg/GleeBug,https://api.github.com/repos/x64dbg/GleeBug/languages
opencover,C#,1131,224,other,71,2011-02-22T09:01:11Z,152122,"A code coverage tool for .NET 2 and above (WINDOWS OS only), support for 32 and 64 processes with both branch and sequence points",https://github.com/OpenCover/opencover,https://api.github.com/repos/OpenCover/opencover/languages
bash-completion,Shell,1131,209,gpl-2.0,112,2016-02-09T14:44:03Z,5065,Programmable completion functions for bash,https://github.com/scop/bash-completion,https://api.github.com/repos/scop/bash-completion/languages
gli,Ruby,1131,99,apache-2.0,62,2009-02-05T03:49:25Z,1917,Make awesome command-line applications the easy way,https://github.com/davetron5000/gli,https://api.github.com/repos/davetron5000/gli/languages
LLJS,JavaScript,1131,96,other,26,2012-02-06T18:52:37Z,1486,LLJS: Low-Level JavaScript,https://github.com/mbebenita/LLJS,https://api.github.com/repos/mbebenita/LLJS/languages
GoAgent-Always-Available,Python,1131,548,other,36,2015-04-05T05:51:34Z,21588,ä¸€ç›´å¯ç”¨çš„GoAgentï¼Œä¼šå®šæ—¶æ‰«æå¯ç”¨çš„google gae ipï¼Œæä¾›å¯è‡ªåŠ¨åŒ–è·å–ipè¿è¡Œçš„ç‰ˆæœ¬,https://github.com/out0fmemory/GoAgent-Always-Available,https://api.github.com/repos/out0fmemory/GoAgent-Always-Available/languages
jsx-control-statements,JavaScript,1131,55,mit,10,2015-02-19T03:03:44Z,229,Neater If and For for React JSX,https://github.com/AlexGilleran/jsx-control-statements,https://api.github.com/repos/AlexGilleran/jsx-control-statements/languages
EmojiPackage,null,1131,187,,15,2018-12-13T03:35:57Z,98959,A rich emoji package resources,https://github.com/getActivity/EmojiPackage,https://api.github.com/repos/getActivity/EmojiPackage/languages
gradle-bintray-plugin,Groovy,1130,181,apache-2.0,149,2013-05-27T20:25:02Z,14631,null,https://github.com/bintray/gradle-bintray-plugin,https://api.github.com/repos/bintray/gradle-bintray-plugin/languages
chatbot,Python,1130,446,,9,2018-01-08T16:00:08Z,50499,ä¸€ä¸ªå¯ä»¥è‡ªå·±è¿›è¡Œè®­ç»ƒçš„ä¸­æ–‡èŠå¤©æœºå™¨äººï¼Œ æ ¹æ®è‡ªå·±çš„è¯­æ–™è®­ç»ƒå‡ºè‡ªå·±æƒ³è¦çš„èŠå¤©æœºå™¨äººï¼Œå¯ä»¥ç”¨äºæ™ºèƒ½å®¢æœã€åœ¨çº¿é—®ç­”ã€æ™ºèƒ½èŠå¤©ç­‰åœºæ™¯ã€‚ç›®å‰åŒ…å«seq2seqå’ŒseqGANç‰ˆæœ¬ï¼Œåç»­å¢åŠ tf2.0ç‰ˆæœ¬ã€‚,https://github.com/zhaoyingjun/chatbot,https://api.github.com/repos/zhaoyingjun/chatbot/languages
BTree,Swift,1130,77,mit,14,2015-12-15T02:32:26Z,2131,Fast sorted collections for Swift using in-memory B-trees,https://github.com/attaswift/BTree,https://api.github.com/repos/attaswift/BTree/languages
vvedenie-mashinnoe-obuchenie,null,1130,281,,5,2016-01-28T23:10:50Z,2315,:memo: ĞŸĞ¾Ğ´Ğ±Ğ¾Ñ€ĞºĞ° Ñ€ĞµÑÑƒÑ€ÑĞ¾Ğ² Ğ¿Ğ¾ Ğ¼Ğ°ÑˆĞ¸Ğ½Ğ½Ğ¾Ğ¼Ñƒ Ğ¾Ğ±ÑƒÑ‡ĞµĞ½Ğ¸Ñ,https://github.com/demidovakatya/vvedenie-mashinnoe-obuchenie,https://api.github.com/repos/demidovakatya/vvedenie-mashinnoe-obuchenie/languages
Android-Session-Slides,null,1130,221,,0,2016-09-25T16:35:13Z,19969,Here are the slides in MDCC 2016 Android Session.,https://github.com/MDCC2016/Android-Session-Slides,https://api.github.com/repos/MDCC2016/Android-Session-Slides/languages
AnySoftKeyboard,Java,1130,516,apache-2.0,480,2012-04-18T12:38:01Z,131959,Android (f/w 2.1+) on screen keyboard for multiple languages (chat https://gitter.im/AnySoftKeyboard),https://github.com/AnySoftKeyboard/AnySoftKeyboard,https://api.github.com/repos/AnySoftKeyboard/AnySoftKeyboard/languages
react-mapbox-gl,TypeScript,1130,325,mit,112,2016-04-16T08:23:57Z,16762,A React binding of mapbox-gl-js,https://github.com/alex3165/react-mapbox-gl,https://api.github.com/repos/alex3165/react-mapbox-gl/languages
zt-zip,Java,1130,235,apache-2.0,21,2011-11-22T15:26:37Z,647,ZeroTurnaround ZIP Library,https://github.com/zeroturnaround/zt-zip,https://api.github.com/repos/zeroturnaround/zt-zip/languages
simple-computer,Go,1130,108,,1,2019-05-13T18:21:44Z,707,"the scott CPU from ""But How Do It Know?"" by J. Clark Scott",https://github.com/djhworld/simple-computer,https://api.github.com/repos/djhworld/simple-computer/languages
gopub,Go,1130,317,apache-2.0,18,2018-04-08T07:51:47Z,14198,"vue.js(elementæ¡†æ¶)+golang(beegoæ¡†æ¶)å¼€å‘çš„è¿ç»´å‘å¸ƒç³»ç»Ÿ,æ”¯æŒgit,jenkinsç‰ˆæœ¬å‘å¸ƒ,go ssh,BTä¸¤ç§æ–‡ä»¶ä¼ è¾“æ–¹å¼é€‰æ‹©,æ”¯æŒéƒ¨ç½²å‰å‡†å¤‡ä»»åŠ¡å’Œéƒ¨ç½²åä»»åŠ¡é’©å­å‡½æ•°",https://github.com/linclin/gopub,https://api.github.com/repos/linclin/gopub/languages
vue-cnode,Vue,1130,341,,0,2016-07-05T13:48:08Z,1839,åŸºäºvue2 + vue-router + vuet + ES6 + less + flex.cssé‡å†™vueç‰ˆcnodeç¤¾åŒºï¼Œä½¿ç”¨webpack2æ‰“åŒ…,https://github.com/lzxb/vue-cnode,https://api.github.com/repos/lzxb/vue-cnode/languages
material-animated-switch,Java,1130,161,,24,2015-06-15T21:42:51Z,237,A material Switch with icon animations and color transitions,https://github.com/glomadrian/material-animated-switch,https://api.github.com/repos/glomadrian/material-animated-switch/languages
CocoaPods-app,Swift,1130,269,other,66,2014-11-15T15:12:01Z,10657,A full-featured and standalone installation of CocoaPods.,https://github.com/CocoaPods/CocoaPods-app,https://api.github.com/repos/CocoaPods/CocoaPods-app/languages
coroutines-examples,null,1130,136,apache-2.0,0,2016-04-18T14:59:09Z,306,Examples for coroutines design in Kotlin,https://github.com/Kotlin/coroutines-examples,https://api.github.com/repos/Kotlin/coroutines-examples/languages
nuxtjs.org,Vue,1130,262,,13,2016-11-09T15:11:12Z,11726,Nuxt.js Documentation Website (Universal Vue.js Application built with Nuxt.js),https://github.com/nuxt/nuxtjs.org,https://api.github.com/repos/nuxt/nuxtjs.org/languages
MacGap2,Objective-C,1130,86,,42,2014-05-21T20:40:40Z,214,MacGap 2,https://github.com/MacGapProject/MacGap2,https://api.github.com/repos/MacGapProject/MacGap2/languages
js-xls,null,1130,193,other,0,2012-12-30T06:26:45Z,2604,:x: XLS (Excel 95-2004) + XML 2003 parser (now merged in http://github.com/sheetjs/js-xlsx ),https://github.com/SheetJS/js-xls,https://api.github.com/repos/SheetJS/js-xls/languages
CalendarView,Kotlin,1130,90,mit,5,2019-04-20T14:43:36Z,2936,"A highly customizable calendar library for Android, powered by RecyclerView.",https://github.com/kizitonwose/CalendarView,https://api.github.com/repos/kizitonwose/CalendarView/languages
cotire,CMake,1130,129,mit,75,2012-03-11T16:36:51Z,553,CMake module to speed up builds.,https://github.com/sakra/cotire,https://api.github.com/repos/sakra/cotire/languages
Deep-Learning-for-Tracking-and-Detection,null,1130,358,,1,2017-05-12T19:39:38Z,1252515,"Collection of papers, datasets, code and other resources for object tracking and detection using deep learning",https://github.com/abhineet123/Deep-Learning-for-Tracking-and-Detection,https://api.github.com/repos/abhineet123/Deep-Learning-for-Tracking-and-Detection/languages
sftpgo,Go,1130,52,gpl-3.0,5,2019-07-20T10:18:31Z,1373,Full featured and highly configurable SFTP server,https://github.com/drakkan/sftpgo,https://api.github.com/repos/drakkan/sftpgo/languages
