termgraph,Python,2290,114,mit,13,2012-09-21T18:31:27Z,382,a python command-line tool which draws basic graphs in the terminal,https://github.com/mkaz/termgraph,https://api.github.com/repos/mkaz/termgraph/languages
flash,PHP,2290,329,,35,2014-06-30T04:03:54Z,66,Easy flash notifications,https://github.com/laracasts/flash,https://api.github.com/repos/laracasts/flash/languages
pointnet,Python,2290,896,other,114,2017-01-31T04:50:28Z,530,PointNet: Deep Learning on Point Sets for 3D Classification and Segmentation,https://github.com/charlesq34/pointnet,https://api.github.com/repos/charlesq34/pointnet/languages
coil,Kotlin,2290,85,apache-2.0,21,2019-08-10T21:28:21Z,34279,Image loading for Android backed by Kotlin Coroutines.,https://github.com/coil-kt/coil,https://api.github.com/repos/coil-kt/coil/languages
he,JavaScript,2290,181,mit,14,2013-06-25T06:54:45Z,653,A robust HTML entity encoder/decoder written in JavaScript.,https://github.com/mathiasbynens/he,https://api.github.com/repos/mathiasbynens/he/languages
TensorFlow-and-DeepLearning-Tutorial,Python,2290,630,,5,2016-10-08T06:01:45Z,32016,A TensorFlow & Deep Learning online course I taught in 2016,https://github.com/CreatCodeBuild/TensorFlow-and-DeepLearning-Tutorial,https://api.github.com/repos/CreatCodeBuild/TensorFlow-and-DeepLearning-Tutorial/languages
toolbox,Inno Setup,2289,770,,321,2015-06-29T22:39:27Z,12072,The Docker Toolbox,https://github.com/docker/toolbox,https://api.github.com/repos/docker/toolbox/languages
goworker,Go,2289,210,other,27,2013-07-22T17:04:27Z,99,"goworker is a Go-based background worker that runs 10 to 100,000* times faster than Ruby-based workers.",https://github.com/benmanns/goworker,https://api.github.com/repos/benmanns/goworker/languages
vim-orgmode,Python,2288,199,other,104,2010-10-31T13:58:17Z,2199,Text outlining and task management for Vim based on Emacs' Org-Mode,https://github.com/jceb/vim-orgmode,https://api.github.com/repos/jceb/vim-orgmode/languages
pytorch-yolo-v3,Python,2288,756,,89,2018-04-06T21:55:48Z,2453,A PyTorch implementation of the YOLO v3 object detection algorithm,https://github.com/ayooshkathuria/pytorch-yolo-v3,https://api.github.com/repos/ayooshkathuria/pytorch-yolo-v3/languages
RMStore,C,2286,424,apache-2.0,90,2013-07-30T14:14:39Z,11667,A lightweight iOS library for In-App Purchases,https://github.com/robotmedia/RMStore,https://api.github.com/repos/robotmedia/RMStore/languages
vue-express-mongo-boilerplate,JavaScript,2285,630,,58,2016-06-18T12:09:40Z,14361,":star: MEVN Full stack JS web app boilerplate with NodeJS, Express, Mongo and VueJS",https://github.com/icebob/vue-express-mongo-boilerplate,https://api.github.com/repos/icebob/vue-express-mongo-boilerplate/languages
derailed_benchmarks,Ruby,2285,117,,27,2014-10-15T20:56:37Z,485,"Go faster, off the Rails - Benchmarks for your whole Rails app",https://github.com/schneems/derailed_benchmarks,https://api.github.com/repos/schneems/derailed_benchmarks/languages
CoreStore,Swift,2285,170,mit,43,2014-12-14T12:26:04Z,11854,Unleashing the real power of Core Data with the elegance and safety of Swift,https://github.com/JohnEstropia/CoreStore,https://api.github.com/repos/JohnEstropia/CoreStore/languages
graphhopper,Java,2285,901,apache-2.0,257,2012-02-18T19:57:38Z,76806,An open source route planning library and server using OpenStreetMap.,https://github.com/graphhopper/graphhopper,https://api.github.com/repos/graphhopper/graphhopper/languages
doppler,JavaScript,2285,173,mit,6,2015-03-08T18:21:59Z,7167,:wave: Motion detection using the doppler effect,https://github.com/DanielRapp/doppler,https://api.github.com/repos/DanielRapp/doppler/languages
tensorflow-internals,TeX,2285,487,,12,2018-06-30T02:50:29Z,106970,It is open source ebook about TensorFlow kernel and implementation mechanism.,https://github.com/horance-liu/tensorflow-internals,https://api.github.com/repos/horance-liu/tensorflow-internals/languages
LifeHelper,Java,2285,519,,10,2017-09-28T07:44:04Z,118907,ç»„ä»¶åŒ–ç»¼åˆæ¡ˆä¾‹ï¼ŒåŒ…å«å¾®ä¿¡æ–°é—»ï¼Œå¤´æ¡è§†é¢‘ï¼Œç¾å¥³å›¾ç‰‡ï¼Œç™¾åº¦éŸ³ä¹ï¼Œå¹²æ´»é›†ä¸­è¥ï¼Œç©Androidï¼Œè±†ç“£è¯»ä¹¦ç”µå½±ï¼ŒçŸ¥ä¹æ—¥æŠ¥ç­‰ç­‰æ¨¡å—ã€‚æ¶æ„æ¨¡å¼ï¼šç»„ä»¶åŒ–+MVP+Rx+Retrofit+Desgin+Dagger2+é˜¿é‡ŒVLayout+è…¾è®¯X5+è…¾è®¯buglyã€‚å®‰è£…é˜¿é‡Œç¼–ç è§„çº¦æ’ä»¶ï¼Œä¸æ–­ä¿®æ­£ä¸åˆç†ä»£ç å’Œæœ€å¤§ç¨‹åº¦å»é™¤é»„è‰²è­¦å‘Šï¼ï¼ï¼èåˆå¼€å‘ä¸­éœ€è¦çš„å„ç§å°æ¡ˆä¾‹ï¼,https://github.com/yangchong211/LifeHelper,https://api.github.com/repos/yangchong211/LifeHelper/languages
bootlint,JavaScript,2284,320,mit,50,2014-07-02T14:55:13Z,3330,HTML linter for Bootstrap projects,https://github.com/twbs/bootlint,https://api.github.com/repos/twbs/bootlint/languages
ansible-container,Python,2284,424,lgpl-3.0,200,2016-05-05T18:40:29Z,4348,DEPRECATED -- Ansible Container was a tool to build Docker images and orchestrate containers using only Ansible playbooks.,https://github.com/ansible/ansible-container,https://api.github.com/repos/ansible/ansible-container/languages
fiora,TypeScript,2284,509,mit,19,2016-02-15T14:47:58Z,11637,"An interesting chat application power by socket.io, koa, mongodb and react",https://github.com/yinxin630/fiora,https://api.github.com/repos/yinxin630/fiora/languages
startbootstrap-sb-admin,CSS,2283,1635,mit,12,2014-10-25T00:36:38Z,28266,"A free, open source, Bootstrap admin theme created by Start Bootstrap",https://github.com/BlackrockDigital/startbootstrap-sb-admin,https://api.github.com/repos/BlackrockDigital/startbootstrap-sb-admin/languages
MaterialIntroView,Java,2283,367,,47,2016-01-30T13:08:17Z,3102,Material Intro View is a showcase android library.,https://github.com/iammert/MaterialIntroView,https://api.github.com/repos/iammert/MaterialIntroView/languages
mpdf,PHP,2283,617,gpl-2.0,249,2015-03-03T11:44:47Z,88074,PHP library generating PDF files from UTF-8 encoded HTML,https://github.com/mpdf/mpdf,https://api.github.com/repos/mpdf/mpdf/languages
fr_public,C++,2283,265,,17,2012-04-11T05:28:30Z,47174,Farbrausch demo tools 2001-2011,https://github.com/farbrausch/fr_public,https://api.github.com/repos/farbrausch/fr_public/languages
now,Go,2282,144,mit,0,2013-11-18T10:55:30Z,74,Now is a time toolkit for golang,https://github.com/jinzhu/now,https://api.github.com/repos/jinzhu/now/languages
TelegramSwift,Swift,2282,363,gpl-2.0,222,2017-10-10T10:14:10Z,153233,Source code of Telegram for macos on Swift 5.0,https://github.com/overtake/TelegramSwift,https://api.github.com/repos/overtake/TelegramSwift/languages
schematics,Python,2281,277,other,103,2010-12-27T02:25:29Z,2103,Python Data Structures for Humansâ„¢.,https://github.com/schematics/schematics,https://api.github.com/repos/schematics/schematics/languages
Bastillion,JavaScript,2281,304,agpl-3.0,77,2013-02-07T23:11:49Z,3152,Bastillion is a web-based SSH console that centrally manages administrative access to systems. Web-based administration is combined with management and distribution of user's public SSH keys.,https://github.com/bastillion-io/Bastillion,https://api.github.com/repos/bastillion-io/Bastillion/languages
pannellum,JavaScript,2280,437,mit,118,2012-09-17T15:43:07Z,100382,"Pannellum is a lightweight, free, and open source panorama viewer for the web.",https://github.com/mpetroff/pannellum,https://api.github.com/repos/mpetroff/pannellum/languages
xmake,C,2280,249,apache-2.0,29,2015-04-23T03:37:31Z,19437,ğŸ”¥ A cross-platform build utility based on Lua,https://github.com/xmake-io/xmake,https://api.github.com/repos/xmake-io/xmake/languages
pfsense,PHP,2280,920,apache-2.0,21,2011-05-12T19:44:21Z,315220,Main repository for pfSense,https://github.com/pfsense/pfsense,https://api.github.com/repos/pfsense/pfsense/languages
bouncer,PHP,2280,241,mit,30,2015-09-17T00:34:40Z,2921,Eloquent roles and abilities.,https://github.com/JosephSilber/bouncer,https://api.github.com/repos/JosephSilber/bouncer/languages
