paris,PHP,1013,144,,0,2010-09-29T11:51:54Z,247,"A lightweight Active Record implementation for PHP5, built on top of Idiorm.",https://github.com/j4mie/paris,https://api.github.com/repos/j4mie/paris/languages
radon,Jupyter Notebook,1013,67,mit,9,2012-09-20T18:58:58Z,2605,Various code metrics for Python code,https://github.com/rubik/radon,https://api.github.com/repos/rubik/radon/languages
Inveigh,PowerShell,1013,245,other,7,2015-04-02T18:04:41Z,1103,Windows PowerShell ADIDNS/LLMNR/mDNS/NBNS spoofer/man-in-the-middle tool,https://github.com/Kevin-Robertson/Inveigh,https://api.github.com/repos/Kevin-Robertson/Inveigh/languages
installer,Shell,1013,169,gpl-2.0,55,2015-08-29T05:18:52Z,89225,Anarchy Linux - A simple and intuitive Arch Linux installer. https://www.anarchylinux.org/,https://github.com/AnarchyLinux/installer,https://api.github.com/repos/AnarchyLinux/installer/languages
comeonin,Elixir,1013,64,other,2,2014-12-19T09:38:57Z,488,Password hashing specification for the Elixir programming language,https://github.com/riverrun/comeonin,https://api.github.com/repos/riverrun/comeonin/languages
ps-lite,C++,1013,411,apache-2.0,70,2015-04-26T19:29:30Z,740,A lightweight parameter server interface,https://github.com/dmlc/ps-lite,https://api.github.com/repos/dmlc/ps-lite/languages
ansible-elasticsearch,Ruby,1013,579,other,36,2015-04-30T07:21:20Z,930,Ansible playbook for Elasticsearch,https://github.com/elastic/ansible-elasticsearch,https://api.github.com/repos/elastic/ansible-elasticsearch/languages
wechat-weapp-movie,JavaScript,1013,307,mit,25,2016-11-25T09:46:04Z,228,🎬电影推荐 - 微信小程序,https://github.com/sesine/wechat-weapp-movie,https://api.github.com/repos/sesine/wechat-weapp-movie/languages
litecli,Python,1013,25,bsd-3-clause,7,2018-05-13T14:11:49Z,2305,CLI for SQLite Databases with auto-completion and syntax highlighting,https://github.com/dbcli/litecli,https://api.github.com/repos/dbcli/litecli/languages
AspNetCore.Diagnostics.HealthChecks,C#,1013,206,apache-2.0,77,2018-09-27T10:50:21Z,2283,Enterprise HealthChecks for ASP.NET Core Diagnostics Package,https://github.com/Xabaril/AspNetCore.Diagnostics.HealthChecks,https://api.github.com/repos/Xabaril/AspNetCore.Diagnostics.HealthChecks/languages
CTF-pwn-tips,null,1013,163,,1,2017-01-19T09:27:53Z,39,Here record some tips about pwn. Something is obsoleted and won't be updated. Sorry about that.,https://github.com/Naetw/CTF-pwn-tips,https://api.github.com/repos/Naetw/CTF-pwn-tips/languages
craco,JavaScript,1013,71,apache-2.0,5,2018-10-14T21:49:44Z,1069,"Create React App Configuration Override, an easy and comprehensible configuration layer for create-react-app",https://github.com/gsoft-inc/craco,https://api.github.com/repos/gsoft-inc/craco/languages
gifi,JavaScript,1013,42,mit,7,2016-02-23T20:54:47Z,8314,watch GIFs while running npm install,https://github.com/vadimdemedes/gifi,https://api.github.com/repos/vadimdemedes/gifi/languages
psi-probe,Java,1013,340,other,167,2015-03-16T15:15:01Z,29617,"Advanced manager and monitor for Apache Tomcat, forked from Lambda Probe",https://github.com/psi-probe/psi-probe,https://api.github.com/repos/psi-probe/psi-probe/languages
jquery-toast-plugin,JavaScript,1013,314,,26,2014-10-01T14:47:46Z,187,Highly customizable jquery plugin to show toast messages,https://github.com/kamranahmedse/jquery-toast-plugin,https://api.github.com/repos/kamranahmedse/jquery-toast-plugin/languages
slackcat,Go,1012,38,mit,3,2015-12-30T18:46:01Z,114,CLI utility to post files and command output to slack ,https://github.com/bcicen/slackcat,https://api.github.com/repos/bcicen/slackcat/languages
datepicker,JavaScript,1012,423,mit,28,2014-02-11T05:37:29Z,1159,A simple jQuery datepicker plugin.,https://github.com/fengyuanchen/datepicker,https://api.github.com/repos/fengyuanchen/datepicker/languages
svgo-compressor,JavaScript,1012,43,mit,11,2016-05-30T15:07:51Z,1056,"A Plugin that compresses SVG assets using SVGO, right when you export them. This Plugin requires Sketch 3.8.",https://github.com/sketch-hq/svgo-compressor,https://api.github.com/repos/sketch-hq/svgo-compressor/languages
datasciencecoursera,HTML,1012,830,,7,2016-12-27T03:59:24Z,34250,Data Science Repo and blog for John Hopkins Coursera Courses. Please let me know if you have any questions.,https://github.com/mGalarnyk/datasciencecoursera,https://api.github.com/repos/mGalarnyk/datasciencecoursera/languages
JNWSpringAnimation,Objective-C,1012,72,mit,0,2013-06-03T01:50:51Z,77,Spring physics for Core Animation.,https://github.com/jwilling/JNWSpringAnimation,https://api.github.com/repos/jwilling/JNWSpringAnimation/languages
react-virtualized-select,JavaScript,1012,141,mit,12,2016-03-30T04:52:03Z,4038,HOC that uses react-virtualized and react-select to display large lists of options in a drop-down,https://github.com/bvaughn/react-virtualized-select,https://api.github.com/repos/bvaughn/react-virtualized-select/languages
jekyll-assets,Ruby,1012,144,mit,58,2012-10-21T22:43:15Z,3724,:art: Asset pipelines for Jekyll.,https://github.com/envygeeks/jekyll-assets,https://api.github.com/repos/envygeeks/jekyll-assets/languages
EFCircularSlider,Objective-C,1012,168,mit,23,2013-12-04T15:53:21Z,450,An extensible circular slider for iOS applications,https://github.com/eliotfowler/EFCircularSlider,https://api.github.com/repos/eliotfowler/EFCircularSlider/languages
python-anti-patterns,null,1012,186,other,33,2014-07-25T13:39:52Z,1514,"An open collection of Python anti-patterns and ""worst practices"".",https://github.com/quantifiedcode/python-anti-patterns,https://api.github.com/repos/quantifiedcode/python-anti-patterns/languages
DSB2017,Python,1012,372,,75,2017-05-04T17:48:05Z,40461,The solution of team 'grt123' in DSB2017,https://github.com/lfz/DSB2017,https://api.github.com/repos/lfz/DSB2017/languages
VideoPose3D,Python,1012,247,other,56,2018-10-18T22:59:49Z,9729,Efficient 3D human pose estimation in video using 2D keypoint trajectories,https://github.com/facebookresearch/VideoPose3D,https://api.github.com/repos/facebookresearch/VideoPose3D/languages
fopnp,Python,1012,503,,0,2013-12-10T19:21:57Z,1188,Foundations of Python Network Programming (Apress) — scripts and examples,https://github.com/brandon-rhodes/fopnp,https://api.github.com/repos/brandon-rhodes/fopnp/languages
zero-width-detection,JavaScript,1012,78,,0,2018-01-02T15:14:06Z,1339,Invisibly inserting usernames into text with Zero-Width Characters,https://github.com/umpox/zero-width-detection,https://api.github.com/repos/umpox/zero-width-detection/languages
warzone2100,C++,1012,304,other,45,2010-11-16T04:36:26Z,629055,Warzone 2100 - a free and open source real time strategy game.,https://github.com/Warzone2100/warzone2100,https://api.github.com/repos/Warzone2100/warzone2100/languages
terminal-slack,JavaScript,1012,98,mit,26,2015-05-10T00:14:25Z,1704,Terminal client for slack,https://github.com/evanyeung/terminal-slack,https://api.github.com/repos/evanyeung/terminal-slack/languages
a11y.css,CSS,1012,80,mit,28,2013-11-21T14:52:20Z,11764,This CSS file intends to warn developers about possible risks and mistakes that exist in HTML code. It can also be used to roughly evaluate a site's quality by simply including it as an external stylesheet.,https://github.com/ffoodd/a11y.css,https://api.github.com/repos/ffoodd/a11y.css/languages
skicka,Go,1012,104,apache-2.0,33,2014-08-14T23:28:35Z,535,Command-line utility for working with Google Drive. Join the mailing list at https://groups.google.com/forum/#!forum/skicka-users.,https://github.com/google/skicka,https://api.github.com/repos/google/skicka/languages
THREE.MeshLine,JavaScript,1012,158,mit,47,2015-11-20T23:12:16Z,6277,Mesh replacement for THREE.Line,https://github.com/spite/THREE.MeshLine,https://api.github.com/repos/spite/THREE.MeshLine/languages
ggthemes,R,1012,197,,2,2012-09-07T00:00:07Z,43212,"Additional themes, scales, and geoms for ggplot2",https://github.com/jrnold/ggthemes,https://api.github.com/repos/jrnold/ggthemes/languages
FiftyShadesOf,Java,1012,147,apache-2.0,5,2016-08-29T16:28:42Z,1031,An elegant context-care loading placeholder for Android,https://github.com/florent37/FiftyShadesOf,https://api.github.com/repos/florent37/FiftyShadesOf/languages
detect-secrets,Python,1012,93,apache-2.0,44,2017-12-05T00:38:38Z,1008,An enterprise friendly way of detecting and preventing secrets in code.,https://github.com/Yelp/detect-secrets,https://api.github.com/repos/Yelp/detect-secrets/languages
iced,Rust,1012,26,mit,21,2019-07-15T22:34:46Z,587,"A renderer-agnostic GUI library for Rust, inspired by Elm",https://github.com/hecrj/iced,https://api.github.com/repos/hecrj/iced/languages
Android-ReadTheFuckingSourceCode,HTML,1012,233,,0,2016-08-26T04:16:09Z,44606,😜 记录日常的开发技巧，开发中遇到的技术重点、难点，各个知识点的总结，优质面试题等等。持续更新...,https://github.com/jeanboydev/Android-ReadTheFuckingSourceCode,https://api.github.com/repos/jeanboydev/Android-ReadTheFuckingSourceCode/languages
vue-clipboard2,JavaScript,1012,135,mit,11,2017-01-04T13:23:48Z,377,A simple vue2 binding to clipboard.js,https://github.com/Inndy/vue-clipboard2,https://api.github.com/repos/Inndy/vue-clipboard2/languages
coinbasepro-python,Python,1012,487,mit,48,2016-07-14T23:01:09Z,280,The unofficial Python client for the Coinbase Pro API,https://github.com/danpaquin/coinbasepro-python,https://api.github.com/repos/danpaquin/coinbasepro-python/languages
pywit,Python,1012,289,other,25,2014-09-29T22:55:24Z,89,Python library for Wit.ai,https://github.com/wit-ai/pywit,https://api.github.com/repos/wit-ai/pywit/languages
Piplin,PHP,1012,204,mit,18,2016-09-07T13:31:11Z,6840,:outbox_tray: An open source self-hosted continuous integration and deployment system - QQ群： 656868 ,https://github.com/Piplin/Piplin,https://api.github.com/repos/Piplin/Piplin/languages
docbox,CSS,1012,178,isc,3,2016-03-03T00:27:53Z,196,REST API documentation generator,https://github.com/tmcw/docbox,https://api.github.com/repos/tmcw/docbox/languages
lager,Erlang,1012,442,apache-2.0,34,2011-06-24T15:19:23Z,2035,A logging framework for Erlang/OTP,https://github.com/erlang-lager/lager,https://api.github.com/repos/erlang-lager/lager/languages
veldrid,C#,1011,98,mit,42,2016-02-25T23:00:28Z,92882,"A low-level, portable graphics library for .NET.",https://github.com/mellinoe/veldrid,https://api.github.com/repos/mellinoe/veldrid/languages
pad,Java,1011,199,other,1,2010-01-13T21:45:15Z,28012,Etherpad Open-Source Repository,https://github.com/ether/pad,https://api.github.com/repos/ether/pad/languages
delaunator,JavaScript,1011,66,isc,3,2017-05-16T11:28:13Z,1226,An incredibly fast JavaScript library for Delaunay triangulation of 2D points,https://github.com/mapbox/delaunator,https://api.github.com/repos/mapbox/delaunator/languages
tfjs-node,TypeScript,1011,105,apache-2.0,7,2018-02-12T18:23:36Z,144392,TensorFlow powered JavaScript library for training and deploying ML models on Node.js.,https://github.com/tensorflow/tfjs-node,https://api.github.com/repos/tensorflow/tfjs-node/languages
rest,JavaScript,1011,160,other,0,2012-05-23T23:11:04Z,1088,RESTful HTTP client for JavaScript,https://github.com/cujojs/rest,https://api.github.com/repos/cujojs/rest/languages
NLua,C#,1011,216,mit,9,2013-03-06T14:27:53Z,80091,Bridge between Lua and the .NET.,https://github.com/NLua/NLua,https://api.github.com/repos/NLua/NLua/languages
rlpyt,Python,1011,132,mit,23,2019-04-28T18:29:02Z,883,Reinforcement Learning in PyTorch,https://github.com/astooke/rlpyt,https://api.github.com/repos/astooke/rlpyt/languages
oneliners,null,1011,315,,4,2013-10-19T11:33:26Z,556,Useful bash one-liners for bioinformatics.,https://github.com/stephenturner/oneliners,https://api.github.com/repos/stephenturner/oneliners/languages
Negotiation,PHP,1011,43,mit,6,2013-01-18T19:28:50Z,315,Content Negotiation tools for PHP.,https://github.com/willdurand/Negotiation,https://api.github.com/repos/willdurand/Negotiation/languages
Essentials,C#,1011,265,other,118,2018-02-20T17:11:53Z,14049,Essential cross platform APIs for your mobile apps.,https://github.com/xamarin/Essentials,https://api.github.com/repos/xamarin/Essentials/languages
sass.js,JavaScript,1011,114,mit,11,2014-01-12T21:03:33Z,52786,Sass.js - API for emscripted libsass to run in the browser,https://github.com/medialize/sass.js,https://api.github.com/repos/medialize/sass.js/languages
agda,Haskell,1011,134,other,613,2015-08-08T17:51:48Z,108425,Agda is a dependently typed programming language / interactive theorem prover.,https://github.com/agda/agda,https://api.github.com/repos/agda/agda/languages
linux,C,1011,229,,83,2012-02-08T21:24:37Z,8259,dtrace for linux - kernel driver and userland tools,https://github.com/dtrace4linux/linux,https://api.github.com/repos/dtrace4linux/linux/languages
Ulauncher,Python,1011,64,gpl-3.0,102,2015-05-10T08:44:08Z,2373,Linux Application Launcher,https://github.com/Ulauncher/Ulauncher,https://api.github.com/repos/Ulauncher/Ulauncher/languages
wtforms,Python,1011,290,other,62,2013-09-11T01:53:07Z,2077,A flexible forms validation and rendering library for Python.,https://github.com/wtforms/wtforms,https://api.github.com/repos/wtforms/wtforms/languages
mammoth.js,JavaScript,1011,179,bsd-2-clause,40,2013-03-29T21:41:02Z,1146,Convert Word documents (.docx files) to HTML,https://github.com/mwilliamson/mammoth.js,https://api.github.com/repos/mwilliamson/mammoth.js/languages
common-workflow-language,Python,1010,162,apache-2.0,245,2014-09-25T11:04:47Z,3501,Repository for the CWL standards. Use https://cwl.discourse.group/ for support 😊,https://github.com/common-workflow-language/common-workflow-language,https://api.github.com/repos/common-workflow-language/common-workflow-language/languages
Chat-Buy-React,JavaScript,1010,137,gpl-3.0,3,2017-11-21T08:45:37Z,535," Client for beginners to learn, built with React / Redux / Node",https://github.com/KieSun/Chat-Buy-React,https://api.github.com/repos/KieSun/Chat-Buy-React/languages
noisejs,JavaScript,1010,167,isc,9,2012-07-01T10:44:25Z,13,Javascript 2D Perlin & Simplex noise functions,https://github.com/josephg/noisejs,https://api.github.com/repos/josephg/noisejs/languages
ios-swift-collapsible-table-section,Swift,1010,133,mit,14,2016-05-30T17:05:54Z,5371,:iphone: A simple iOS Swift project demonstrates how to implement collapsible table section.,https://github.com/jeantimex/ios-swift-collapsible-table-section,https://api.github.com/repos/jeantimex/ios-swift-collapsible-table-section/languages
react-in-patterns-cn,JavaScript,1010,113,mit,0,2018-04-28T05:15:40Z,152014,React in patterns 中文版,https://github.com/SangKa/react-in-patterns-cn,https://api.github.com/repos/SangKa/react-in-patterns-cn/languages
MPlayerX,Objective-C,1010,272,,12,2011-01-07T01:35:45Z,294975,media player on Mac OS X,https://github.com/niltsh/MPlayerX,https://api.github.com/repos/niltsh/MPlayerX/languages
firebase-php,PHP,1010,226,mit,14,2015-01-07T23:07:53Z,1784,Unofficial Firebase Admin SDK for PHP,https://github.com/kreait/firebase-php,https://api.github.com/repos/kreait/firebase-php/languages
hybrid,TypeScript,1010,390,mit,59,2014-11-12T21:37:53Z,3725,"[I don't have time to work on this anymore. Use at your own risk] Build WordPress based PWA, iOS, Android & Windows phones apps in minutes!",https://github.com/wordpress-clients/hybrid,https://api.github.com/repos/wordpress-clients/hybrid/languages
awesome-mpvue,null,1010,131,,0,2018-03-13T16:11:05Z,52,A curated list of awesome things related to mpvue,https://github.com/mpvue/awesome-mpvue,https://api.github.com/repos/mpvue/awesome-mpvue/languages
statrethinking_winter2019,null,1010,167,,22,2018-10-24T07:28:55Z,5100,Statistical Rethinking course at MPI-EVA from Dec 2018 through Feb 2019,https://github.com/rmcelreath/statrethinking_winter2019,https://api.github.com/repos/rmcelreath/statrethinking_winter2019/languages
zap-desktop,JavaScript,1010,187,mit,110,2017-08-10T16:14:13Z,217308,Cross platform Lightning Network wallet focused on user experience and ease of use ⚡️,https://github.com/LN-Zap/zap-desktop,https://api.github.com/repos/LN-Zap/zap-desktop/languages
mantra,Shell,1010,60,,82,2016-01-01T09:54:15Z,259,Mantra - An Application Architecture for Meteor,https://github.com/kadirahq/mantra,https://api.github.com/repos/kadirahq/mantra/languages
laydate,JavaScript,1010,580,mit,59,2014-06-21T07:55:47Z,110,layDate（日期与时间组件） 是 layui 独立维护的三大组件之一,https://github.com/sentsin/laydate,https://api.github.com/repos/sentsin/laydate/languages
ngSemantic,TypeScript,1010,171,mit,98,2015-09-27T17:23:04Z,7968,Angular 2 building blocks :package: based on Semantic UI,https://github.com/vladotesanovic/ngSemantic,https://api.github.com/repos/vladotesanovic/ngSemantic/languages
arc-icon-theme,Shell,1010,91,gpl-3.0,40,2016-06-05T13:34:57Z,4838,null,https://github.com/horst3180/arc-icon-theme,https://api.github.com/repos/horst3180/arc-icon-theme/languages
universe-starter-agent,Python,1010,298,mit,0,2016-11-17T21:47:52Z,2452,A starter agent that can solve a number of universe environments.,https://github.com/openai/universe-starter-agent,https://api.github.com/repos/openai/universe-starter-agent/languages
MMPlaceHolder,Objective-C,1010,146,mit,1,2014-08-11T03:19:11Z,3014,A drop in solution to show UIView's size. Only one line code to use it.,https://github.com/adad184/MMPlaceHolder,https://api.github.com/repos/adad184/MMPlaceHolder/languages
Edit-This-Cookie,JavaScript,1010,326,other,113,2012-07-15T08:52:18Z,3433,EditThisCookie is the famous Google Chrome/Chromium extension for editing cookies ,https://github.com/ETCExtensions/Edit-This-Cookie,https://api.github.com/repos/ETCExtensions/Edit-This-Cookie/languages
Hermes,Java,1010,165,other,6,2016-04-26T12:25:35Z,323,"A smart, novel and easy-to-use framework for Android Inter-Process Communication (IPC). （简单易用的安卓进程间通信IPC框架）",https://github.com/Xiaofei-it/Hermes,https://api.github.com/repos/Xiaofei-it/Hermes/languages
handtracking,Python,1010,296,apache-2.0,9,2017-11-26T05:47:39Z,161267,Building a Real-time Hand-Detector using Neural Networks (SSD) on Tensorflow,https://github.com/victordibia/handtracking,https://api.github.com/repos/victordibia/handtracking/languages
ActivitySwitcher,Java,1010,132,,4,2016-10-11T05:55:08Z,3952,"ActivitySwitcher is based on the Activity view operation management library, you can achieve any jump between Activity, close any Activity and end applications and other functions.",https://github.com/Hitomis/ActivitySwitcher,https://api.github.com/repos/Hitomis/ActivitySwitcher/languages
deep3d,Jupyter Notebook,1010,210,,31,2016-04-02T06:24:26Z,3198,Automatic 2D-to-3D Video Conversion with CNNs,https://github.com/piiswrong/deep3d,https://api.github.com/repos/piiswrong/deep3d/languages
MMLayershots,Objective-C,1010,67,mit,9,2014-05-18T13:07:46Z,163,Layershots converts your iOS screenshot into a layered photoshop (PSD) file.,https://github.com/vpdn/MMLayershots,https://api.github.com/repos/vpdn/MMLayershots/languages
django-jsonfield,Python,1010,237,mit,50,2009-05-03T03:42:01Z,135,A reusable JSONField model for Django to store ad-hoc data,https://github.com/dmkoch/django-jsonfield,https://api.github.com/repos/dmkoch/django-jsonfield/languages
Metascala,Scala,1010,93,,0,2013-03-03T03:59:32Z,2032,A JVM written in Scala,https://github.com/lihaoyi/Metascala,https://api.github.com/repos/lihaoyi/Metascala/languages
loklak_webclient,JavaScript,1010,50,mit,5,2015-04-15T17:34:16Z,4466,loklak web application,https://github.com/fossasia/loklak_webclient,https://api.github.com/repos/fossasia/loklak_webclient/languages
