laravel-messenger,PHP,1810,424,mit,3,2014-10-29T17:39:44Z,338,Simple user messaging package for Laravel,https://github.com/cmgmyr/laravel-messenger,https://api.github.com/repos/cmgmyr/laravel-messenger/languages
html-to-react-components,JavaScript,1810,104,mit,0,2015-12-30T04:48:08Z,5698,Converts HTML pages into React components,https://github.com/roman01la/html-to-react-components,https://api.github.com/repos/roman01la/html-to-react-components/languages
tenacity,Python,1810,92,apache-2.0,21,2016-08-11T12:44:02Z,375,Retrying library for Python,https://github.com/jd/tenacity,https://api.github.com/repos/jd/tenacity/languages
openshift-ansible,Python,1809,2153,apache-2.0,890,2014-09-16T17:07:51Z,40409,OpenShift Installation and Configuration Management,https://github.com/openshift/openshift-ansible,https://api.github.com/repos/openshift/openshift-ansible/languages
AnimatedSvgView,Java,1809,233,apache-2.0,2,2016-05-25T21:22:43Z,601,Animated SVG Drawing for Android,https://github.com/jaredrummler/AnimatedSvgView,https://api.github.com/repos/jaredrummler/AnimatedSvgView/languages
awesome-github,null,1809,513,,0,2016-03-02T08:45:01Z,95,"A curated list of awesome GitHub guides, articles, sites, tools, projects and resources.  收集这个列表，只是为了更好地使用亲爱的GitHub,欢迎提交pr和issue。",https://github.com/AntBranch/awesome-github,https://api.github.com/repos/AntBranch/awesome-github/languages
sanitize-html,JavaScript,1809,217,mit,93,2013-09-09T20:12:33Z,388,"Clean up user-submitted HTML, preserving whitelisted elements and whitelisted attributes on a per-element basis. Built on htmlparser2 for speed and tolerance",https://github.com/apostrophecms/sanitize-html,https://api.github.com/repos/apostrophecms/sanitize-html/languages
youtube-8m,Python,1809,773,apache-2.0,8,2016-12-20T21:49:38Z,477,Starter code for working with the YouTube-8M dataset.,https://github.com/google/youtube-8m,https://api.github.com/repos/google/youtube-8m/languages
gulp-book,JavaScript,1809,388,,1,2015-03-20T15:11:44Z,7171, Gulp 入门指南,https://github.com/og/gulp-book,https://api.github.com/repos/og/gulp-book/languages
react-portal,JavaScript,1809,185,mit,13,2015-03-24T19:42:56Z,3764,"🎯 React component for transportation of modals, lightboxes, loading bars... to document.body or else.",https://github.com/tajo/react-portal,https://api.github.com/repos/tajo/react-portal/languages
compton,C,1809,354,other,260,2011-11-04T19:02:20Z,1215,A compositor for X11.,https://github.com/chjj/compton,https://api.github.com/repos/chjj/compton/languages
Thanos.sh,PowerShell,1809,231,mit,37,2018-08-20T02:35:07Z,23,"if you are Thanos(root), this command could delete half your files randomly",https://github.com/hotvulcan/Thanos.sh,https://api.github.com/repos/hotvulcan/Thanos.sh/languages
GraphEngine,C#,1809,257,other,48,2017-02-09T05:02:16Z,40287,Microsoft Graph Engine,https://github.com/microsoft/GraphEngine,https://api.github.com/repos/microsoft/GraphEngine/languages
tern_for_vim,Python,1809,99,mit,51,2013-04-29T11:53:51Z,93,Tern plugin for Vim,https://github.com/ternjs/tern_for_vim,https://api.github.com/repos/ternjs/tern_for_vim/languages
snyk,TypeScript,1809,166,other,79,2015-10-30T11:36:00Z,12891,CLI and build-time tool to find & fix known vulnerabilities in open-source dependencies,https://github.com/snyk/snyk,https://api.github.com/repos/snyk/snyk/languages
javascript-design-patterns-for-humans,null,1809,184,other,6,2017-02-21T08:10:03Z,105,An ultra-simplified explanation of design patterns implemented in javascript,https://github.com/sohamkamani/javascript-design-patterns-for-humans,https://api.github.com/repos/sohamkamani/javascript-design-patterns-for-humans/languages
d3-plugins,JavaScript,1808,708,other,69,2012-03-30T17:18:53Z,676,[DEPRECATED] A repository for sharing D3.js V3 plugins.,https://github.com/d3/d3-plugins,https://api.github.com/repos/d3/d3-plugins/languages
open-product-management,null,1808,370,,0,2016-03-22T00:39:55Z,764,A curated list of product management advice for technical people.,https://github.com/ProductHired/open-product-management,https://api.github.com/repos/ProductHired/open-product-management/languages
altair,TypeScript,1808,86,mit,15,2017-03-25T21:08:30Z,20107,✨⚡️ A beautiful feature-rich GraphQL Client for all platforms.,https://github.com/imolorhe/altair,https://api.github.com/repos/imolorhe/altair/languages
Custom-Metaboxes-and-Fields-for-WordPress,PHP,1808,442,,218,2011-02-21T20:58:50Z,976,Lets you easily create metaboxes with custom fields that will blow your mind.   ,https://github.com/WebDevStudios/Custom-Metaboxes-and-Fields-for-WordPress,https://api.github.com/repos/WebDevStudios/Custom-Metaboxes-and-Fields-for-WordPress/languages
pixelfed,PHP,1808,196,agpl-3.0,95,2018-04-17T01:48:45Z,21001,Photo Sharing. For Everyone.,https://github.com/pixelfed/pixelfed,https://api.github.com/repos/pixelfed/pixelfed/languages
grpc-node,JavaScript,1808,244,apache-2.0,157,2017-08-02T18:20:33Z,3086,gRPC for Node.js,https://github.com/grpc/grpc-node,https://api.github.com/repos/grpc/grpc-node/languages
BrightFutures,Swift,1808,179,mit,6,2014-06-08T10:57:27Z,894,Write great asynchronous code in Swift using futures and promises,https://github.com/Thomvis/BrightFutures,https://api.github.com/repos/Thomvis/BrightFutures/languages
circe,Scala,1808,392,other,97,2015-07-31T15:12:09Z,9459,Yet another JSON library for Scala,https://github.com/circe/circe,https://api.github.com/repos/circe/circe/languages
CtCI-6th-Edition-Python,Python,1808,755,,78,2016-02-12T04:47:40Z,40,Cracking the Coding Interview 6th Ed. Python Solutions,https://github.com/careercup/CtCI-6th-Edition-Python,https://api.github.com/repos/careercup/CtCI-6th-Edition-Python/languages
JavaVerbalExpressions,Java,1808,214,mit,15,2013-07-25T16:15:26Z,129,Java regular expressions made easy.,https://github.com/VerbalExpressions/JavaVerbalExpressions,https://api.github.com/repos/VerbalExpressions/JavaVerbalExpressions/languages
laravel-graphql,PHP,1808,232,,125,2015-08-13T15:02:04Z,539,"Facebook GraphQL for Laravel 5. It supports Relay, eloquent models, validation and GraphiQL.",https://github.com/folkloreinc/laravel-graphql,https://api.github.com/repos/folkloreinc/laravel-graphql/languages
handout,Python,1808,92,apache-2.0,13,2018-08-28T15:30:22Z,56,Turn Python scripts into handouts with Markdown and figures,https://github.com/danijar/handout,https://api.github.com/repos/danijar/handout/languages
rewind,Shell,1807,65,mit,2,2013-04-11T19:22:27Z,207,Rewind is an intelligent archivist.,https://github.com/gilesbowkett/rewind,https://api.github.com/repos/gilesbowkett/rewind/languages
sol2,C++,1807,188,mit,7,2016-01-07T03:09:13Z,24403,"Sol3 (sol2 v3.0) - a C++ <-> Lua API wrapper with advanced features and top notch performance - is here, and it's great! Documentation:",https://github.com/ThePhD/sol2,https://api.github.com/repos/ThePhD/sol2/languages
client_golang,Go,1807,489,apache-2.0,22,2013-01-25T16:32:46Z,1815,Prometheus instrumentation library for Go applications,https://github.com/prometheus/client_golang,https://api.github.com/repos/prometheus/client_golang/languages
DouBanSpider,Python,1807,1052,,9,2015-05-17T16:30:30Z,16448,豆瓣读书的爬虫,https://github.com/lanbing510/DouBanSpider,https://api.github.com/repos/lanbing510/DouBanSpider/languages
kapacitor,Go,1807,412,other,678,2015-08-31T14:54:42Z,19952,"Open source framework for processing, monitoring, and alerting on time series data",https://github.com/influxdata/kapacitor,https://api.github.com/repos/influxdata/kapacitor/languages
react-native-notifications,Objective-C,1807,410,mit,15,2016-04-06T13:17:44Z,9240,React Native Notifications,https://github.com/wix/react-native-notifications,https://api.github.com/repos/wix/react-native-notifications/languages
Shuffle,JavaScript,1807,283,mit,5,2011-12-24T18:33:07Z,13980,"Categorize, sort, and filter a responsive grid of items",https://github.com/Vestride/Shuffle,https://api.github.com/repos/Vestride/Shuffle/languages
awesome-ocaml,null,1807,127,,6,2014-07-24T12:57:22Z,9262,"A curated collection of awesome OCaml tools, frameworks, libraries and articles.",https://github.com/ocaml-community/awesome-ocaml,https://api.github.com/repos/ocaml-community/awesome-ocaml/languages
flat-color-icons,HTML,1807,261,other,5,2015-03-13T12:49:48Z,462,Free Flat Color Icons,https://github.com/icons8/flat-color-icons,https://api.github.com/repos/icons8/flat-color-icons/languages
android-percent-support-extend,Java,1806,512,apache-2.0,37,2015-06-30T12:39:20Z,2542,a extends lib for android-percent-support(Google百分比布局库的扩展),https://github.com/hongyangAndroid/android-percent-support-extend,https://api.github.com/repos/hongyangAndroid/android-percent-support-extend/languages
home,HTML,1806,130,,143,2015-03-07T06:39:46Z,6907,Rime::Home is home to Rime users and developers,https://github.com/rime/home,https://api.github.com/repos/rime/home/languages
prerender-loader,JavaScript,1806,44,apache-2.0,18,2018-05-30T18:04:38Z,74,📰 Painless universal pre-rendering for Webpack.,https://github.com/GoogleChromeLabs/prerender-loader,https://api.github.com/repos/GoogleChromeLabs/prerender-loader/languages
document-library,CSS,1806,267,,1,2018-08-20T02:05:39Z,104672,"jsliang 的文档库. 里面包含了个人撰写的所有前端文章，例如 Vue、React,、ECharts、微信小程序等……",https://github.com/LiangJunrong/document-library,https://api.github.com/repos/LiangJunrong/document-library/languages
ARAnalytics,Objective-C,1806,210,mit,19,2012-12-18T17:09:34Z,1748,Simplify your iOS/Mac analytics,https://github.com/orta/ARAnalytics,https://api.github.com/repos/orta/ARAnalytics/languages
joy4,Go,1806,348,mit,69,2016-07-03T08:53:36Z,590,Golang audio/video library and streaming server,https://github.com/nareix/joy4,https://api.github.com/repos/nareix/joy4/languages
pulsar,Python,1806,157,bsd-3-clause,26,2011-01-15T12:10:13Z,47729,Event driven concurrent framework for Python,https://github.com/quantmind/pulsar,https://api.github.com/repos/quantmind/pulsar/languages
CNN_sentence,Python,1805,804,,42,2014-12-04T03:33:02Z,506,CNNs for sentence classification,https://github.com/yoonkim/CNN_sentence,https://api.github.com/repos/yoonkim/CNN_sentence/languages
grakn,Java,1805,224,agpl-3.0,186,2016-07-11T23:59:57Z,80979,Grakn Core: The Knowledge Graph,https://github.com/graknlabs/grakn,https://api.github.com/repos/graknlabs/grakn/languages
flutter_swiper,Dart,1805,217,mit,119,2018-05-19T05:19:41Z,6397,"The best swiper for flutter , with multiple layouts, infinite loop. Compatible with Android & iOS.",https://github.com/best-flutter/flutter_swiper,https://api.github.com/repos/best-flutter/flutter_swiper/languages
euler,C++,1805,394,apache-2.0,99,2019-01-10T06:32:32Z,251,A distributed graph deep learning framework.,https://github.com/alibaba/euler,https://api.github.com/repos/alibaba/euler/languages
tauCharts,JavaScript,1805,111,other,41,2014-01-17T09:03:30Z,21395,D3 based data-focused charting library. Designed with passion. Flexible.,https://github.com/TargetProcess/tauCharts,https://api.github.com/repos/TargetProcess/tauCharts/languages
hawk,JavaScript,1805,161,other,0,2012-11-24T08:56:01Z,777,HTTP Holder-Of-Key Authentication Scheme,https://github.com/hapijs/hawk,https://api.github.com/repos/hapijs/hawk/languages
noc-examples-processing,Processing,1805,789,mit,46,2012-11-02T20:15:54Z,2508,Repository for example code from The Nature of Code book,https://github.com/nature-of-code/noc-examples-processing,https://api.github.com/repos/nature-of-code/noc-examples-processing/languages
node-windows,JavaScript,1804,269,other,78,2013-01-15T20:33:38Z,2098,"Windows support for Node.JS scripts (daemons, eventlog, UAC, etc).",https://github.com/coreybutler/node-windows,https://api.github.com/repos/coreybutler/node-windows/languages
PinterestSwift,Swift,1804,217,mit,0,2014-07-01T04:13:23Z,1988,This is a Swift based demo project to show how to make the transition Pinterest liked.,https://github.com/demonnico/PinterestSwift,https://api.github.com/repos/demonnico/PinterestSwift/languages
cms,C#,1804,776,gpl-3.0,1733,2017-04-26T06:56:34Z,67669,SiteServer CMS 基于.NET平台，能够以最低的成本、最少的人力投入在最短的时间内架设一个功能齐全、性能优异、规模庞大并易于维护的网站平台。,https://github.com/siteserver/cms,https://api.github.com/repos/siteserver/cms/languages
steem,C++,1803,710,other,363,2016-03-23T00:17:55Z,28970,The blockchain for Smart Media Tokens (SMTs) and decentralized applications.,https://github.com/steemit/steem,https://api.github.com/repos/steemit/steem/languages
emojify.js,JavaScript,1803,278,other,53,2012-12-08T18:22:38Z,58314,A Javascript module to convert Emoji keywords to images,https://github.com/joypixels/emojify.js,https://api.github.com/repos/joypixels/emojify.js/languages
android-segmented-control,Java,1803,404,,54,2014-02-06T17:45:28Z,1489,ios UISegmentedControl for android,https://github.com/Kaopiz/android-segmented-control,https://api.github.com/repos/Kaopiz/android-segmented-control/languages
bandit,Python,1803,175,apache-2.0,114,2018-04-26T09:08:12Z,1527,Bandit is a tool designed to find common security issues in Python code.,https://github.com/PyCQA/bandit,https://api.github.com/repos/PyCQA/bandit/languages
Ender,JavaScript,1803,84,other,22,2011-04-04T20:43:08Z,16947,the no-library library: open module JavaScript framework,https://github.com/ender-js/Ender,https://api.github.com/repos/ender-js/Ender/languages
gordon,JavaScript,1803,121,mit,17,2009-12-23T12:19:07Z,5461,An open source Flash™ runtime written in pure JavaScript,https://github.com/tobytailor/gordon,https://api.github.com/repos/tobytailor/gordon/languages
lingvo,Python,1803,273,apache-2.0,40,2018-07-24T22:30:28Z,37976,Lingvo,https://github.com/tensorflow/lingvo,https://api.github.com/repos/tensorflow/lingvo/languages
bleach,Python,1803,197,other,29,2010-02-19T01:12:41Z,910,Bleach is an allowed-list-based HTML sanitizing library that escapes or strips markup and attributes,https://github.com/mozilla/bleach,https://api.github.com/repos/mozilla/bleach/languages
laravel-vue-spa,PHP,1803,572,mit,20,2017-01-16T22:40:38Z,1992,A Laravel-Vue SPA starter project template.,https://github.com/cretueusebiu/laravel-vue-spa,https://api.github.com/repos/cretueusebiu/laravel-vue-spa/languages
MailDev,JavaScript,1803,226,other,60,2013-03-31T19:37:09Z,7924,:mailbox: SMTP Server + Web Interface for viewing and testing emails during development.,https://github.com/djfarrelly/MailDev,https://api.github.com/repos/djfarrelly/MailDev/languages
rtop,Go,1802,146,other,18,2015-05-09T11:24:54Z,31,"rtop is an interactive, remote system monitoring tool based on SSH",https://github.com/rapidloop/rtop,https://api.github.com/repos/rapidloop/rtop/languages
snap,Go,1802,288,apache-2.0,150,2014-08-13T21:04:51Z,60981,The open telemetry framework,https://github.com/intelsdi-x/snap,https://api.github.com/repos/intelsdi-x/snap/languages
yalu102,Objective-C,1802,591,wtfpl,70,2017-01-25T17:40:36Z,7813,incomplete iOS 10.2 jailbreak for 64 bit devices by qwertyoruiopz and marcograssi,https://github.com/kpwn/yalu102,https://api.github.com/repos/kpwn/yalu102/languages
scrollability,JavaScript,1802,152,other,22,2011-05-20T02:24:43Z,1255,Imitates iOS native scrolling in JavaScript.,https://github.com/joehewitt/scrollability,https://api.github.com/repos/joehewitt/scrollability/languages
The-Powder-Toy,C++,1802,533,gpl-3.0,49,2010-07-25T13:47:06Z,29361,"Written in C++ and using SDL, The Powder Toy is a desktop version of the classic 'falling sand' physics sandbox, it simulates air pressure and velocity as well as heat.",https://github.com/The-Powder-Toy/The-Powder-Toy,https://api.github.com/repos/The-Powder-Toy/The-Powder-Toy/languages
-archived-chromium,null,1802,703,,13,2008-10-21T00:16:21Z,726809,"Old and archived, see https://github.com/chromium/chromium instead.",https://github.com/chromium/-archived-chromium,https://api.github.com/repos/chromium/-archived-chromium/languages
SyncTrayzor,C#,1801,176,mit,71,2015-02-08T17:08:40Z,11455,Windows tray utility / filesystem watcher / launcher for Syncthing,https://github.com/canton7/SyncTrayzor,https://api.github.com/repos/canton7/SyncTrayzor/languages
SRL-PHP,PHP,1801,72,mit,9,2016-08-16T08:56:01Z,106,Simple Regex Language,https://github.com/SimpleRegex/SRL-PHP,https://api.github.com/repos/SimpleRegex/SRL-PHP/languages
kubeedge,Go,1801,439,apache-2.0,186,2018-09-28T08:57:49Z,48680,Kubernetes Native Edge Computing Framework (project under CNCF),https://github.com/kubeedge/kubeedge,https://api.github.com/repos/kubeedge/kubeedge/languages
prowler,Shell,1801,321,other,26,2016-08-24T15:12:24Z,1048,"AWS Security Best Practices Assessment, Auditing, Hardening and Forensics Readiness Tool. It follows guidelines of the CIS Amazon Web Services Foundations Benchmark and DOZENS of additional checks including GDPR and HIPAA (+100). Official CIS for AWS guide: https://d0.awsstatic.com/whitepapers/compliance/AWS_CIS_Foundations_Benchmark.pdf",https://github.com/toniblyx/prowler,https://api.github.com/repos/toniblyx/prowler/languages
BarrageRenderer,Objective-C,1801,389,mit,29,2015-07-15T14:06:12Z,5301,一个 iOS 上的弹幕渲染库.,https://github.com/unash/BarrageRenderer,https://api.github.com/repos/unash/BarrageRenderer/languages
iOSCourse,Objective-C,1801,779,,0,2014-05-25T02:41:58Z,628322,iOS开发初学者入门,https://github.com/eseedo/iOSCourse,https://api.github.com/repos/eseedo/iOSCourse/languages
LollipopShowcase,Java,1801,524,apache-2.0,0,2014-10-22T19:57:16Z,9176,"A simple app to showcase Androids Material Design and some of the cool new cool stuff in Android Lollipop. RecyclerView, CardView, ActionBarDrawerToggle, DrawerLayout, Animations, Android Compat Design, Toolbar",https://github.com/mikepenz/LollipopShowcase,https://api.github.com/repos/mikepenz/LollipopShowcase/languages
react-server-example,JavaScript,1801,213,mit,1,2013-12-28T14:00:38Z,114,A simple example of how to do server-side rendering with React (no compilation needed),https://github.com/mhart/react-server-example,https://api.github.com/repos/mhart/react-server-example/languages
Kosmos,null,1801,161,,1,2018-06-04T11:58:11Z,185076, All-in-One CFW Package for the Nintendo Switch - previously SDFilesSwitch,https://github.com/AtlasNX/Kosmos,https://api.github.com/repos/AtlasNX/Kosmos/languages
brigade,Go,1801,190,apache-2.0,92,2017-10-23T23:00:48Z,54618,Event-based Scripting for Kubernetes.,https://github.com/brigadecore/brigade,https://api.github.com/repos/brigadecore/brigade/languages
gocrawl,Go,1800,184,bsd-3-clause,6,2012-09-19T02:08:15Z,371,"Polite, slim and concurrent web crawler.",https://github.com/PuerkitoBio/gocrawl,https://api.github.com/repos/PuerkitoBio/gocrawl/languages
go-build-template,Makefile,1800,260,apache-2.0,16,2016-09-21T03:16:57Z,29,A Makefile/Dockerfile example for Go projects.,https://github.com/thockin/go-build-template,https://api.github.com/repos/thockin/go-build-template/languages
sigma,Python,1800,462,,74,2016-12-24T09:48:49Z,8963,Generic Signature Format for SIEM Systems,https://github.com/Neo23x0/sigma,https://api.github.com/repos/Neo23x0/sigma/languages
gloo,Go,1800,121,apache-2.0,239,2018-01-22T20:19:49Z,59473,An Envoy-Powered API Gateway,https://github.com/solo-io/gloo,https://api.github.com/repos/solo-io/gloo/languages
akita,TypeScript,1800,151,apache-2.0,2,2018-06-11T09:03:03Z,5727,🚀 State Management Tailored-Made for JS Applications,https://github.com/datorama/akita,https://api.github.com/repos/datorama/akita/languages
wtftw,Rust,1800,70,bsd-3-clause,15,2014-11-01T17:54:09Z,515,Window Tiling For The Win. A tiling window manager written in Rust,https://github.com/Kintaro/wtftw,https://api.github.com/repos/Kintaro/wtftw/languages
TimeLine,Java,1800,247,,0,2017-06-09T10:27:34Z,36303,瀑布流式的时间轴,https://github.com/vivian8725118/TimeLine,https://api.github.com/repos/vivian8725118/TimeLine/languages
netmq,C#,1800,558,other,179,2012-11-03T15:50:06Z,11090,A 100% native C# implementation of ZeroMQ for .NET,https://github.com/zeromq/netmq,https://api.github.com/repos/zeromq/netmq/languages
