common-workflow-language,Python,1010,162,apache-2.0,245,2014-09-25T11:04:47Z,3501,Repository for the CWL standards. Use https://cwl.discourse.group/ for support 😊,https://github.com/common-workflow-language/common-workflow-language,https://api.github.com/repos/common-workflow-language/common-workflow-language/languages
Chat-Buy-React,JavaScript,1010,137,gpl-3.0,3,2017-11-21T08:45:37Z,535," Client for beginners to learn, built with React / Redux / Node",https://github.com/KieSun/Chat-Buy-React,https://api.github.com/repos/KieSun/Chat-Buy-React/languages
noisejs,JavaScript,1010,167,isc,9,2012-07-01T10:44:25Z,13,Javascript 2D Perlin & Simplex noise functions,https://github.com/josephg/noisejs,https://api.github.com/repos/josephg/noisejs/languages
ios-swift-collapsible-table-section,Swift,1010,133,mit,14,2016-05-30T17:05:54Z,5371,:iphone: A simple iOS Swift project demonstrates how to implement collapsible table section.,https://github.com/jeantimex/ios-swift-collapsible-table-section,https://api.github.com/repos/jeantimex/ios-swift-collapsible-table-section/languages
react-in-patterns-cn,JavaScript,1010,113,mit,0,2018-04-28T05:15:40Z,152014,React in patterns 中文版,https://github.com/SangKa/react-in-patterns-cn,https://api.github.com/repos/SangKa/react-in-patterns-cn/languages
MPlayerX,Objective-C,1010,272,,12,2011-01-07T01:35:45Z,294975,media player on Mac OS X,https://github.com/niltsh/MPlayerX,https://api.github.com/repos/niltsh/MPlayerX/languages
firebase-php,PHP,1010,226,mit,14,2015-01-07T23:07:53Z,1784,Unofficial Firebase Admin SDK for PHP,https://github.com/kreait/firebase-php,https://api.github.com/repos/kreait/firebase-php/languages
hybrid,TypeScript,1010,390,mit,59,2014-11-12T21:37:53Z,3725,"[I don't have time to work on this anymore. Use at your own risk] Build WordPress based PWA, iOS, Android & Windows phones apps in minutes!",https://github.com/wordpress-clients/hybrid,https://api.github.com/repos/wordpress-clients/hybrid/languages
awesome-mpvue,null,1010,131,,0,2018-03-13T16:11:05Z,52,A curated list of awesome things related to mpvue,https://github.com/mpvue/awesome-mpvue,https://api.github.com/repos/mpvue/awesome-mpvue/languages
statrethinking_winter2019,null,1010,167,,22,2018-10-24T07:28:55Z,5100,Statistical Rethinking course at MPI-EVA from Dec 2018 through Feb 2019,https://github.com/rmcelreath/statrethinking_winter2019,https://api.github.com/repos/rmcelreath/statrethinking_winter2019/languages
zap-desktop,JavaScript,1010,187,mit,110,2017-08-10T16:14:13Z,217308,Cross platform Lightning Network wallet focused on user experience and ease of use ⚡️,https://github.com/LN-Zap/zap-desktop,https://api.github.com/repos/LN-Zap/zap-desktop/languages
mantra,Shell,1010,60,,82,2016-01-01T09:54:15Z,259,Mantra - An Application Architecture for Meteor,https://github.com/kadirahq/mantra,https://api.github.com/repos/kadirahq/mantra/languages
laydate,JavaScript,1010,580,mit,59,2014-06-21T07:55:47Z,110,layDate（日期与时间组件） 是 layui 独立维护的三大组件之一,https://github.com/sentsin/laydate,https://api.github.com/repos/sentsin/laydate/languages
ngSemantic,TypeScript,1010,171,mit,98,2015-09-27T17:23:04Z,7968,Angular 2 building blocks :package: based on Semantic UI,https://github.com/vladotesanovic/ngSemantic,https://api.github.com/repos/vladotesanovic/ngSemantic/languages
arc-icon-theme,Shell,1010,91,gpl-3.0,40,2016-06-05T13:34:57Z,4838,null,https://github.com/horst3180/arc-icon-theme,https://api.github.com/repos/horst3180/arc-icon-theme/languages
universe-starter-agent,Python,1010,298,mit,0,2016-11-17T21:47:52Z,2452,A starter agent that can solve a number of universe environments.,https://github.com/openai/universe-starter-agent,https://api.github.com/repos/openai/universe-starter-agent/languages
MMPlaceHolder,Objective-C,1010,146,mit,1,2014-08-11T03:19:11Z,3014,A drop in solution to show UIView's size. Only one line code to use it.,https://github.com/adad184/MMPlaceHolder,https://api.github.com/repos/adad184/MMPlaceHolder/languages
Edit-This-Cookie,JavaScript,1010,326,other,113,2012-07-15T08:52:18Z,3433,EditThisCookie is the famous Google Chrome/Chromium extension for editing cookies ,https://github.com/ETCExtensions/Edit-This-Cookie,https://api.github.com/repos/ETCExtensions/Edit-This-Cookie/languages
Hermes,Java,1010,165,other,6,2016-04-26T12:25:35Z,323,"A smart, novel and easy-to-use framework for Android Inter-Process Communication (IPC). （简单易用的安卓进程间通信IPC框架）",https://github.com/Xiaofei-it/Hermes,https://api.github.com/repos/Xiaofei-it/Hermes/languages
handtracking,Python,1010,296,apache-2.0,9,2017-11-26T05:47:39Z,161267,Building a Real-time Hand-Detector using Neural Networks (SSD) on Tensorflow,https://github.com/victordibia/handtracking,https://api.github.com/repos/victordibia/handtracking/languages
ActivitySwitcher,Java,1010,132,,4,2016-10-11T05:55:08Z,3952,"ActivitySwitcher is based on the Activity view operation management library, you can achieve any jump between Activity, close any Activity and end applications and other functions.",https://github.com/Hitomis/ActivitySwitcher,https://api.github.com/repos/Hitomis/ActivitySwitcher/languages
deep3d,Jupyter Notebook,1010,210,,31,2016-04-02T06:24:26Z,3198,Automatic 2D-to-3D Video Conversion with CNNs,https://github.com/piiswrong/deep3d,https://api.github.com/repos/piiswrong/deep3d/languages
MMLayershots,Objective-C,1010,67,mit,9,2014-05-18T13:07:46Z,163,Layershots converts your iOS screenshot into a layered photoshop (PSD) file.,https://github.com/vpdn/MMLayershots,https://api.github.com/repos/vpdn/MMLayershots/languages
django-jsonfield,Python,1010,237,mit,50,2009-05-03T03:42:01Z,135,A reusable JSONField model for Django to store ad-hoc data,https://github.com/dmkoch/django-jsonfield,https://api.github.com/repos/dmkoch/django-jsonfield/languages
Metascala,Scala,1010,93,,0,2013-03-03T03:59:32Z,2032,A JVM written in Scala,https://github.com/lihaoyi/Metascala,https://api.github.com/repos/lihaoyi/Metascala/languages
loklak_webclient,JavaScript,1010,50,mit,5,2015-04-15T17:34:16Z,4466,loklak web application,https://github.com/fossasia/loklak_webclient,https://api.github.com/repos/fossasia/loklak_webclient/languages
async-rl,Python,1009,182,mit,23,2016-04-14T02:05:24Z,1096,"Tensorflow + Keras + OpenAI Gym implementation of 1-step Q Learning from  ""Asynchronous Methods for Deep Reinforcement Learning""",https://github.com/coreylynch/async-rl,https://api.github.com/repos/coreylynch/async-rl/languages
OverlayScrollbars,JavaScript,1009,65,mit,11,2017-09-11T11:58:44Z,2407,"A javascript scrollbar plugin which hides native scrollbars, provides custom styleable overlay scrollbars and keeps the native functionality and feeling.",https://github.com/KingSora/OverlayScrollbars,https://api.github.com/repos/KingSora/OverlayScrollbars/languages
speakingurl,JavaScript,1009,84,bsd-3-clause,19,2013-05-21T12:29:41Z,1261,Generate a slug – transliteration with a lot of options,https://github.com/pid/speakingurl,https://api.github.com/repos/pid/speakingurl/languages
scantailor,C++,1009,204,other,219,2014-04-06T17:32:27Z,6530,null,https://github.com/scantailor/scantailor,https://api.github.com/repos/scantailor/scantailor/languages
memoizee,JavaScript,1009,46,isc,15,2012-08-06T09:39:01Z,399,Complete memoize/cache solution for JavaScript,https://github.com/medikoo/memoizee,https://api.github.com/repos/medikoo/memoizee/languages
elm-css,Elm,1009,158,bsd-3-clause,64,2015-09-20T16:52:06Z,7790,Typed CSS in Elm.,https://github.com/rtfeldman/elm-css,https://api.github.com/repos/rtfeldman/elm-css/languages
spectacle,HTML,1009,213,other,26,2016-01-12T10:36:11Z,1902,Beautiful static documentation generator for OpenAPI/Swagger 2.0,https://github.com/sourcey/spectacle,https://api.github.com/repos/sourcey/spectacle/languages
astyanax,Java,1009,372,apache-2.0,160,2011-07-13T20:24:30Z,6990,Cassandra Java Client,https://github.com/Netflix/astyanax,https://api.github.com/repos/Netflix/astyanax/languages
jest-styled-components,JavaScript,1009,92,mit,51,2017-03-18T11:22:41Z,1223,🔧 💅 Jest utilities for Styled Components,https://github.com/styled-components/jest-styled-components,https://api.github.com/repos/styled-components/jest-styled-components/languages
django-tenant-schemas,Python,1009,311,mit,123,2012-06-23T10:54:34Z,613,Tenant support for Django using PostgreSQL schemas.,https://github.com/bernardopires/django-tenant-schemas,https://api.github.com/repos/bernardopires/django-tenant-schemas/languages
p6spy,Java,1009,207,apache-2.0,8,2010-12-28T21:35:51Z,59450,P6Spy is a framework that enables database data to be seamlessly intercepted and logged with no code changes to the application.,https://github.com/p6spy/p6spy,https://api.github.com/repos/p6spy/p6spy/languages
jbpm,Java,1009,992,apache-2.0,11,2010-09-22T13:19:52Z,330319,a Business Process Management (BPM) Suite,https://github.com/kiegroup/jbpm,https://api.github.com/repos/kiegroup/jbpm/languages
awesome-http-benchmark,null,1009,70,mit,0,2017-02-24T04:31:42Z,24,"HTTP(S) benchmark tools, testing/debugging, & restAPI (RESTful)",https://github.com/denji/awesome-http-benchmark,https://api.github.com/repos/denji/awesome-http-benchmark/languages
awesome-gan-for-medical-imaging,null,1009,261,,0,2017-08-23T20:38:25Z,96,Awesome GAN for Medical Imaging,https://github.com/xinario/awesome-gan-for-medical-imaging,https://api.github.com/repos/xinario/awesome-gan-for-medical-imaging/languages
jitsi-videobridge,Java,1009,420,apache-2.0,107,2013-04-24T21:21:59Z,165400,"Jitsi Videobridge is a WebRTC compatible video router or SFU that lets build highly scalable video conferencing infrastructure (i.e., up to hundreds of conferences per server).",https://github.com/jitsi/jitsi-videobridge,https://api.github.com/repos/jitsi/jitsi-videobridge/languages
JASON,Swift,1009,71,mit,7,2015-06-27T12:19:50Z,902,Fast JSON parsing for Swift,https://github.com/delba/JASON,https://api.github.com/repos/delba/JASON/languages
